,crawl_date,domain,url,mime_type_web_server,mime_type_tika,language,content
6624,20200417,apple.com,https://www.apple.com/mac/?cid=OAS-US-DOMAINS-mac.com,text/html,application/xhtml+xml,en,"Mac - Apple Global Nav Open Menu Global Nav Close Menu Apple Shopping Bag + Search apple.com Cancel Apple Mac iPad iPhone Watch TV Music Support Shopping Bag + Cancel MacBook Air New MacBook Pro 13” MacBook Pro 16” iMac iMac Pro Mac Pro New Mac mini New CompareMac models Pro Display XDR New Accessoriesfor Mac Catalina Mac Evaluate COVID‑19 symptoms and understand next steps. Get started now New MacBook Air Light. Speed. Starting at $999 Buy Learn more Which Mac notebook is right for you? MacBook Air Starting at $999 13.3-inch Retina display1 Up to 4-core Intel Core i7 processor Up to 16GB memory Up to 2TB storage2 Up to 11 hours battery life3 Touch ID Backlit Magic Keyboard Buy Learn more MacBook Pro 13” Starting at $1299 13.3-inch Retina display1 Up to 4-core Intel Core i7 processor Up to 16GB memory Up to 2TB storage2 Up to 10 hours battery life3 Touch Bar and Touch ID Backlit keyboard Buy Learn more MacBook Pro 16” Starting at $2399 16-inch Retina display1 Up to 8-core Intel Core i9 processor Up to 64GB memory Up to 8TB storage2 Up to 11 hours battery life3 Touch Bar and Touch ID Backlit Magic Keyboard Buy Learn more Compare all Mac models Accessories Explore MacBook Pro accessories. Shop Apple Trade In Get up to $2470 for your current computer.* Just trade in your eligible computer for credit or recycle it for free. It’s good for you and the planet. Find your trade‑in value Fast, free delivery And free returns. See checkout for delivery dates. Learn more about free delivery Find the card for you Get 3% Daily Cash with Apple Card or get special financing. Learn more about Financing What makes a Mac a Mac? macOS Catalina The power of Mac. Taken further. Dedicated apps for music, TV, and podcasts. Smart new features like Sidecar, powerful technologies for developers, and your favorite iPad apps, now on Mac. Learn more Update now macOS macOS is the operating system that powers every Mac. It lets you do things you simply can’t with other computers. That’s because it’s designed specifically for the hardware it runs on — and vice versa. Learn moreabout macOS iCloud iCloud safely and securely stores your photos, videos, documents, messages, music, apps, and more — and keeps them updated across all your devices. So you always have access to what you want, wherever you want it. Learn moreabout iCloud Built-in Apps Powerful creativity and productivity tools live inside every Mac — apps that help you explore, connect, and work more efficiently. Photos iMovie GarageBand Pages Numbers Keynote Safari Photos iMovie GarageBand Pages Numbers Keynote Safari Photos Keep your growing library organized and accessible. Perfect your images and create beautiful gifts for sharing. And with iCloud Photos, you can store a lifetime’s worth of photos and videos in the cloud. Learn more about Photos iMovie Tell stories like never before. A simple design and intuitive editing features make it easy to create beautiful 4K movies and Hollywood-style trailers. Learn more about iMovie GarageBand The easiest way to create great-sounding songs on your Mac. With an intuitive interface and access to a complete sound library, it’s never been easier to learn, play, record, and share music like a pro. Learn more about GarageBand Pages This powerful word processor gives you everything you need to create documents that look beautiful. And read beautifully. It lets you work seamlessly between Mac, iOS, and iPadOS devices. And work effortlessly with people who use Microsoft Word. Learn more about Pages Numbers Create sophisticated spreadsheets with dramatic interactive charts, tables, and images that paint a revealing picture of your data. Work seamlessly between Mac, iOS, and iPadOS devices. And work effortlessly with people who use Microsoft Excel. Learn more about Numbers Keynote Bring your ideas to life with beautiful presentations. Employ powerful tools and dazzling effects that keep your audience engaged. Work seamlessly between Mac, iOS, and iPadOS devices. And work effortlessly with people who use Microsoft PowerPoint. Learn more about Keynote Safari Safari has innovative features that let you enjoy more of the web. In even more ways. Built-in privacy features help protect your information and keep your Mac secure. An updated start page helps you easily and quickly save, find, and share your favorite sites. And Siri suggestions surface bookmarks, links from your reading list, iCloud Tabs, links you receive in Messages, and more. Learn more about Safari Pro Apps For professionals ready to push their creativity, these industry-leading apps offer maximum control over editing, processing, and output of music and film. Logic Pro X MainStage 3 Final Cut Pro X Motion Compressor Logic Pro X MainStage 3 Final Cut Pro X Motion Compressor Logic Pro X Logic Pro puts a complete recording and MIDI production studio on your Mac, with everything you need to write, record, edit, and mix like never before. And with a huge collection of full-featured plug-ins along with thousands of sounds and loops, you’ll have everything you need to go from first inspiration to final master, no matter what kind of music you want to create. Learn more about Logic Pro X MainStage 3 Take your Mac to the stage with a full-screen interface optimized for live performance, flexible hardware control, and a massive collection of plug-ins and sounds that are fully compatible with Logic Pro X. Learn more about MainStage 3 Final Cut Pro X Built to meet the needs of today’s creative editors, Final Cut Pro offers revolutionary video editing, powerful media organization, and incredible performance optimized for Mac computers and macOS Catalina. Learn more about Final Cut Pro X Motion Motion is a powerful motion graphics tool that makes it easy to create cinematic 2D and 3D titles, fluid transitions, and realistic effects in real time. Learn more about Motion Compressor Add power and flexibility for exporting projects from Final Cut Pro. Customize output settings, work faster with distributed encoding, and easily package your film for the iTunes Store. Learn more about Compressor The Mac App Store features rich editorial content and great apps for Mac. Explore the Mac App Store Get more out of Mac Apple TV Plus Lights. Camera. Mac. Every new Mac comes with one year of Apple TV+.4 Watch now on the Apple TV app Apple Card is here Get 3% Daily Cash on purchases from Apple using Apple Card. Learn moreabout Apple Card Apple Arcade A new world to play in. 100+ ad‑free games. Try it free5 Learn moreabout Apple Arcade Apple News Plus Hundreds of magazines and leading newspapers. One subscription. Try Apple News+ free6 Learn moreabout Apple News Plus Mac for Education Power to make big things happen in the classroom. Learn about Mac in education Learn about special pricing for institutions Mac for Higher Education Ready for everything college has to offer. Learn about Mac in higher education Shop with Apple Education Pricing Mac for Business Get the power to take your business to the next level. Learn about Mac in business Shop for your business Update to the latest version of iOS or macOS to start your Apple News+ free trial. Get the latest iOS Get the latest macOS Upgrade to start your free trial. Get the latest iOS Get the latest iPadOS Get the latest tvOS Get the latest macOS Apple Footer * Trade-in value based on 2018 15-inch MacBook Pro. Trade-in value will vary based on the condition, year, and configuration of your trade-in device. You must be at least 18 years old to be eligible to trade in for credit or for an Apple Store Gift Card. Not all devices are eligible for credit. More details are available from Apple’s Mac trade‑in partner and Apple’s iPhone, iPad, and Apple Watch trade‑in partner for trade-in and recycling of eligible devices. Restrictions and limitations may apply. Payments are based on the received device matching the description you provided when your estimate was made. Apple reserves the right to refuse or limit the quantity of any device for any reason. In the Apple Store: Offer only available on presentation of a valid, government-issued photo ID (local law may require saving this information). Value of your current device may be applied toward purchase of a new Apple device. Offer may not be available in all stores. Some stores may have additional requirements. Screen size is measured diagonally. 1TB = 1 trillion bytes; actual formatted capacity less. Battery life varies by use and configuration; see apple.com/batteries for more information. $4.99/month after free trial. One subscription per Family Sharing group. Offer good for 3 months after eligible device activation. Plan automatically renews until cancelled. Restrictions and other terms apply. $4.99/month after free trial. No commitment. Plan automatically renews after trial until cancelled. New subscribers only. $9.99/month after free trial. No commitment. Plan automatically renews after trial until cancelled. The COVID‑19 site and app were developed in partnership with CDC. They are not meant as an endorsement of any Apple products.  Apple Mac Shop and Learn Open Menu Close Menu Mac iPad iPhone Watch TV Music AirPods HomePod iPod touch Accessories Gift Cards Services Open Menu Close Menu Apple Music Apple News+ Apple TV+ Apple Arcade Apple Card iCloud Account Open Menu Close Menu Manage Your Apple ID Apple Store Account iCloud.com Apple Store Open Menu Close Menu Find a Store Genius Bar Today at Apple Apple Camp Field Trip Apple Store App Refurbished and Clearance Financing Apple Trade In Order Status Shopping Help For Business Open Menu Close Menu Apple and Business Shop for Business For Education Open Menu Close Menu Apple and Education Shop for K-12 Shop for College For Healthcare Open Menu Close Menu Apple in Healthcare Health on Apple Watch Health Records on iPhone For Government Open Menu Close Menu Shop for Government Shop for Veterans and Military Apple Values Open Menu Close Menu Accessibility Education Environment Inclusion and Diversity Privacy Supplier Responsibility About Apple Open Menu Close Menu Newsroom Apple Leadership Job Opportunities Investors Events Contact Apple More ways to shop: Find an Apple Store or other retailer near you. Or call 1-800-MY-APPLE. United States Copyright © 2020 Apple Inc. All rights reserved. Privacy Policy Terms of Use Sales and Refunds Legal Site Map"
6635,20200417,apple.com,https://www.apple.com/icloud/,text/html,application/xhtml+xml,en,"iCloud - Apple Global Nav Open Menu Global Nav Close Menu Apple Shopping Bag + Search apple.com Cancel Apple Mac iPad iPhone Watch TV Music Support Shopping Bag + Cancel iCloud The best place for all your photos, files, and more. iCloud is built into every Apple device. That means all your stuff — photos, files, notes, and more — is safe, up to date, and available wherever you are. And it works automatically, so all you have to do is keep doing what you love. Everyone gets 5GB of free iCloud storage to start, and it’s easy to add more at any time. iCloud Photos All your photos and videos. Always available. A lifetime of photos on all your devices. With iCloud Photos, you can browse, search, and share all the photos and videos from any of your devices, whether they were taken yesterday or years ago. Take all the photos you want. Without worrying about space on your devices. To save space on your devices, the original, full‑resolution photos you take are automatically uploaded to iCloud. You’ll still always have a lightweight version of every photo on your device, and you can download the originals whenever you need them. The easiest way to share photos with friends and family. Shared Albums lets you create albums for trips, events, or whatever you want. Simply choose the friends and family members who can see, comment, and add their own photos and videos. iCloud Drive Any type of file. All in one place. All your files available from all your devices. The files you keep safe in iCloud Drive are easy to get to, no matter which device you’re using. You can access all your files from the Files app on iOS and iPadOS, the Finder on your Mac, File Explorer for Windows PCs, or iCloud.com. Organize files however you want. Get to them on any device you want. iCloud Drive lets you organize your files with folders, rename them, and tag them with colors. And when you make a change, the update is made across all your devices. You can even have everything in your Mac Desktop and Documents folders automatically available in iCloud Drive. Share folders and files with ease. iCloud Drive makes it fast and easy to work with others from anywhere. Just send a private link and they’ll get instant access to the folders and files you’ve chosen to share. You control whether they can view, share, or edit each file, and you can change these settings at any time. And anyone can participate since it works across iPhone, iPad, Mac, Windows PCs, and the web. Apps using iCloud Your favorite apps are even better with iCloud. All your essentials. Accessible from all your devices. iCloud automatically keeps apps — including Mail, Calendar, Contacts, Reminders, Safari, and some of your favorite apps from the App Store — updated across all your devices. So when you add a new phone number, bookmark a website, or update a slide in a presentation, the change appears everywhere. Collaborate with Pages, Numbers, Keynote, and Notes. Work with others on documents, presentations, and spreadsheets and see edits as they’re made. With live updates on all your devices, your collaborators will always be on the same page. Every message. Updated across all your devices. iCloud automatically stores all of your messages. Search for an address, a funny exchange, or anything else. And you can pick up every conversation right where you left off. Even when you move to a new phone or computer. iCloud Backup and Restore All the things that matter. Safe and secure. Automatic backups give you peace of mind. iCloud automatically backs up your iOS and iPadOS devices when they’re connected to power and Wi-Fi. So if you lose your device or get a new one, you’ll have all the things that matter without missing a beat.1 Move to a new device with everything you loved about your old one. iCloud makes moving your settings, photos, apps, and documents to a new device seamless. Just sign in to iCloud when you set up your new device, and you’ll be ready to go in minutes. Two‑factor authentication helps keep your data safe. Two‑factor authentication is an extra layer of security designed to ensure that only you can access your account. That means your account can only be accessed on devices you trust, like your iPhone, iPad, or Mac. Learn more about two‑factor authentication Find the storage plan that’s right for you. The right amount of storage depends on how you and your family members want to use your devices. Everyone gets 5GB of free iCloud storage to get started and it’s easy to upgrade at any time. Your apps and any iTunes or Apple TV purchases don’t count toward your iCloud storage space, so you need it just for things like photos, videos, files, and device backups. Learn more about iCloud storage Capacity Description Price Included 5GB Good for safely storing all the basics, like contacts, calendars, and notes. Free Most Popular 50GB Recommended for storing your photos, videos, files, and apps and backing up your device. $0.99/month Lots of Photos 200GB Good for families or one person with lots of photos and videos. $2.99/month Great for Families 2TB A lifetime of photos, videos, and everything else for you and up to five family members. Ideal for families to share. $9.99/month Family Sharing Family Sharing makes it easy for you and up to five family members to share iTunes, Apple Books, and App Store purchases, an Apple Music family plan, an iCloud storage plan, and more.2 Learn more about Family Sharing Designed with your privacy in mind. Apple takes the security of your data and the privacy of your personal information very seriously. Because of that, iCloud features are designed to keep your information safe, secure, and available only to you. Learn more about Privacy Apple Footer Backup of purchased music is not available in all countries or regions. Previous purchases may not be restored if they are no longer on the iTunes Store, App Store, or Apple Books. Family Sharing requires a personal Apple ID signed in to iCloud and iTunes. Music, movies, TV shows, and books can be downloaded on up to 10 devices per account, five of which can be computers. iOS 8 or later and OS X Yosemite or later are required to set up or join a Family Sharing group and are recommended for full functionality. Not all content is eligible for Family Sharing. Content can be hidden by family members; hidden content is not available for download. Content downloaded from family members or acquired via redemption codes is not subject to Ask to Buy. iCloud requires iOS 5 or later on iPhone 3GS or later, iPod touch (3rd generation or later), iPad Pro, iPad or later, iPad Air or later, or iPad mini or later; a Mac computer with OS X Lion 10.7.5 or later; or a PC with Windows 7 or Windows 8 (Outlook 2007 or later or an up-to-date browser is required for accessing email, contacts, and calendars). Some features require iOS 13 or iPadOS and macOS Catalina. Some features require a Wi-Fi connection. Some features are not available in all countries or regions. Access to some services is limited to 10 devices.  Apple iCloud Shop and Learn Open Menu Close Menu Mac iPad iPhone Watch TV Music AirPods HomePod iPod touch Accessories Gift Cards Services Open Menu Close Menu Apple Music Apple News+ Apple TV+ Apple Arcade Apple Card iCloud Account Open Menu Close Menu Manage Your Apple ID Apple Store Account iCloud.com Apple Store Open Menu Close Menu Find a Store Genius Bar Today at Apple Apple Camp Field Trip Apple Store App Refurbished and Clearance Financing Apple Trade In Order Status Shopping Help For Business Open Menu Close Menu Apple and Business Shop for Business For Education Open Menu Close Menu Apple and Education Shop for K-12 Shop for College For Healthcare Open Menu Close Menu Apple in Healthcare Health on Apple Watch Health Records on iPhone For Government Open Menu Close Menu Shop for Government Shop for Veterans and Military Apple Values Open Menu Close Menu Accessibility Education Environment Inclusion and Diversity Privacy Supplier Responsibility About Apple Open Menu Close Menu Newsroom Apple Leadership Job Opportunities Investors Events Contact Apple More ways to shop: Find an Apple Store or other retailer near you. Or call 1-800-MY-APPLE. United States Copyright © 2020 Apple Inc. All rights reserved. Privacy Policy Terms of Use Sales and Refunds Legal Site Map"
