,crawl_date,domain,url,mime_type_web_server,mime_type_tika,language,content
122071,20200703,ca.reuters.com,https://ca.reuters.com/article/topNews/idCAKBN244003,text/html,text/html,en,"Global Markets: COVID recovery vs COVID reality - Reuters Discover Thomson Reuters FinancialGovernment SolutionsLegalReuters News AgencyRisk Management SolutionsTax & AccountingBlog: Answers OnInnovation @ Thomson Reuters Directory of sites Login Contact Support Top News Business Canada Markets Sports More Canada Business News July 3, 2020 / 12:07 AM / in 7 hours Global Markets: COVID recovery vs COVID reality Marc Jones 5 Min Read LONDON (Reuters) - World shares stalled near a four-month high on Friday and the industrial bellwether metal copper scuffed its longest weekly winning streak in nearly three years, as nagging coronavirus nerves tempered the recent recovery run. FILE PHOTO: A street cleaning operative walks past the London Stock Exchange Group building in the City of London financial district, whilst British stocks tumble as investors fear that the coronavirus outbreak could stall the global economy, in London, Britain, March 9, 2020. REUTERS/Toby Melville/File Photo The market rally, fuelled by Thursday’s record U.S. jobs numbers, largely blew itself out after a record daily total of new U.S. COVID-19 cases, though news of the fastest expansion in China’s services sector in over a decade kept Asia’s tail up early in the day. Chinese shares had charged to their highest level in five years [.SS], helping the pan-Asian indexes to four-month peaks, so the sight of European markets stalling left traders floundering, especially with no Wall Street to pick things up again because of a U.S. market holiday. [.EU] Currency and commodity markets were also subdued after an otherwise strong week for confidence-sensitive stalwarts such oil, copper, sterling and the Australian dollar, which all struggled on Friday. More than three dozen U.S. states are now seeing increases in COVID-19 cases, including Florida, where they have leapt above 10,000 a day. And while Europe is largely easing restrictions, some places are having to keep them or reimpose them again. “I think infection rates and fears of localised lockdowns have doused some of the enthusiasm,” said Societe Generale strategist Kit Jukes. “We have three elements now; vaccine hopes, decent data in most places - but also the return of infection rates, which can make you nervous.” London, Paris and Frankfurt’s stock markets were down 1.2%, 0.4% and 0.8% respectively as trading began to wind down, although all were up for the week. The euro and pound were also fractionally lower, though it was barely noticeable thanks to the dollar’s second dip of the week. The euro was at $1.1226 and though it gained against the safe Swiss franc it fell versus the red-hot Norwegian crown, which has been on the rise for months, in tandem with most petrocurrencies. S&P 500 futures were down 0.2% but volumes were low due to the U.S. market holiday for Independence Day. The previous day’s U.S. non-farm payrolls had shown a well-above-forecast 4.8 million surge in jobs in June. It came largely thanks to rises in the hard-hit hospitality sectors, though economists did note some caveats. The number of permanent job losses continued to rise, increasing by 588,000 to 2.9 million, while the unemployment rate remains a chunky 7.6 percentage points above its February level. A Deutsche Bank analysis put the U.S. unemployment rate behind all its developed market peers, barring Canada. WILL THE BEARS BITE BACK? The recovery faces headwinds as the surge of new coronavirus infections prompts U.S. states to delay and in some cases reverse plans to let stores and restaurants reopen and activities resume. BofA said in a report on Friday that $7.1 billion had been was pulled out of equity funds over the last week, and its closely-followed ‘Bull & Bear’ indicator was out of “buy” territory for the first time since March 17. Nevertheless, investors seem to have been largely overlooking the various virus spikes for now at least, and taking the view that things are still improving globally. A market fear gauge, the VIX volatility index, has seen its biggest drop in two months and German government bond yields were set for their biggest weekly rise in a month, though they nudged down on Friday to -0.44%. Riskier Italian yields fell to 1.26% as well though, which is their lowest since late March, at the peak of Europe’s coronavirus lockdown. [GVD/EUR] Oil prices also eased after an otherwise solid week. Brent crude fell 0.65% to $42.86 a barrel while U.S. crude dropped 0.66% to $40.38 a barrel. Both were around $25 this time two months ago. Copper prices were poised for a seventh consecutive weekly gain, their longest winning streak in nearly three years, though it too was slightly down on the day at $6,040 a tonne, more than $1,500 up from lows it plumbed in March. [/MET/L] “The one issue that hangs over all the markets is ‘Will we see a surge in secondary infections that will trigger a second wave of national rather than regional shutdowns?’,” Malcolm Freeman, director of Kingdom Futures, wrote in a note. Graphic: China recovery - here Graphic: COVID-19 in U.S. - here Reporting by Marc Jones; Editing by Kevin Liffey 0 : 0 narrow-browser-and-phone medium-browser-and-portrait-tablet landscape-tablet medium-wide-browser wide-browser-and-larger medium-browser-and-landscape-tablet medium-wide-browser-and-larger above-phone portrait-tablet-and-above above-portrait-tablet landscape-tablet-and-above landscape-tablet-and-medium-wide-browser portrait-tablet-and-below landscape-tablet-and-below Disclaimer Privacy Reuters Plus Do Not Sell My Personal Information All quotes delayed a minimum of 15 minutes. See here for a complete list of exchanges and delays. © 2020 Reuters. All Rights Reserved."
132286,20200710,ca.reuters.com,https://ca.reuters.com/article/topNews/idCAKBN244003,text/html,text/html,en,"Global Markets: COVID recovery vs COVID reality - Reuters Discover Thomson Reuters FinancialGovernment SolutionsLegalReuters News AgencyRisk Management SolutionsTax & AccountingBlog: Answers OnInnovation @ Thomson Reuters Directory of sites Login Contact Support Top News Business Canada Markets Sports More Canada Business News July 3, 2020 / 12:07 AM / 7 days ago Global Markets: COVID recovery vs COVID reality Marc Jones 5 Min Read LONDON (Reuters) - World shares stalled near a four-month high on Friday and the industrial bellwether metal copper scuffed its longest weekly winning streak in nearly three years, as nagging coronavirus nerves tempered the recent recovery run. FILE PHOTO: A street cleaning operative walks past the London Stock Exchange Group building in the City of London financial district, whilst British stocks tumble as investors fear that the coronavirus outbreak could stall the global economy, in London, Britain, March 9, 2020. REUTERS/Toby Melville/File Photo The market rally, fuelled by Thursday’s record U.S. jobs numbers, largely blew itself out after a record daily total of new U.S. COVID-19 cases, though news of the fastest expansion in China’s services sector in over a decade kept Asia’s tail up early in the day. Chinese shares had charged to their highest level in five years [.SS], helping the pan-Asian indexes to four-month peaks, so the sight of European markets stalling left traders floundering, especially with no Wall Street to pick things up again because of a U.S. market holiday. [.EU] Currency and commodity markets were also subdued after an otherwise strong week for confidence-sensitive stalwarts such oil, copper, sterling and the Australian dollar, which all struggled on Friday. More than three dozen U.S. states are now seeing increases in COVID-19 cases, including Florida, where they have leapt above 10,000 a day. And while Europe is largely easing restrictions, some places are having to keep them or reimpose them again. “I think infection rates and fears of localised lockdowns have doused some of the enthusiasm,” said Societe Generale strategist Kit Jukes. “We have three elements now; vaccine hopes, decent data in most places - but also the return of infection rates, which can make you nervous.” London, Paris and Frankfurt’s stock markets were down 1.2%, 0.4% and 0.8% respectively as trading began to wind down, although all were up for the week. The euro and pound were also fractionally lower, though it was barely noticeable thanks to the dollar’s second dip of the week. The euro was at $1.1226 and though it gained against the safe Swiss franc it fell versus the red-hot Norwegian crown, which has been on the rise for months, in tandem with most petrocurrencies. S&P 500 futures were down 0.2% but volumes were low due to the U.S. market holiday for Independence Day. The previous day’s U.S. non-farm payrolls had shown a well-above-forecast 4.8 million surge in jobs in June. It came largely thanks to rises in the hard-hit hospitality sectors, though economists did note some caveats. The number of permanent job losses continued to rise, increasing by 588,000 to 2.9 million, while the unemployment rate remains a chunky 7.6 percentage points above its February level. A Deutsche Bank analysis put the U.S. unemployment rate behind all its developed market peers, barring Canada. WILL THE BEARS BITE BACK? The recovery faces headwinds as the surge of new coronavirus infections prompts U.S. states to delay and in some cases reverse plans to let stores and restaurants reopen and activities resume. BofA said in a report on Friday that $7.1 billion had been was pulled out of equity funds over the last week, and its closely-followed ‘Bull & Bear’ indicator was out of “buy” territory for the first time since March 17. Nevertheless, investors seem to have been largely overlooking the various virus spikes for now at least, and taking the view that things are still improving globally. A market fear gauge, the VIX volatility index, has seen its biggest drop in two months and German government bond yields were set for their biggest weekly rise in a month, though they nudged down on Friday to -0.44%. Riskier Italian yields fell to 1.26% as well though, which is their lowest since late March, at the peak of Europe’s coronavirus lockdown. [GVD/EUR] Oil prices also eased after an otherwise solid week. Brent crude fell 0.65% to $42.86 a barrel while U.S. crude dropped 0.66% to $40.38 a barrel. Both were around $25 this time two months ago. Copper prices were poised for a seventh consecutive weekly gain, their longest winning streak in nearly three years, though it too was slightly down on the day at $6,040 a tonne, more than $1,500 up from lows it plumbed in March. [/MET/L] “The one issue that hangs over all the markets is ‘Will we see a surge in secondary infections that will trigger a second wave of national rather than regional shutdowns?’,” Malcolm Freeman, director of Kingdom Futures, wrote in a note. Graphic: China recovery - here Graphic: COVID-19 in U.S. - here Reporting by Marc Jones; Editing by Kevin Liffey 0 : 0 narrow-browser-and-phone medium-browser-and-portrait-tablet landscape-tablet medium-wide-browser wide-browser-and-larger medium-browser-and-landscape-tablet medium-wide-browser-and-larger above-phone portrait-tablet-and-above above-portrait-tablet landscape-tablet-and-above landscape-tablet-and-medium-wide-browser portrait-tablet-and-below landscape-tablet-and-below Disclaimer Privacy Reuters Plus Do Not Sell My Personal Information All quotes delayed a minimum of 15 minutes. See here for a complete list of exchanges and delays. © 2020 Reuters. All Rights Reserved."
223168,20200904,ca.reuters.com,https://ca.reuters.com/article/domesticNews/idCAKBN25S5Q8,text/html,text/html,en,"In Canada, airlines face uphill climb to replace quarantines with COVID-19 testing | Reuters Discover Thomson Reuters Directory of sitesLoginContactSupport for-phone-onlyfor-tablet-portrait-upfor-tablet-landscape-upfor-desktop-upfor-wide-desktop-up Domestic News Updated In Canada, airlines face uphill climb to replace quarantines with COVID-19 testing By Allison Lampert, Allison Martell 3 Min Read MONTREAL/TORONTO (Reuters) - Transport Canada is holding early talks with airlines to introduce COVID-19 testing at airports, but the day when such tests could become an alternative to the quarantines decimating travel could still be far off, sources familiar with the discussions said. FILE PHOTO: WestJet airline signage is pictured at Vancouver's international airport in Richmond, British Columbia, Canada, February 5, 2019. REUTERS/Ben Nelms/File Photo The airline-led talks come as Air Canada and WestJet introduce their own testing plans for Toronto and Vancouver airports, respectively this fall. The use of airport testing to reduce or eliminate Canada’s strict two-week self quarantine rule would be logistically challenging as it would require cooperation from airports, airlines, federal and provincial health authorities, the sources said. And government-approved lab tests that largely take 24 to 48 hours to deliver results would need to be used, making them impractical for airport departures, they added. Canada has faced pressure from airlines to change its travel restrictions, with the country’s borders now closed to all noncitizens except for essential workers. “The airlines have a vested interest in seeing this happen,” one of the source said. “But there is no guarantee that Canada would choose to lift the 14-day quarantine even if testing were able to take place at airports.” Globally, carriers and airports largely back testing to replace quarantines, with a U.N. aviation task force expected to weigh in on one industry proposal at a Sept. 15 meeting, airline group IATA said. IATA and Airports Council International (ACI) support the use of PCR (polymerase chain reaction) tests 48 hours ahead of departure from high-risk countries, since rapid tests are not seen as reliable or widely accepted by regulators. Health Canada has changed its position on home tests and is now willing to consider approving rapid home COVID-19 tests. Last week U.S. regulators approved a rapid test from Abbott Laboratories but it is currently approved only for people who have symptoms. WestJet and Vancouver International Airport have not yet finalized joint plans announced last week to test some departing passengers. Tamara Vrooman, chief executive of the Vancouver airport, said one possibility was for the facility to be certified as a lab, but “we’re still examining that.” Air Canada declined comment. Canada’s Chief Public Health Officer Theresa Tam said on Friday her agency was looking at “options going forward and reducing the more restrictive measures at the border.” Health officials are also considering the timing of the test, since travelers coming to Canada might have a negative result if they were infected only one or two days prior. Transport Canada said it is committed to “working with other federal partners to explore COVID testing at airports upon arrival.” Reporting By Allison Lampert in Montreal and Allison Martell in Toronto; Editing by Bill Berkrot and Tom Brown Our Standards: The Thomson Reuters Trust Principles. Apps Newsletters Advertise with Us Advertising Guidelines Cookies Terms of Use Privacy Do Not Sell My Personal Information All quotes delayed a minimum of 15 minutes. See here for a complete list of exchanges and delays.© 2020 Reuters. All Rights Reserved. for-phone-onlyfor-tablet-portrait-upfor-tablet-landscape-upfor-desktop-upfor-wide-desktop-up"
237034,20200911,ca.reuters.com,https://ca.reuters.com/article/topNews/idCAKBN25Z2XM,text/html,text/html,en,"British Columbia imposes fresh curbs on nightclubs as COVID-19 cases spike | Reuters Discover Thomson Reuters Directory of sitesLoginContactSupport for-phone-onlyfor-tablet-portrait-upfor-tablet-landscape-upfor-desktop-upfor-wide-desktop-up Domestic News Updated British Columbia imposes fresh curbs on nightclubs as COVID-19 cases spike By David Ljunggren 3 Min Read OTTAWA (Reuters) - British Columbia on Tuesday ordered the closure of all nightclubs and Ontario delayed an easing of remaining restrictions imposed to fight the coronavirus pandemic, as Canada reported a spike in new COVID-19 cases. Slideshow ( 5 images ) The rise comes as schools across the country started to reopen after a nearly five-month forced shutdown to contain the spread of the virus, which has killed 9,153 people, according to latest government data. New cases jumped by 1,606 in the past 24 hours, taking the total to 133,748. “This week is a really critical week,” Canada’s Chief Public Health Officer Theresa Tam said. An average of 545 new cases had been reported daily over the past week, up from about 300 in July. “This is concerning ... when cases occur, including in schools, it is a reflection on what’s happening in the community,” Tam told a briefing. Canada’s western province of British Columbia has asked restaurants, pubs and bars to end sale of liquor at 10:00 p.m. and ordered bars and restaurants to close by 11:00 p.m., unless serving food, according to a government statement. Several of Canada’s 10 provinces started reopening schools this week for in-person learning after investing millions in added protections. Quebec, which welcomed back pupils last month, has already reported a number of cases in schools. Tam noted the increase in infections was concentrated among younger adults and cited the risk posed by private functions and family gatherings. Alberta, which reopened schools one week ago, reported 11 COVID-19 cases spread across 11 different schools, Chief Medical Health Officer Dr. Deena Hinshaw said on Tuesday, adding the infections were spread in the community, and not acquired within the schools. Alberta now has 1,692 known active cases, the most since early May. The premier of Ontario, Canada’s most-populous province, railed against young people and students who he said were holding unauthorized parties and warned them he wanted the police to lay charges if necessary. “No more parties. I just can’t stress it enough,” Doug Ford told a briefing on Tuesday. Ontario is suspending by a month efforts to lift remaining restrictions in place to fight the outbreak. The coronavirus reproduction number, which shows how many people someone with COVID-19 is infecting, has risen to just above one, an indication that the virus is spreading. “That is not a good sign,” Tam said. Quebec unveiled a four-step alert system for measures to curb COVID-19 that would introduce restrictions such as limiting the number of people allowed to gather depending on the risk of transmission. Reporting by David Ljunggren and Julie Gordon in Ottawa,; Additional reporting by Allison Lampert in Montreal and Allison Martell in Toronto and Rod Nickel in Winnipeg; Editing by Peter Cooney, Tom Brown and Richard Pullin Our Standards: The Thomson Reuters Trust Principles. Apps Newsletters Advertise with Us Advertising Guidelines Cookies Terms of Use Privacy Do Not Sell My Personal Information All quotes delayed a minimum of 15 minutes. See here for a complete list of exchanges and delays.© 2020 Reuters. All Rights Reserved. for-phone-onlyfor-tablet-portrait-upfor-tablet-landscape-upfor-desktop-upfor-wide-desktop-up"
237037,20200911,ca.reuters.com,https://ca.reuters.com/article/topNews/idCAKBN25Z1JY,text/html,text/html,en,"Stocks end lower as tech swoon persists, Tesla in historic drop | Reuters Discover Thomson Reuters Directory of sitesLoginContactSupport for-phone-onlyfor-tablet-portrait-upfor-tablet-landscape-upfor-desktop-upfor-wide-desktop-up Business News Updated Stocks end lower as tech swoon persists, Tesla in historic drop By Chuck Mikolajczak 4 Min Read NEW YORK (Reuters) - U.S. stocks closed lower for a third straight session on Tuesday as heavyweight technology names extended their sell-off to send the Nasdaq into correction territory, while Tesla suffered its biggest daily percentage drop after the stock was passed over for inclusion in the S&P 500. Each of the 11 major S&P sectors were lower, led by declines in technology and energy. Reports on Friday that SoftBank made significant option purchases during the run-up in U.S. stocks added to investor nervousness. Technology once again dragged indexes lower with a drop of 4.59%, the third straight decline and worst three-day performance for the sector since mid-March. Even with the recent drop, the sector remains the best performer on the year. “Things got expensive, they ran up, they got very concentrated and people got really giddy,” said Willie Delwiche, investment strategist at Baird in Milwaukee. “Everyone is all loaded up on one side, it doesn’t take much of a ripple to knock some apples off the cart.” The Dow Jones Industrial Average fell 632.42 points, or 2.25%, to 27,500.89, the S&P 500 lost 95.12 points, or 2.78%, to 3,331.84 and the Nasdaq Composite dropped 465.44 points, or 4.11%, to 10,847.69. Energy shares slumped 3.71% as oil prices fell below $40 a barrel. Media reports of SoftBank’s option purchases also reminded investors that market makers might have billions of dollars’ worth of long positions as hedges against options trades. Related Coverage U.S. options investors pull back on tech bets, but SoftBank's trade looms large Wall Street’s rally, which has been fueled in large part by massive amounts of monetary and fiscal stimulus, screeched to a halt last week with the Nasdaq falling as much as 9.9% from its intraday record as investors booked profits after a run that lifted the index about 70% from its pandemic lows. Tuesday’s losses put the index down 10% from its closing record, confirming a correction began on Sept. 2. At session lows on Tuesday, Facebook, Amazon.com, Apple, Tesla, Microsoft, Alphabet and Netflix had collectively lost more than $1 trillion in market capitalization since Sept. 2. Tesla plunged 21.06% to suffer its biggest daily percentage drop as the electric-car maker was excluded from a group of companies being added to the S&P 500. Investors had widely expected its inclusion after a blockbuster quarterly earnings report in July. Up to Friday’s close, the stock had surged about 400% this year. JPMorgan Chase & Co fell 3.48%, after a report it was probing employees who were allegedly involved in the misuse of funds intended for COVID-19 relief. The wider banks index lost 3.44%, also tracking Treasury yields. A gauge of value stocks fell 1.84%, but outperformed the broader market and a 3.38%, decline in the growth index. Wall Street’s fear gauge climbed for the third time in four sessions. Concerns over potential U.S. sanctions against China’s biggest chipmaker, SMIC, hit domestic suppliers, with the PHLX semiconductor index down 3.43%. FILE PHOTO: The front facade of the New York Stock Exchange (NYSE) is seen in New York City, New York, U.S., June 26, 2020. REUTERS/Brendan McDermid General Motors Co jumped 7.93% after it acquired an 11% stake worth $2 billion in U.S. electric-truck maker Nikola Corp. The truck maker’s shares surged 40.79%. Declining issues outnumbered advancing ones on the NYSE by a 3.78-to-1 ratio; on Nasdaq, a 2.22-to-1 ratio favored decliners. The S&P 500 posted no new 52-week highs and 2 new lows; the Nasdaq Composite recorded 31 new highs and 49 new lows. Volume on U.S. exchanges was 10.48 billion shares, compared with the 9.32 billion average for the full session over the last 20 trading days. Reporting by Chuck Mikolajczak in New York; Editing by Maju Samuel and Matthew Lewis Our Standards: The Thomson Reuters Trust Principles. Apps Newsletters Advertise with Us Advertising Guidelines Cookies Terms of Use Privacy Do Not Sell My Personal Information All quotes delayed a minimum of 15 minutes. See here for a complete list of exchanges and delays.© 2020 Reuters. All Rights Reserved. for-phone-onlyfor-tablet-portrait-upfor-tablet-landscape-upfor-desktop-upfor-wide-desktop-up"
