,crawl_date,domain,url,mime_type_web_server,mime_type_tika,language,content
237044,20200911,ca.reuters.com,https://ca.reuters.com/article/domesticNews/idCAKBN25S5Q8,text/html,text/html,en,"In Canada, airlines face uphill climb to replace quarantines with COVID-19 testing | Reuters Discover Thomson Reuters Directory of sitesLoginContactSupport for-phone-onlyfor-tablet-portrait-upfor-tablet-landscape-upfor-desktop-upfor-wide-desktop-up Domestic News Updated In Canada, airlines face uphill climb to replace quarantines with COVID-19 testing By Allison Lampert, Allison Martell 3 Min Read MONTREAL/TORONTO (Reuters) - Transport Canada is holding early talks with airlines to introduce COVID-19 testing at airports, but the day when such tests could become an alternative to the quarantines decimating travel could still be far off, sources familiar with the discussions said. FILE PHOTO: WestJet airline signage is pictured at Vancouver's international airport in Richmond, British Columbia, Canada, February 5, 2019. REUTERS/Ben Nelms/File Photo The airline-led talks come as Air Canada and WestJet introduce their own testing plans for Toronto and Vancouver airports, respectively this fall. The use of airport testing to reduce or eliminate Canada’s strict two-week self quarantine rule would be logistically challenging as it would require cooperation from airports, airlines, federal and provincial health authorities, the sources said. And government-approved lab tests that largely take 24 to 48 hours to deliver results would need to be used, making them impractical for airport departures, they added. Canada has faced pressure from airlines to change its travel restrictions, with the country’s borders now closed to all noncitizens except for essential workers. “The airlines have a vested interest in seeing this happen,” one of the source said. “But there is no guarantee that Canada would choose to lift the 14-day quarantine even if testing were able to take place at airports.” Globally, carriers and airports largely back testing to replace quarantines, with a U.N. aviation task force expected to weigh in on one industry proposal at a Sept. 15 meeting, airline group IATA said. IATA and Airports Council International (ACI) support the use of PCR (polymerase chain reaction) tests 48 hours ahead of departure from high-risk countries, since rapid tests are not seen as reliable or widely accepted by regulators. Health Canada has changed its position on home tests and is now willing to consider approving rapid home COVID-19 tests. Last week U.S. regulators approved a rapid test from Abbott Laboratories but it is currently approved only for people who have symptoms. WestJet and Vancouver International Airport have not yet finalized joint plans announced last week to test some departing passengers. Tamara Vrooman, chief executive of the Vancouver airport, said one possibility was for the facility to be certified as a lab, but “we’re still examining that.” Air Canada declined comment. Canada’s Chief Public Health Officer Theresa Tam said on Friday her agency was looking at “options going forward and reducing the more restrictive measures at the border.” Health officials are also considering the timing of the test, since travelers coming to Canada might have a negative result if they were infected only one or two days prior. Transport Canada said it is committed to “working with other federal partners to explore COVID testing at airports upon arrival.” Reporting By Allison Lampert in Montreal and Allison Martell in Toronto; Editing by Bill Berkrot and Tom Brown Our Standards: The Thomson Reuters Trust Principles. Apps Newsletters Advertise with Us Advertising Guidelines Cookies Terms of Use Privacy Do Not Sell My Personal Information All quotes delayed a minimum of 15 minutes. See here for a complete list of exchanges and delays.© 2020 Reuters. All Rights Reserved. for-phone-onlyfor-tablet-portrait-upfor-tablet-landscape-upfor-desktop-upfor-wide-desktop-up"
283372,20201009,ca.reuters.com,https://ca.reuters.com/article/businessNews/idCAKBN26R28P,text/html,text/html,en,"Canada exports and imports fall in August, flag slowing recovery | Reuters Discover Thomson Reuters Directory of sitesLoginContactSupport for-phone-onlyfor-tablet-portrait-upfor-tablet-landscape-upfor-desktop-upfor-wide-desktop-up Business News Updated Canada exports and imports fall in August, flag slowing recovery By Julie Gordon 3 Min Read OTTAWA (Reuters) - Canada’s exports and imports both fell in August, hinting that the momentum of the recovery from the COVID-19 crisis could have slowed more than anticipated, data from Statistics Canada showed on Tuesday. Slideshow ( 2 images ) Imports fell 1.2%, while exports were down 1.0%. Canada’s trade deficit, meanwhile, narrowed slightly to C$2.45 billion ($1.85 billion), missing analyst expectations of C$2.0 billion. Statscan revised July’s trade deficit to C$2.53 billion from an initial C$2.45 billion. “The slowdown in trade showed up earlier than we had anticipated, and the drop in export volumes suggests that the recovery’s momentum could have slowed more than anticipated in August,” said Royce Mendes, senior economist at CIBC Economics, in a note. Lower imports of aircraft and other transportation equipment and parts drove the import decline, while exports fell after three months of strong gains on lower exports of passenger cars and light trucks, Statscan said. Imports from Canada’s largest trading partner, the United States, fell 1.6%, while exports to that country were up 1.0% on higher lumber exports. Exports to all countries remained 7% below pre-pandemic levels, while imports remained down 5.1%, Statscan said. “Overall, the fact that we haven’t fully recovered in the merchandise side is a disappointment,” said Ross Prusakowski, principal economist at Export Development Canada. Prusakowski noted that some of the export weakness was temporary, pointing to a strike at the Port of Montreal in August that had an impact on shipments, particularly to Europe. “That’s one area where we think there might be some strength coming back,” Prusakowski said. Analysts also noted that a July boost caused by shorter seasonal shutdowns at most auto assembly plants did not continue into August, returning trade in that segment to more typical levels. Still, export levels of passenger cars and light trucks were almost C$200 million higher than in February, Statscan said. The Canadian dollar CAD= was trading nearly unchanged after the data at 1.3260 to the greenback, or 75.41 U.S. cents. Reporting by Julie Gordon and David Ljunggren in Ottawa, additional reporting by Fergal Smith in Toronto; Editing by Steve Orlofsky and Nick Zieminski Our Standards: The Thomson Reuters Trust Principles. Apps Newsletters Advertise with Us Advertising Guidelines Cookies Terms of Use Privacy Do Not Sell My Personal Information All quotes delayed a minimum of 15 minutes. See here for a complete list of exchanges and delays.© 2020 Reuters. All Rights Reserved. for-phone-onlyfor-tablet-portrait-upfor-tablet-landscape-upfor-desktop-upfor-wide-desktop-up"
295232,20201016,ca.reuters.com,https://ca.reuters.com/article/businessNews/idCAKBN27121D,text/html,text/html,en,"C$ pares weekly decline as investors cheer vaccine progress | Reuters Discover Thomson Reuters Directory of sitesLoginContactSupport for-phone-onlyfor-tablet-portrait-upfor-tablet-landscape-upfor-desktop-upfor-wide-desktop-up Business News Updated C$ pares weekly decline as investors cheer vaccine progress By Fergal Smith 2 Min Read FILE PHOTO: A Canadian dollar coin, commonly known as the ""Loonie"", is pictured in this illustration picture taken in Toronto, January 23, 2015. REUTERS/Mark Blinch (CANADA - Tags: BUSINESS) TORONTO (Reuters) - The Canadian dollar gained ground against its broadly weaker U.S. counterpart on Friday as signs of progress on developing a COVID-19 vaccine boosted investor sentiment, with the loonie clawing back some of this week’s decline. The Canadian dollar CAD= was trading 0.3% higher at 1.3180 to the greenback, or 75.87 U.S. cents, having traded in a range of 1.3177 to 1.3237. For the week, the loonie was down 0.5%. “The usual suspects” were behind the currency’s move higher on Friday, including a weaker U.S. dollar and increased risk appetite, said Ronald Simpson, managing director, global currency analysis at Action Economics. Canada runs a current account deficit and is a major producer of commodities, including oil, so the loonie tends to be sensitive to the global flow of trade and capital. Wall Street bounced back after three straight days of losses as a positive update from Pfizer on development of its COVID-19 vaccine tempered worries that a resurgent pandemic would derail economic recovery. Data showing stronger-than-expected U.S. retail sales growth last month added to positive sentiment. Canadian manufacturing sales fell by 2.0% in August, following three months of consecutive gains, Statistics Canada said. Excluding transportation equipment, sales rose 1.1%. U.S. crude oil futures CLc1 settled 0.2% lower at $40.88 a barrel on concern that a spike in COVID-19 cases in Europe and the United States would curtail demand in two of the world's biggest fuel consuming regions. Preserving Canada’s triple-A credit rating could be less of a priority for Ottawa than in years gone by, with the focus on digging the economy out of a hole rather than staying in a shrinking group of top-rated sovereign borrowers, analysts say. Canadian government bond yields were mixed across the curve, with the 10-year CA10YT=RR unchanged at 0.572%. Reporting by Fergal Smith; Editing by Nick Zieminski and Sandra Maler Our Standards: The Thomson Reuters Trust Principles. Apps Newsletters Advertise with Us Advertising Guidelines Cookies Terms of Use Privacy Do Not Sell My Personal Information All quotes delayed a minimum of 15 minutes. See here for a complete list of exchanges and delays.© 2020 Reuters. All Rights Reserved. for-phone-onlyfor-tablet-portrait-upfor-tablet-landscape-upfor-desktop-upfor-wide-desktop-up"
295239,20201016,ca.reuters.com,https://ca.reuters.com/article/topNews/idCAKBN2711DN,text/html,text/html,en,"Analysis: For Canada, keeping triple-A rating may not be the focus it once was | Reuters Discover Thomson Reuters Directory of sitesLoginContactSupport for-phone-onlyfor-tablet-portrait-upfor-tablet-landscape-upfor-desktop-upfor-wide-desktop-up Business News Updated Analysis: For Canada, keeping triple-A rating may not be the focus it once was By Fergal Smith 4 Min Read TORONTO (Reuters) - Preserving Canada’s triple-A credit rating could be less of a priority for Ottawa than in years gone by, with the focus on digging the economy out of a hole rather than staying in a shrinking group of top-rated sovereign borrowers, analysts say. FILE PHOTO: A Canadian flag flies in front of the Peace Tower on Parliament Hill in Ottawa, Ontario, Canada, March 22, 2017. REUTERS/Chris Wattie/File Photo To maintain its top rating, Canada would likely need to convince credit rating agencies it has a tenable plan to restore fiscal health once the coronavirus pandemic recedes, say the analysts. Ottawa has projected a budget deficit of C$343 billion ($259 billion) for the current fiscal year ending March 31 as it spends to cushion the economic blow from the pandemic, which at about 16% of GDP would be a record shortfall. Credit rating agencies will be closely watching Ottawa’s fiscal update expected in the fall to assess Canada’s financial health. But the threat of a downgrade may not shape policy as much as it did in the 1990s, when S&P Global Ratings and Moody’s Investors Service stripped Canada of its triple-A rating. Back then, Canada entered into a multi-year period of fiscal austerity, spurred by the unflattering disparity between its finances and those of peers. Now, Canada is not an outlier. “The whole thing is relativity ... when you put it in the international context, Canada doesn’t look as bad as it might,” said John Manley, a senior business adviser at Bennett Jones and former federal finance minister and industry minister in Liberal Party governments. Globally, government spending to offset the economic impact of the virus totals $12 trillion, or about 12% of gross domestic product, according to the International Monetary Fund, while the number of sovereign borrowers rated triple A has fallen to 10 to 12, depending on the rating agency, from as many as 19 a decade ago. ‘NO TIME FOR AUSTERITY’ S&P has said that Canada is better positioned than most countries to spend temporarily in support of its economy. It, Moody’s and DBRS Morningstar give Canada their highest rating. But Fitch Ratings downgraded the country’s rating in June. Canada’s borrowing costs have not suffered. With the Bank of Canada buying much of the government’s debt issuance, through its quantitative easing program, bond yields have held near record lows. That has emboldened Prime Minister Justin Trudeau to promise even more spending by his Liberal government, saying that “this is not the time for austerity.” Any government that runs a deficit the size of Canada’s “doesn’t care much about what the rating agencies have to say,” said David Rosenberg, chief economist and strategist at Rosenberg Research. The fall fiscal update is likely to include some longer-term fiscal projections as well as the costing of economic support measures, economists say. “I think the focus will be more on helping the economy rather than tackling deficits,” said Josh Nye, a senior economist at Royal Bank of Canada. “The severity of the second wave and its economic impact will be key in how much government support needs to remain in place.” Canada’s new COVID-19 cases in the second wave have risen above the peak in the spring, forcing provinces to take targeted measures. “Some rating agencies will look through to the medium term, citing this as a transitory event,” said Maria Berlettano, head of Canadian government credit strategy at CIBC Capital Markets. “Others may not be so patient.” ($1 = 1.3229 Canadian dollars) Reporting by Fergal Smith; Editing by Peter Cooney Our Standards: The Thomson Reuters Trust Principles. Apps Newsletters Advertise with Us Advertising Guidelines Cookies Terms of Use Privacy Do Not Sell My Personal Information All quotes delayed a minimum of 15 minutes. See here for a complete list of exchanges and delays.© 2020 Reuters. All Rights Reserved. for-phone-onlyfor-tablet-portrait-upfor-tablet-landscape-upfor-desktop-upfor-wide-desktop-up"
308451,20201023,ca.reuters.com,https://ca.reuters.com/article/businessNews/idCAKBN27121D,text/html,text/html,en,"C$ pares weekly decline as investors cheer vaccine progress | Reuters Discover Thomson Reuters Directory of sitesLoginContactSupport for-phone-onlyfor-tablet-portrait-upfor-tablet-landscape-upfor-desktop-upfor-wide-desktop-up Business News Updated C$ pares weekly decline as investors cheer vaccine progress By Fergal Smith 2 Min Read FILE PHOTO: A Canadian dollar coin, commonly known as the ""Loonie"", is pictured in this illustration picture taken in Toronto, January 23, 2015. REUTERS/Mark Blinch (CANADA - Tags: BUSINESS) TORONTO (Reuters) - The Canadian dollar gained ground against its broadly weaker U.S. counterpart on Friday as signs of progress on developing a COVID-19 vaccine boosted investor sentiment, with the loonie clawing back some of this week’s decline. The Canadian dollar CAD= was trading 0.3% higher at 1.3180 to the greenback, or 75.87 U.S. cents, having traded in a range of 1.3177 to 1.3237. For the week, the loonie was down 0.5%. “The usual suspects” were behind the currency’s move higher on Friday, including a weaker U.S. dollar and increased risk appetite, said Ronald Simpson, managing director, global currency analysis at Action Economics. Canada runs a current account deficit and is a major producer of commodities, including oil, so the loonie tends to be sensitive to the global flow of trade and capital. Wall Street bounced back after three straight days of losses as a positive update from Pfizer on development of its COVID-19 vaccine tempered worries that a resurgent pandemic would derail economic recovery. Data showing stronger-than-expected U.S. retail sales growth last month added to positive sentiment. Canadian manufacturing sales fell by 2.0% in August, following three months of consecutive gains, Statistics Canada said. Excluding transportation equipment, sales rose 1.1%. U.S. crude oil futures CLc1 settled 0.2% lower at $40.88 a barrel on concern that a spike in COVID-19 cases in Europe and the United States would curtail demand in two of the world's biggest fuel consuming regions. Preserving Canada’s triple-A credit rating could be less of a priority for Ottawa than in years gone by, with the focus on digging the economy out of a hole rather than staying in a shrinking group of top-rated sovereign borrowers, analysts say. Canadian government bond yields were mixed across the curve, with the 10-year CA10YT=RR unchanged at 0.572%. Reporting by Fergal Smith; Editing by Nick Zieminski and Sandra Maler Our Standards: The Thomson Reuters Trust Principles. Apps Newsletters Advertise with Us Advertising Guidelines Cookies Terms of Use Privacy Do Not Sell My Personal Information All quotes delayed a minimum of 15 minutes. See here for a complete list of exchanges and delays.© 2020 Reuters. All Rights Reserved. for-phone-onlyfor-tablet-portrait-upfor-tablet-landscape-upfor-desktop-upfor-wide-desktop-up"
308463,20201023,ca.reuters.com,https://ca.reuters.com/article/topNews/idCAKBN2711DN,text/html,text/html,en,"Analysis: For Canada, keeping triple-A rating may not be the focus it once was | Reuters Discover Thomson Reuters Directory of sitesLoginContactSupport for-phone-onlyfor-tablet-portrait-upfor-tablet-landscape-upfor-desktop-upfor-wide-desktop-up Business News Updated Analysis: For Canada, keeping triple-A rating may not be the focus it once was By Fergal Smith 4 Min Read TORONTO (Reuters) - Preserving Canada’s triple-A credit rating could be less of a priority for Ottawa than in years gone by, with the focus on digging the economy out of a hole rather than staying in a shrinking group of top-rated sovereign borrowers, analysts say. FILE PHOTO: A Canadian flag flies in front of the Peace Tower on Parliament Hill in Ottawa, Ontario, Canada, March 22, 2017. REUTERS/Chris Wattie/File Photo To maintain its top rating, Canada would likely need to convince credit rating agencies it has a tenable plan to restore fiscal health once the coronavirus pandemic recedes, say the analysts. Ottawa has projected a budget deficit of C$343 billion ($259 billion) for the current fiscal year ending March 31 as it spends to cushion the economic blow from the pandemic, which at about 16% of GDP would be a record shortfall. Credit rating agencies will be closely watching Ottawa’s fiscal update expected in the fall to assess Canada’s financial health. But the threat of a downgrade may not shape policy as much as it did in the 1990s, when S&P Global Ratings and Moody’s Investors Service stripped Canada of its triple-A rating. Back then, Canada entered into a multi-year period of fiscal austerity, spurred by the unflattering disparity between its finances and those of peers. Now, Canada is not an outlier. “The whole thing is relativity ... when you put it in the international context, Canada doesn’t look as bad as it might,” said John Manley, a senior business adviser at Bennett Jones and former federal finance minister and industry minister in Liberal Party governments. Globally, government spending to offset the economic impact of the virus totals $12 trillion, or about 12% of gross domestic product, according to the International Monetary Fund, while the number of sovereign borrowers rated triple A has fallen to 10 to 12, depending on the rating agency, from as many as 19 a decade ago. ‘NO TIME FOR AUSTERITY’ S&P has said that Canada is better positioned than most countries to spend temporarily in support of its economy. It, Moody’s and DBRS Morningstar give Canada their highest rating. But Fitch Ratings downgraded the country’s rating in June. Canada’s borrowing costs have not suffered. With the Bank of Canada buying much of the government’s debt issuance, through its quantitative easing program, bond yields have held near record lows. That has emboldened Prime Minister Justin Trudeau to promise even more spending by his Liberal government, saying that “this is not the time for austerity.” Any government that runs a deficit the size of Canada’s “doesn’t care much about what the rating agencies have to say,” said David Rosenberg, chief economist and strategist at Rosenberg Research. The fall fiscal update is likely to include some longer-term fiscal projections as well as the costing of economic support measures, economists say. “I think the focus will be more on helping the economy rather than tackling deficits,” said Josh Nye, a senior economist at Royal Bank of Canada. “The severity of the second wave and its economic impact will be key in how much government support needs to remain in place.” Canada’s new COVID-19 cases in the second wave have risen above the peak in the spring, forcing provinces to take targeted measures. “Some rating agencies will look through to the medium term, citing this as a transitory event,” said Maria Berlettano, head of Canadian government credit strategy at CIBC Capital Markets. “Others may not be so patient.” ($1 = 1.3229 Canadian dollars) Reporting by Fergal Smith; Editing by Peter Cooney Our Standards: The Thomson Reuters Trust Principles. Apps Newsletters Advertise with Us Advertising Guidelines Cookies Terms of Use Privacy Do Not Sell My Personal Information All quotes delayed a minimum of 15 minutes. See here for a complete list of exchanges and delays.© 2020 Reuters. All Rights Reserved. for-phone-onlyfor-tablet-portrait-upfor-tablet-landscape-upfor-desktop-upfor-wide-desktop-up"
375545,20201204,ca.reuters.com,https://ca.reuters.com/article/topNews/idCAKBN28B5FY,text/html,text/html,en,"Canada PM Trudeau indicates U.S. border restrictions to last a long time | Reuters Discover Thomson Reuters Directory of sitesLoginContactSupport for-phone-onlyfor-tablet-portrait-upfor-tablet-landscape-upfor-desktop-upfor-wide-desktop-up Domestic News Updated Canada PM Trudeau indicates U.S. border restrictions to last a long time By David Ljunggren 2 Min Read OTTAWA (Reuters) - Canada will not agree to lifting a ban on non-essential travel with the United States until the coronavirus outbreak is significantly under control around the world, Prime Minister Justin Trudeau said on Tuesday. FILE PHOTO: Canada's Prime Minister Justin Trudeau attends a news conference at Rideau Cottage, as efforts continue to help slow the spread of the coronavirus disease (COVID-19), in Ottawa, Ontario, Canada November 20, 2020. REUTERS/Blair Gable Trudeau’s comments were a clear indication that the border restrictions will last well into 2021. The two neighbors agreed to the ban in March and have rolled it over on a monthly basis ever since. The ban does not affect trade. The two countries have highly integrated economies and Canada sends 75% of its goods exports to the United States every month. “Until the virus is significantly more under control everywhere around the world, we’re not going to be releasing the restrictions at the border,” Trudeau told the Canadian Broadcasting Corp. when asked about the issue. “We are incredibly lucky that trade in essential goods, in agricultural products, in pharmaceuticals is flowing back and forth as it always has,” he said. Trudeau spoke the day after his minority Liberal government said the budget deficit would hit a historic C$381.6 billion ($294.7 billion) on COVID-19 aid and promised to spend an additional C$100 billion in stimulus. Trudeau, who relies on other parties to govern, would be toppled if the House of Commons votes against the measures but he dismissed that as unlikely. “I am reasonably confident none of the opposition parties wants an election right now,” he later told reporters. The border restrictions are opposed by the travel industry, hit by a slumping number of tourists. But the premiers of Canada’s major provinces say they have no interest in re-opening the border as long as cases of COVID-19 escalate in the United States. A second wave is also sweeping across Canada, where authorities are starting to re-impose restrictions on businesses and limit the size of gatherings. Reporting by David Ljunggren; Editing by Bernadette Baum and Aurora Ellis Our Standards: The Thomson Reuters Trust Principles. Apps Newsletters Advertise with Us Advertising Guidelines Cookies Terms of Use Privacy Do Not Sell My Personal Information All quotes delayed a minimum of 15 minutes. See here for a complete list of exchanges and delays.© 0 Reuters. All Rights Reserved. for-phone-onlyfor-tablet-portrait-upfor-tablet-landscape-upfor-desktop-upfor-wide-desktop-up"
