,crawl_date,domain,url,mime_type_web_server,mime_type_tika,language,content
101747,20200619,currently.att.yahoo.com,https://currently.att.yahoo.com/,text/html,text/html,en,"Currently.com - AT&T Yahoo Email, News, Sports & More AT&T Search Powered by Yahoo Skip to Navigation Skip to Main Content Skip to Related Content Sign in Mail Sign in to view your mail Mail News Finance Sports Entertainment Lifestyle Weather myAT&T More... Black government official resigns over Trump response Mary Elizabeth Taylor's resignation may be the first high-profile departure prompted by President Trump's response to calls for police reform.'Cut sharply against my core values' » 13,871 people reacting Study ties blood type to COVID-19 risk Mountain lion caught roaming San Francisco Woman who torched police cars tracked via Etsy Navy upholds captain's firing for virus warning Florida shatters daily record for new coronavirus cases News Bleacher Report John Wall Says He's Scared of Getting Pulled Over: 'Never Know What Can Happen' Washington Wizards point guard John Wall told former NBA forward Caron Butler that he's "" scared of getting pulled over"" by police after relaying an encounter that occurred in Washington, D... 11 reaction U.S. The Telegraph Natural born killer: the violent life of Woody Harrelson's hitman father On September 1, 1980, police outside of Vanhorn, Texas were locked in a six-hour standoff with a fugitive and suspected assassin. He was Charles Voyde Harrelson – father of Hollywood A-lister Woody Harrelson. Crazed and hallucinating from injecting cocaine, Charles Harrelson had convinced himself there was a bomb hidden in the muffler of his car. He pulled over to the side of the highway and began blasting at the car with his gun, blowing his tyre. Harrelson – shirtless and wearing cutoff jeans and gold chains – held himself hostage. With his gun under his chin, he threatened to kill himself and claimed – among other things – that he killed John F. Kennedy. Harrelson was later sentenced to two life sentences for shooting the federal judge John H. Wood, nicknamed “Maximum John” for his tough sentences. He was set to preside over the trial of marijuana kingpin Jimmy Chagra. The life and crimes of Charles Harrelson are now the subject of Son of a Hitman, an investigative Spotify podcast by journalist Jason Cavanagh. Speaking with witnesses, lawyers, law enforcement, and relatives of his victims (of both convicted and alleged crimes), Son of a Hitman paints a damning, ruthless portrait of Charles V. Harrelson: a murderer-for-hire; a woman-beater; a con-man; a drug mover and user; and debt collector. One wild story even has him smuggling weapons into Cuba with Jack Ruby, the man who shot Lee Harvey Oswald. The sister of one murder victim described Harrelson as “cold as ice… there was nothing in his eyes.” 3131 reactions Entertainment The Independent James Gandolfini threatened to ‘beat the f***’ out of Harvey Weinstein, says Steve Schirripa James Gandolfini once became so upset with Harvey Weinstein that he wanted to physically attack him, his Sopranos co-star Steve Schrippa has said.Schirripa and Michael Imperioli were guests on the Joe Rogan Experience this week, where they reflected on their time with Gandolfini on the HBO show. Joe Rogan & ""Sopranos"" Actors Reminisce About James Gandolfini HotNewHipHop James Gandolfini Once Told Harvey Weinstein He'd 'Beat the F-' Out of Him The New York Observer 5050 reactions Celebrity USA TODAY Sister of Nicole Brown Simpson on release date of Ford Bronco: 'Are you kidding me?' The Brown family is surprised the world premiere of the popular Bronco SUV falls on the birthday of former football star Orenthal James 'O.J.' Simpson 46114,611 reactions U.S. Yahoo Entertainment Trump says Rayshard Brooks's killing is 'very sad' but you 'can’t resist a police officer' Trump said that the situation with Rayshard Brooks ended “very bad” and that he hopes the officer charged in Brooks’s death ""gets a fair shake because police have not been treated fairly.” 5 things to know for June 18: Rayshard Brooks, police, Covid-19, John Bolton, Syria NewsAdvance.com Sen. Loeffler on charges against officer in Rayshard Brooks death FOX News Videos 31593,159 reactions Business Quartz If India does #BoycottChina, its startups will lose more than just funding The phenomenal growth of India's much-celebrated tech startup ecosystem, which is now the third-largest in the world, could be stunted if Chinese funding into the country slows in the aftermath of the military escalations on the border this week, experts believe. “Chinese investors have been making their presence stronger in the Indian startup ecosystem since (the) last few years, which also enabled these startups to scale up successfully,” said Aurojyoti Bose, lead analyst at GlobalData. Last year, Chinese investors put a whopping $3.9 billion (Rs29,729 crore) into Indian startups—nearly double the $2 billion in 2018. 173173 reactions Science The Conversation Coronavirus: why it's dangerous to blindly 'follow the science' when there's no consensus yet If expert advice on the pandemic turns out to be wrong, it will have dire consequences for how reliable scientific evidence is treated in other policy areas, such as climate change. 288288 reactions Sports Seventeen Simone Biles Just Pulled Off a Gymnastics Move That’s Never Been Done Before My jaw is on THE FLOOR. 100100 reactions Trending Now 1. Juneteenth 2. Camila Alves 3. Father’s Day 2020 4. Ian Holm 5. Classic Car Insurance 6. Sneeze Guard 7. Pamela Anderson 8. Medigap Plan G 9. Miranda Pearman-Maday 10. Courtney Stodden Weather United States View your Locations Remove from favorite locations Detect my location Enter City or Zipcode Manage Locations Today 77°71° SatThunderstorms today with a high of 80 °F (26.7 °C) and a low of 70 °F (21.1 °C). There is a 35% chance of precipitation. 80°70° SunThunderstorms today with a high of 87 °F (30.6 °C) and a low of 67 °F (19.4 °C). 87°67° MonThunderstorms today with a high of 86 °F (30.0 °C) and a low of 68 °F (20.0 °C). There is a 35% chance of precipitation. 86°68°More on Yahoo Weather Popular Searches Probiotics Cash Back Horoscope Gemini5/21 - 6/20 Cancer6/21 - 7/22 Leo7/23 - 8/22 Virgo8/23 - 9/22 Libra9/23 - 10/22 Scorpio10/23 - 11/21 Sagittarius11/22 - 12/21 Capricorn12/22 - 1/19 Aquarius1/20 - 2/18 Pisces2/19 - 3/20 Aries3/21 - 4/19 Taurus4/20 - 5/20 Gemini(change) June 19 - Feeling like you are the priority in someones life is more important than usual today. Its possible youve experienced a setback that has thrown you off balance, and this is where your best friend, romantic partner, or favorite relative can be helpful. By letting them know you need extra doses of tender, loving care, your nearest and dearest can step up to the plate. Now that the nurturing Moon and receptive Venus are joining together in your 1st House of Self, their compliments and encouraging words will be especially therapeutic. See more » Terms (Updated) Privacy (Updated) Privacy dashboard Acceptable Use Policy Advertise Advertising Choices Feedback © 2020 AT&T Intellectual Property All rights reserved. AT&T and Globe logo are registered trademarks of AT&T Intellectual Property. Close this content, you can also use the Escape key at anytime"
111583,20200626,currently.att.yahoo.com,https://currently.att.yahoo.com/,text/html,text/html,en,"Currently.com - AT&T Yahoo Email, News, Sports & More AT&T Search Powered by Yahoo Skip to Navigation Skip to Main Content Skip to Related Content Sign in Mail Sign in to view your mail Mail News Finance Sports Entertainment Lifestyle Weather myAT&T More... Daughter begs people not to vote for her dad Robert Regan blames his daughter's ""socialist university,"" but says he's ""happy she feels confident"" to oppose him publicly.'For the love of God' » 2,104 people reacting Council votes to remove Minneapolis police force Ron Jeremy pleads not guilty to rape, assault charges Texas man 'smacks' judge over mask rule Facebook to crack down on hate speech 'Pop, Lock & Drop It' rapper killed in double shooting News CNN POW and MIA in Iraq and Afghanistan Fast Facts View CNN's Fast Facts about POW/MIA's in Iraq and Afghanistan from 1991 to present. Start the conversation Celebrity The Telegraph Brian Dennehy, tough-guy character actor who found fame in the Rambo film First Blood – obituary Brian Dennehy, who has died aged 81, was a hulking character actor and former US Marine who seemed to play every tough-cookie supporting role in American film in the 1980s, before belatedly proving himself to be an outstanding stage performer. Dennehy frequently played cops, most notably in the inaugural Rambo film, First Blood (1982). As the small-town sheriff pursuing the soldier-turned-drifter John Rambo (Sylvester Stallone), Dennehy was the reactionary villain of the piece, but he also managed to convey the character’s fundamental decency. He brought similar nuances to his portrayals of dogged police detectives in the thrillers Gorky Park (1983) and F/X (1986); the corrupt Sheriff Cobb in the Western Silverado (1985); and the blustering and possibly homicidal district attorney in Presumed Innocent (1990). 176176 reactions World The Telegraph Teenager who pushed boy off Tate viewing platform blamed social services and said he was 'mad' The teenager who threw a six-year-old from a viewing platform at the Tate Modern laughed and told the child’s father “Yes, I am mad” before blaming social services for his actions, a court has heard. Jonty Bravery, 18, who is autistic, has pleaded guilty to attempted murder after scooping up the boy and hurling him over the railings “without any hesitation” last August in front of his horrified parents. A sentence hearing at the Old Bailey heard that he had planned the incident “well in advance” and had researched the easiest way to kill someone as he had been ""seriously unhappy"" and wanted to get out of his supported accommodation. Deanna Heer, prosecuting, told the court: ""He said he had to prove a point to 'every idiot' who had ever said he did not have a mental health problem that he should not be in the community."" She said he was under one-on-one supervision with Hammersmith and Fulham Social Services at the time of the attack, but was allowed to go out unaccompanied for four-hour periods. However, a recording apparently taken by one of his care workers in Autumn 2018, in which Bravery can be heard talking about his plans to kill somebody by pushing them off a building, suggests that opportunities to stop the attack were missed. Teenager who threw French boy from London art gallery roof jailed for 15 years Reuters UK Teenager sentenced for tossing child from atop London museum seattlepi.com 9595 reactions Celebrity The Independent Elton John's ex-wife Renate Blauel launches legal action against singer 32 years after split Elton John’s ex-wife, Renate Blauel, has launched legal action against the singer at the high court, 32 years after their divorce.The German-born sound engineer, who has stayed out of the spotlight since her split from John in 1988, is seeking an injunction against the singer. Elton John's ex-wife takes legal action against the singer Page Six Elton John's ex-wife, Renate Blauel, seeking injunction against singer Fox News 5555 reactions Business Quartz Amazon has a new team to chase down and punish counterfeiters Amazon says it's stepping up the battle against counterfeits on its huge third-party marketplaces with the creation of a new team that will investigate fakes and pursue criminal charges or civil lawsuits against the offenders. It's called the Counterfeit Crimes Unit. The team bolsters Amazon's efforts to go after counterfeiters themselves. 1010 reactions Politics The Telegraph Donald Trump says Chicago 'like living in Hell' and 'worse than Afghanistan' in attack on 'radical' Democrats Donald Trump has criticised Joe Biden's ability to speak and said the Democratic nominee would be controlled by a ""radical fringe group of lunatics"" if he became president. During a town hall in Wisconsin, a key swing-state, Mr Trump repeated his attacks on Mr Biden's age and health, questioning his ability to be president. “Whenever he does talk, he can’t put two sentences together,” Mr Trump said. “I don’t want to be nice or un-nice. The man can’t speak.” ""He's a candidate that will destroy this country,"" Mr Trump added. ""And he may not do it himself. He will be run by a radical fringe group of lunatics that will destroy our country."" Mr Trump, in a Fox News town hall on Thursday, also criticised the soaring crime rates in cities including Chicago and Baltimore – comparing them to Afghanistan and Honduras - and said living in those cities is ""like living in hell"". As Trump visits Wisconsin, new poll shows him trailing Biden by double digits in key battleground state MarketWatch Trump on crime in Chicago, Detroit and Baltimore: ‘It is like living in Hell’ Yahoo Entertainment 196196 reactions U.S. House Beautiful A Giant Dust Plume Originating in the Sahara Desert Is Heading Over the U.S. This Weekend Dubbed the Saharan Dust Plume, this storm has already traveled 5,000 miles and doesn't seem to be stopping anytime soon. Saharan dust plume heads to US skies this weekend ABC News Massive Saharan dust plume will reach US Thursday — here's what you need to know FOX 10 Phoenix 2222 reactions Business Popular Mechanics The World's Tallest Mass Timber Building Will Be a Sight to Behold Coming soon to the Sydney skyline: the future of construction. Oz tech titans to build world's tallest 'hybrid timber' tower in Sydney AFP Relax News Sydney could soon be home to a giant 'hybrid timber' building CNBC.com 123123 reactions Trending Now 1. Police reform bill 2. Kourtney Kardashian 3. Coronavirus spike 4. Julianne Moore 5. Shay Mitchell 6. Costco Car Insurance 7. Christine Baranski 8. Street Signs 9. Mortgage Interest Rates 10. William Shatner Weather United States View your Locations Remove from favorite locations Detect my location Enter City or Zipcode Manage Locations Today 90°71° SatThunderstorms today with a high of 92 °F (33.3 °C) and a low of 75 °F (23.9 °C). There is a 30% chance of precipitation. 92°75° SunThunderstorms today with a high of 93 °F (33.9 °C) and a low of 76 °F (24.4 °C). 93°76° MonMostly cloudy today with a high of 89 °F (31.7 °C) and a low of 77 °F (25.0 °C). 89°77°More on Yahoo Weather Popular Searches Bankruptcy Website Builder Horoscope Cancer6/21 - 7/22 Leo7/23 - 8/22 Virgo8/23 - 9/22 Libra9/23 - 10/22 Scorpio10/23 - 11/21 Sagittarius11/22 - 12/21 Capricorn12/22 - 1/19 Aquarius1/20 - 2/18 Pisces2/19 - 3/20 Aries3/21 - 4/19 Taurus4/20 - 5/20 Gemini5/21 - 6/20 Cancer(change) June 26 - Always leave them wanting more. After you approach a prospective business or social contact today, make a strategic retreat. Being a bit elusive will encourage this person to put effort into holding your attention, which will allow the relationship to gain traction. It's likely the two of you will form a strong intellectual connection and their unique way of seeing the world will be inspiring. Collaborating on a creative project with this innovator may be especially rewarding; casually drop this suggestion and see where it goes. See more » Terms (Updated) Privacy (Updated) Privacy dashboard Acceptable Use Policy Advertise Advertising Choices Feedback © 2020 AT&T Intellectual Property All rights reserved. AT&T and Globe logo are registered trademarks of AT&T Intellectual Property. Close this content, you can also use the Escape key at anytime"
122022,20200703,currently.att.yahoo.com,https://currently.att.yahoo.com/,text/html,text/html,en,"Currently.com - AT&T Yahoo Email, News, Sports & More AT&T Search Powered by Yahoo Skip to Navigation Skip to Main Content Skip to Related Content Sign in Mail Sign in to view your mail Mail News Finance Sports Entertainment Lifestyle Weather myAT&T More... Horrifying details in case of missing Texas solider Authorities said 20-year-old Spc. Aaron David Robinson ran away from Fort Hood on Tuesday night after officials said they had found partial human remains.The tragic case of Vanessa Guillen » 2,413 people reacting 'Airplane!' at 40: Co-director defends controversial scene Man posts regret for going to party, dies of virus next day Braun: 'I just think it's more than Donald Trump' Amazon driver quits, leaves keys in ignition The drug used on Elijah McClain during fatal arrest News CNN Coronavirus infections rising in 36 states as July Fourth weekend starts As Americans head into a holiday weekend in the shadow of a ravaging coronavirus pandemic, some governors are rethinking their stance on face coverings after days of record infections. 1313 reactions U.S. The Telegraph Deadly rabbit virus nicknamed 'bunny ebola' spreading rapidly across southern US A deadly rabbit virus nicknamed ""bunny ebola"" is spreading across the southwest US, killing thousands of wild and pet rabbits. Outbreaks of the rare and highly contagious virus have been reported in seven states across America's Sun Belt, including Arizona, California and Texas. The disease, RHDV2, has been referred to as ""bunny ebola"" by veterinarians because it replicates the severe bleeding and organ failure the ebola virus causes in humans. In many cases the virus is only detected after an animal dies and its nose leaks blood. The US Department of Agriculture confirmed cases of the RHDV2 in Arizona, California, Colorado, Nevada, New Mexico, Utah, and Texas beginning in April. Harrop: Some of you rabbits are winning, others not Standard-Examiner ‘Bunny ebola’ burning through rabbit populations across US. Why experts are worried Miami Herald 1010 reactions Entertainment Evening Standard Dean Cain faces criticism for claiming ‘cancel culture’ would have censored his Superman series Ex-Superman actor Dean Cain has left fans scratching their heads after a bizarre interview in which he compared “cancel culture” to George Orwell’s dystopian novel 1984.Cain, 53, is best-known for starring in a TV series about the superhero in the nineties and during an appearance on Fox News, he claimed the show would be censored if it was airing nowadays. Comic Writer Trashes Dean Cain for Saying Superman Couldn't Say 'The American Way' Today [Photos] lovebscott.com - Celebrity Gossip and Entertainment News Dean Cain responds to writer's call to reexamine how superheroes are portrayed on TV FOX News Videos 8080 reactions Style The Independent 24 best online lingerie shops that will become your underwear go-tos It can feel like a bit of a risk to buy your intimates online, because let’s be honest, size is relative when it comes to bras and knickers.Those who shopped before the internet age might not be convinced that an online shop can do the same as a proper shop assistant, but with the variety of sizes, styles and shapes available on these sites, they might just change their tune. 44 reactions U.S. The Telegraph Trump's July 4 celebration at Mount Rushmore provokes fury among Native Americans Donald Trump’s trip to Mount Rushmore on Friday to celebrate America's Independence Day will be met with furious protests from Native Americans who say he is unwelcome on the sacred ground. The US president has planned a huge celebration for his visit to South Dakota, one of his main events since resuming campaigning, with fighter jets performing a fly past over the monument and the first fireworks display on the site since 2009 to mark the public holiday. It comes as US states with increasing coronavirus case numbers have been forced to close beaches and bars amid fears the July 4th celebrations over the long weekend will cause a fresh surge in the virus. Several Native American groups plan to protest the visit to the monument, arguing that Mr Trump should have sought permission from the area's Sioux tribal governments before holding the event. The Black Hills, where the carving of the four US presidents sits, are sacred to the Lakota Sioux tribe and are an integral part of their creation stories. 262262 reactions U.S. Yahoo Life What's behind the crying, screaming 'Karen' meltdowns that keep going viral? Experts explain As ""Karens"" continue to go viral for their over-the-top behavior, Yahoo Life speaks with experts in psychology, sociology and race to understand what's behind the archetype. 36403,640 reactions Lifestyle Best Products You Have to See These Beautiful Places Around the World Check out these global beauties.From Best Products 5959 reactions Celebrity House Beautiful Prince Harry Made Another Move Away From His Former Status as a Senior Royal Harry is HRH no longer. Everything We Know About Meghan Markle and Prince Harry’s Battle With the Tabloids Glamour Meghan Markle ""Honored"" to Have Her Guest-Edited Vogue Issue Recognized Town & Country 1313 reactions Trending Now 1. Black Lives Matter 2. Paulina Gretzky 3. Coronavirus 4. Spongebob Squarepants 5. Karen Videos 6. Cheap SUV Deals 7. American Idol 8. Jillian Wuestenberg 9. Vehicle Donations 10. Blank Invoices Print Weather United States View your Locations Remove from favorite locations Detect my location Enter City or Zipcode Manage Locations Today 90°73° SatThunderstorms today with a high of 89 °F (31.7 °C) and a low of 71 °F (21.7 °C). 89°71° SunSunny today with a high of 92 °F (33.3 °C) and a low of 71 °F (21.7 °C). 92°71° MonThunderstorms today with a high of 93 °F (33.9 °C) and a low of 70 °F (21.1 °C). 93°70°More on Yahoo Weather Popular Searches Asthma Treatment Alaska Cruises Horoscope Cancer6/21 - 7/22 Leo7/23 - 8/22 Virgo8/23 - 9/22 Libra9/23 - 10/22 Scorpio10/23 - 11/21 Sagittarius11/22 - 12/21 Capricorn12/22 - 1/19 Aquarius1/20 - 2/18 Pisces2/19 - 3/20 Aries3/21 - 4/19 Taurus4/20 - 5/20 Gemini5/21 - 6/20 Cancer(change) July 3 - Give yourself a present -- from a new toy to an afternoon at the spa. Your energy needs to be re-grounded, and you are the only one who can do that. It's a good time to reconnect with your inner child. See more » Terms (Updated) Privacy (Updated) Privacy dashboard Acceptable Use Policy Advertise Advertising Choices Feedback © 2020 AT&T Intellectual Property All rights reserved. AT&T and Globe logo are registered trademarks of AT&T Intellectual Property. Close this content, you can also use the Escape key at anytime"
