,crawl_date,domain,url,mime_type_web_server,mime_type_tika,language,content
260126,20200925,currently.att.yahoo.com,https://currently.att.yahoo.com/,text/html,text/html,en,"Currently.com - AT&T Yahoo Email, News, Sports & More AT&T Search Powered by Yahoo Skip to Navigation Skip to Main Content Skip to Related Content Sign in Mail Sign in to view your mail Mail Get AT&T MailFREE News Finance Sports Entertainment Lifestyle Weather myAT&T More... Breaking News: U.S. tops more than 7 million coronavirus cases Deputy sentenced for sex with ex-boyfriend's son Shauna Bishop, a former Sacramento County sheriff's deputy, pleaded guilty in July to sexually molesting the 16-year-old son of an ex-boyfriend.She is ordered to surrender Dec. 11 » Dad loses jobs after taking bullet to protect kids Fisherman hooks corpse in Central Park lake Man run over by his own van, killed trying to stop robbery Ginsburg's trainer honors her with pushups by casket Pizza delivery driver, 89, gets huge tip surprise U.S. CNN Lawyer says cop shot Jacob Blake after hearing a mother's desperate plea: 'He's got my kid. He's got my keys' Police Officer Rusten Sheskey has told investigators that it wasn't just his life he was defending when he fired his weapon seven times at Jacob Blake last month in Kenosha, Wisconsin. He said he used deadly force during the chaotic encounter because he was afraid Blake, while attempting to flee the scene, was trying to kidnap a child in the backseat of the vehicle. News Bleacher Report Video Krack Loves the Over in Cowboys-Seahawks A wild 70% of games the first two week hit the over, but is the under due to crash soon News Bleacher Report Video How to Bet MNF? Even though it makes him feel a bit square, Krack loves the OVER (52.5) in Ravens vs. Chiefs News Bleacher Report Video Who to Bet on in Steelers vs. Texans? Krack tells us the Sharp action this week is on the Texans (+4 or +5 depending on line fluctuations) Sports Bleacher Report Video NBA Stars on Their Bubble Experiences Giannis, Harden, Melo and more describe their time in Florida. Watch now and don't miss ‘The Arena’ on TNT Thursday at 7pm ET 🎥 Politics The Telegraph Donald Trump unveils his 'America First' healthcare plan Donald Trump announced his long-awaited health care plan on Thursday as he seeks to fulfill a campaign promise before the presidential election. The US president vowed to protect people with pre-existing medical conditions, a key part of the Obama-era healthcare legislation which his administration is attempting to strike down, as well as calling for an end to surprise medical billing. Mr Trump unveiled his healthcare ""vision"" during a speech in Charlotte, North Carolina, a key swing state in this year's race, saying his ""America First healthcare plan"" would deliver quality health care at a ""much lower cost"" to the public. Mr Trump has repeatedly attacked the Affordable Care Act, the signature healthcare policy signed into law by President Barack Obama, and promised to repeal and replace it with an alternative healthcare plan during his first term. Health The Telegraph New coronavirus mutation could be evolving to get around mask-wearing and hand-washing Covid-19 may have become more contagious as it has mutated, the largest genetic study carried out in the US into the virus has suggested, as scientists warn it could be adapting to interventions such as mask-wearing and social distancing. One variant of the novel coronavirus is now one of the most dominant in America, accounting for 99.9 per cent of cases in one area studied. The paper concluded that a mutation that changes the structure of the “spike protein” on the surface of the virus may be driving the outsized spread of that particular strain. Researchers have been sequencing the genomes of the coronavirus at Houston Methodist, one of the largest hospitals in Texas, since early March, when the virus first appeared in the city. To date, they have documented 5,085 sequences. In the first wave of the outbreak in Houston around March, some 71 per cent of the viruses were characterised by the mutation, which originated in China and is known as D614G. By the second wave, which began in May and is ongoing, the D614G mutation leaped to 99.9 per cent prevalence. A tiny tweak in the spike protein of the dominant variant switches an amino acid from aspartic acid to glycine. The new mutation appears to be outdistancing all of its competitors. The graphic below explains more. Coronavirus mutating to survive and spread faster, scientists believe The Independent Coronavirus continuing to mutate, study finds, as US cases rise The Guardian Trending Now 1. Ruth Bader Ginsburg 2. Christina Aguilera 3. Coronavirus 4. Fleetwood Mac 5. CPAP Store Online 6. Garnet Hill Catalog 7. Heather Locklear 8. Plexiglass Barriers 9. Star Trek 10. Gal Gadot Weather San Francisco View your Locations Remove from favorite locations Detect my location Enter City or Zipcode Manage Locations TodayDay: Breezy with a high of 69 °F (20.6 °C). Winds from WSW to W at 12 to 19 mph (19.3 to 30.6 kph). Night: Clear. Winds variable at 2 to 20 mph (3.2 to 32.2 kph). The overnight low will be 60 °F (15.6 °C). 69°58° SatMostly sunny today with a high of 73 °F (22.8 °C) and a low of 60 °F (15.6 °C). 73°60° SunSunny today with a high of 77 °F (25.0 °C) and a low of 60 °F (15.6 °C). 77°60° MonSunny today with a high of 79 °F (26.1 °C) and a low of 63 °F (17.2 °C). 79°63°More on Yahoo Weather Scoreboard Change Sports to display different scoresNBA NFL MLB NHL NCAAB NCAAF Trending Yesterday Today Tomorrow Miami Boston 5:30 PM PDT Tampa Bay Dallas 5:00 PM PDT Chi Cubs Chi White Sox 5:10 PM PDT LA Angels LA Dodgers 6:40 PM PDT Philadelphia Tampa Bay 3:40 PM PDT Cincinnati Minnesota 5:10 PM PDTMore scores » Popular Searches Probiotics Luxury Perfumes Horoscope Libra9/23 - 10/22 Scorpio10/23 - 11/21 Sagittarius11/22 - 12/21 Capricorn12/22 - 1/19 Aquarius1/20 - 2/18 Pisces2/19 - 3/20 Aries3/21 - 4/19 Taurus4/20 - 5/20 Gemini5/21 - 6/20 Cancer6/21 - 7/22 Leo7/23 - 8/22 Virgo8/23 - 9/22 Libra(change) September 25 - You feel a bit out of sorts today, not quite sick, not quite depressed, but certainly not at your best. The good news is that this is a brief phase. Things should be great in a day or two. See more » Terms (Updated) Privacy (Updated) Do Not Sell My Personal Information Acceptable Use Policy Advertise Advertising Choices Feedback © 2020 AT&T Intellectual Property All rights reserved. AT&T and Globe logo are registered trademarks of AT&T Intellectual Property. Close this content, you can also use the Escape key at anytime"
271354,20201003,currently.att.yahoo.com,https://currently.att.yahoo.com/,text/html,text/html,en,"Currently.com - AT&T Yahoo Email, News, Sports & More AT&T Search Powered by Yahoo Skip to Navigation Skip to Main Content Skip to Related Content Sign in Mail Sign in to view your mail Mail Get AT&T MailFREE News Finance Sports Entertainment Lifestyle Weather myAT&T More... Firefighters save American flag from wildfire flames Firefighters from Fremont Fire Department Engine 558 saved an American flag from the flames at the Fairwinds Estate Winery in Calistoga, Calif.'We were able to save the flag' » How serious is Trump's risk for severe illness? Trump held fundraiser after top aide tested positive Trump heads to hospital after virus diagnosis Biden tweets after Trump tests positive for COVID-19 Trump's positive virus test creates fresh upheaval Sports Bleacher Report Sue Bird Sets WNBA Finals Assist Record as Storm Beat Aces in Game 1 The Seattle Storm's first victory over the Las Vegas Aces this season couldn't have come at a better time. Breanna Stewart and Seattle took down the No. 1 seed Aces, 93-80, in Game 1 of the WNBA Finals to grab a 1-0 lead in the best-of-five series... World The Telegraph Thousands of animals found dead in Chinese depot after being bought online as pets Some 4,000 pet dogs, rabbits, cats and hamsters that were purchased online have been found dead in boxes at a processing hub in central China after being stranded there for nearly a week, according to an animal welfare group. The group Utopia Animal Rescue said they managed to save just over 1,000 animals but the remainder had perished by the time they arrived at the Dongxing facility in Luohe, Henan province earlier this month. “We’ve done rescues before but this was the first time I had experienced something this tragic,” one volunteer with the group told the South China Morning Post. “When we got there, there were several small mountains of boxes containing animals. Many of them were dead and had started to rot and give off terrible smells,” she said. The incident has once more raised concerns about the lack of regulation of online pet sales in China, where live animals can be bought and sold online with relative ease. Celebrity Evening Standard Shia LaBeouf charged with theft after 'stealing a man’s hat' in LA Shia LaBeouf has been charged after allegedly stealing a man’s hat in Los Angeles.The actor, who has starred in films including Transformers and The Peanut Butter Falcon, is alleged to have argued with a man named Tyler Murphy on June 12. Science Popular Mechanics These Snakes Take Their Prey Down in the Most Savage Way Warning: it gets graphic. And gross. Style Harper's Bazaar Demi Moore Serves in Black Lace in Rihanna's Savage x Fenty Show She makes an appearance with Bella Hadid. Video Savage X Fenty Show Vol. 2 (Trailer 2) Internet Video Archive Bella Hadid Looked Looked a ’90s Supermodel at the Savage x Fenty Show STYLECASTER U.S. The Telegraph Driver dies during a land speed record attempt at airfield A driver has died during a British land speed record attempt. A full investigation is to take place into the circumstances of the incident at Elvington Airfield to the east of York on Thursday afternoon. North Yorkshire Police said they were called out to a ""serious collision"" at the airfield shortly after 4.30pm. A spokesman said that officers and the ambulance service were at the scene. He added: ""Please do not try to access the airfield at this time."" A Motorsport UK spokesman said: ""Further information will be provided once the initial findings of the investigation are available. ""Our thoughts are with the driver's family, who have been informed, the organisers of the event, and other members of the motorsport community present."" Motorsport UK said that it was working with the event organiser and North Yorkshire Police on the investigation. Elvington Airfield was the scene of a crash involving former Top Gear presenter Richard Hammond in 2006. The 50-year-old was left in a coma for two weeks and with brain injuries after crashing a jet-powered car. The privately-owned venue, which is an active airfield, is also a facility for driving, driver training, filming and other testing purposes for professional organisations. Driver dies trying to break British Land Speed Record at Elvington Airfield The Independent Zef Eisenberg death: Maximuscle founder killed in land speed record bid The Independent Celebrity Evening Standard Chrissy Teigen's mother sobs as she cradles grandson Jack in heartbreaking hospital video after star's misscarriage Chrissy Teigen's mother Vilailuck has shared a heartbreaking video of herself crying over the loss of her grandson.Chrissy announced on Wednesday that she had tragically lost her third child around halfway into her pregnancy , days after she was admitted to the hospital. Stars send condolences to Chrissy Teigen and John Legend after heartbreaking baby news Evening Standard Chrissy Teigen Sharing Her Pregnancy Loss Helps Women Like Me Feel Less Alone The Oprah Magazine Trending Now 1. Fred Gerteiny 2. Michelle Mulitz 3. Coronavirus 4. Heather Graham 5. Olivia Wilde 6. 2020 Honda Accord 7. Liv Tyler 8. Life Extensions 9. Alison Victoria 10. Food Delivered Weather San Francisco View your Locations Remove from favorite locations Detect my location Enter City or Zipcode Manage Locations Today 79°62° SatSunny today with a high of 76 °F (24.4 °C) and a low of 61 °F (16.1 °C). 76°61° SunPartly cloudy today with a high of 69 °F (20.6 °C) and a low of 58 °F (14.4 °C). 69°58° MonMostly cloudy today with a high of 68 °F (20.0 °C) and a low of 57 °F (13.9 °C). 68°57°More on Yahoo Weather Scoreboard Change Sports to display different scoresNBA NFL MLB NHL NCAAB NCAAF Trending Yesterday Today Tomorrow Miami LA Lakers 8 14 7:25 1st St. Louis San Diego 0 1 Top 6th Miami Chi Cubs 2 0 Final Louisiana Tech Brigham Young 0 7 9:45 1st 1. FSV Mainz 05 1. FC Union Berlin 0 4 Final Campbell Wake Forest 7 45 4:45 3rdMore scores » Popular Searches Meal Delivery Service Installment Loans Horoscope Libra9/23 - 10/22 Scorpio10/23 - 11/21 Sagittarius11/22 - 12/21 Capricorn12/22 - 1/19 Aquarius1/20 - 2/18 Pisces2/19 - 3/20 Aries3/21 - 4/19 Taurus4/20 - 5/20 Gemini5/21 - 6/20 Cancer6/21 - 7/22 Leo7/23 - 8/22 Virgo8/23 - 9/22 Libra(change) October 3 - Take a second look. Things aren't quite what they seem. You may find that people have been hiding something from you, but their intentions are almost certainly good. The truth can set you free! See more » Terms (Updated) Privacy (Updated) Do Not Sell My Personal Information Acceptable Use Policy Advertise Advertising Choices Feedback © 2020 AT&T Intellectual Property All rights reserved. AT&T and Globe logo are registered trademarks of AT&T Intellectual Property. Close this content, you can also use the Escape key at anytime"
284029,20201009,currently.att.yahoo.com,https://currently.att.yahoo.com/,text/html,text/html,en,"Currently.com - AT&T Yahoo Email, News, Sports & More AT&T Search Powered by Yahoo Skip to Navigation Skip to Main Content Skip to Related Content Sign in Mail Sign in to view your mail Mail Get AT&T MailFREE News Finance Sports Entertainment Lifestyle Weather myAT&T More... Judge allows Derek Chauvin to leave Minnesota The former Minneapolis police officer charged with killing George Floyd will be allowed to move out of Minnesota while he awaits trial.Safety concerns cited » Diabetes drug recalled due to high levels of toxin Man tried to resurrect dead grandmother: police Trump Jr. removes mask to pose with kids during rally Ex-general shares warning about a 2nd Trump term Priest arrested for sex on church altar Celebrity Bleacher Report Ex-WWE superstar indicted on kidnapping, sexual assault charges A two-time WWE champion, two-time world heavyweight champion, two-time U.S. champion, one-time Royal Rumble winner and one-time Money in the Bank winner. News Bleacher Report Video Week 5 Lookahead on 'Your Fantasy Fire Drill' @TheMattCamp returns Sunday to help you with your lineup decisions. Ask your questions in the comments section now 📲 News Bleacher Report Video LeBron Dunk vs. Houston LeBron Dunk vs. Houston Entertainment BUILD Video The X Change Rate: Jonathan Bennett In ""The X Change Rate,"" award-winning drag queen, entertainer and TV personality Monét X Change brings her signature wit, heart and style to BUILD Series. Monét sat down to chat with actor Jonathan Bennett about starring in the upcoming, first gay Hallmark movie, ""The Christmas House,"" his career and more. Politics The Telegraph Exclusive swing state polling shows Biden pulling away after debate and Trump's coronavirus Joe Biden is pulling away from Donald Trump in key swing states after the president’s combative debate performance and his positive test for coronavirus, new polling for The Telegraph has found. The share of voters saying they back the Democratic presidential nominee has jumped in four of the six states Mr Trump won by the narrowest margins in 2016, according to research taken after both events. The responses suggest that far from the US president closing the polling gap by which he has trailed Mr Biden for much of the year it is actually widening as the race enters its final few weeks. Mr Trump will be hoping either the polls are proved wrong again, as they were in 2016, turnout among his supporters far exceeds his rival or something happens between now and November 3 to cause a major rethink among voters. Redfield & Wilton Strategies has been polling six battleground states for The Telegraph throughout the campaign to reveal the state of the race where it matters most. NBC News Among Outlets Chasing Trump Town Hall On Debate Night Variety Second presidential debate now cancelled after Trump refused to take part The Independent Entertainment Total Film Magazine The 27 best movies on Amazon Prime to watch right now (October 2020) Having a night in? Then kick back with one of the best movies on Amazon Prime The 5 best Amazon deals you can get this Tuesday USA TODAY How to cancel your Amazon Prime account Yahoo Finance Celebrity Good Housekeeping Valerie Bertinelli Shared Never-Before-Seen Photos From the Night She Met Eddie Van Halen The two were married for more than two decades. Alex Winter explains how Eddie Van Halen left his mark on Bill & Ted franchise The Independent Black Sabbath’s Tony Iommi on Eddie Van Halen: ‘He Was Always an Inventor’ Rolling Stone Trending Now 1. Vote by mail 2. Suzanne Morphew 3. Register to vote 4. Cole Sprouse 5. Steve Buscemi 6. Barx Buddy 7. Tiger Woods 8. Kendall Jenner 9. Walmart Check Reorder 10. BoardVitals Weather San Francisco View your Locations Remove from favorite locations Detect my location Enter City or Zipcode Manage Locations TodayDay: Partly cloudy with a high of 61 °F (16.1 °C). Winds WSW at 11 mph (17.7 kph). Night: Mostly clear. Winds variable at 2 to 9 mph (3.2 to 14.5 kph). The overnight low will be 58 °F (14.4 °C). 62°57° SatMostly cloudy today with a high of 64 °F (17.8 °C) and a low of 59 °F (15.0 °C). 64°59° SunSunny today with a high of 68 °F (20.0 °C) and a low of 58 °F (14.4 °C). 68°58° MonSunny today with a high of 72 °F (22.2 °C) and a low of 58 °F (14.4 °C). 72°58°More on Yahoo Weather Scoreboard Change Sports to display different scoresNBA NFL MLB NHL NCAAB NCAAF Trending Yesterday Today Tomorrow Miami LA Lakers 6:00 PM PDT NY Yankees Tampa Bay 4:10 PM PDT Arizona St. Oregon Louisville Georgia Tech 4:00 PM PDT Sudan Cameroon Oct 9 Los Angeles Football Club Columbus Crew 4:30 PM PDTMore scores » Popular Searches Euro Vacation Structured Settlements Horoscope Libra9/23 - 10/22 Scorpio10/23 - 11/21 Sagittarius11/22 - 12/21 Capricorn12/22 - 1/19 Aquarius1/20 - 2/18 Pisces2/19 - 3/20 Aries3/21 - 4/19 Taurus4/20 - 5/20 Gemini5/21 - 6/20 Cancer6/21 - 7/22 Leo7/23 - 8/22 Virgo8/23 - 9/22 Libra(change) October 9 - Dig into life's little pleasures today. Things might not be perfectly stable now, but at least you know how to enjoy the time you've got on earth. Show someone else how to do it! See more » Terms (Updated) Privacy (Updated) Do Not Sell My Personal Information Acceptable Use Policy Advertise Advertising Choices Feedback © 2020 AT&T Intellectual Property All rights reserved. AT&T and Globe logo are registered trademarks of AT&T Intellectual Property. Close this content, you can also use the Escape key at anytime"
295592,20201016,currently.att.yahoo.com,https://currently.att.yahoo.com/,text/html,text/html,en,"Currently.com - AT&T Yahoo Email, News, Sports & More AT&T Search Powered by Yahoo Skip to Navigation Skip to Main Content Skip to Related Content Sign in Mail Sign in to view your mail Mail Get AT&T MailFREE News Finance Sports Entertainment Lifestyle Weather myAT&T More... 'It's crazy': Record avalanche of early votes Nearly 21 million Americans have already cast ballots in the 2020 election, a record-shattering avalanche of early votes that has transformed the way the nation votes.Majority might cast ballots before Election Day for 1st time » Trump retweets bogus story about Twitter Foster father accused of sex abuse gets 2nd chance Melania reacts to ex-friend's tell-all book News anchor fired over 'Hubie Halloween' cameo Senator's hug doesn't go over well News Teacher beheaded on public street in suspected terror attack The attack near a school in a Parisian suburb occurred after the teacher apparently showed caricatures of the prophet Muhammad to his students. Politics The Independent Phil Collins serves Trump with a cease and desist order after ‘In the Air Tonight’ plays at rally Singer joins a long list of musicians to oppose Trump’s use of their songs World The Telegraph Three women who acted like a 'pack of animals' when they attacked trainee nurse avoid jail Three women who ripped a trainee nurse's hair out by the roots in a ferocious attack, have been spared jail despite being described as behaving like a pack of animals. Hollie-Louise Brown was set upon outside a nightspot in Ashington, Northumberland in September 2018 in a motiveless attack. She was first attacked by Donna Goulding, 25, with whom she had had a long-standing feud, after they bumped into each other on the dance floor, Newcastle Crown Court heard. Chloe Cummings, 29, and Toni Tyler, 30, then joined in the attack, which started inside the premises and carried on in the street after security staff intervened to remove them from the bar. Ms Brown lost large clumps of hair, was kicked, had her finger bitten, eyes gouged and suffered bruises to her arms and face. World The Telegraph Teacher beheaded in Paris suburb after showing cartoons of Prophet Mohammed to class A history teacher who showed his pupils cartoons of the Prophet Mohammed in class was beheaded near his school in a Paris suburb on Friday by a suspected Islamist terrorist who shouted “Allahu Akbar"", police said. Alerted by local residents, police confronted and shot dead a man armed with a kitchen knife and an air gun who refused to drop his weapons and surrender, and threatened them. Minutes later, officers found the body of the male teacher. A bomb disposal unit was called in to check whether the presumed assailant was wearing a suicide vest or belt. Witnesses told police they heard the assailant shouting “Allahu Akbar” [‘God is the greatest’ in Arabic], police sources said. The teacher had received death threats after giving a class on freedom of expression, during which he showed pupils the controversial cartoons, a police source said. The presumed killer was reported to be an 18-year-old Chechen, the sources said. Paris attack: Teacher ‘decapitated’ in suspected terrorist incident, police say The Independent Teacher decapitated in France after showing Mohammed cartoons AFP U.S. Popular Mechanics ANOTHER Mysterious Jetpack Man Spotted Flying 6,000 Feet Over LAX What the hell is happening in the skies above Los Angeles? 'Only in LA': Pilots report person flying with jetpack at 6,000ft in second sighting in six weeks The Telegraph Airline pilot reports jetpack flier near LAX — again CBS News Sports Cycling News Tour of Flanders Women 2020 - Start List Provisional starters as of October 16, 2020 Van der Poel 'not losing sleep' over Van Aert rivalry ahead of Tour of Flanders Cycling News Four teams out of Women's Tour of Flanders, including defending champion Bastianelli Cycling News Politics The Independent Ice Cube defends working for Trump’s team in run-up to election: ‘Every side is the Darkside’ President’s campaign adviser thanked rapper for ‘willingness to step up’ Ice Cube and his willfully ignorant and dangerous call to action TheGrio Video Ice Cube on Role in Developing Trump Campaign's 'Platinum Plan' for Black America | Billboard News Billboard.com Trending Now 1. Early voting 2. Scarlett Johansson 3. How to vote 4. Sandra Bullock 5. Shop Disney Online 6. CallRail 7. Marla Adams 8. Chevrolet Silverado 1500 9. Elizabeth Hurley 10. Shay Shariatzadeh Weather San Francisco View your Locations Remove from favorite locations Detect my location Enter City or Zipcode Manage Locations TodayDay: Sunny with a high of 89 °F (31.7 °C). Winds WNW at 9 mph (14.5 kph). Night: Clear. Winds variable at 2 to 14 mph (3.2 to 22.5 kph). The overnight low will be 63 °F (17.2 °C). 89°67° SatSunny today with a high of 79 °F (26.1 °C) and a low of 63 °F (17.2 °C). 79°63° SunMostly sunny today with a high of 71 °F (21.7 °C) and a low of 58 °F (14.4 °C). 71°58° MonPartly cloudy today with a high of 68 °F (20.0 °C) and a low of 57 °F (13.9 °C). 68°57°More on Yahoo Weather Scoreboard Change Sports to display different scoresNBA NFL MLB NHL NCAAB NCAAF Trending Yesterday Today Tomorrow Houston Tampa Bay 0 0 End 2nd LA Dodgers Atlanta 6:08 PM PDT SMU Tulane 10 7 0:39 1st Brigham Young Houston 6:30 PM PDT Bahia Goiás 4:00 PM PDT FC Juárez Mazatlán 7:30 PM PDTMore scores » Popular Searches Allergy Relief Plus Size Swimwear Horoscope Libra9/23 - 10/22 Scorpio10/23 - 11/21 Sagittarius11/22 - 12/21 Capricorn12/22 - 1/19 Aquarius1/20 - 2/18 Pisces2/19 - 3/20 Aries3/21 - 4/19 Taurus4/20 - 5/20 Gemini5/21 - 6/20 Cancer6/21 - 7/22 Leo7/23 - 8/22 Virgo8/23 - 9/22 Libra(change) October 16 - You're flirting shamelessly with someone who is amazed at the attention. Your terrific energy might scare them a little, but it's mixed with delight, so who knows where this may lead? See more » Terms (Updated) Privacy (Updated) Do Not Sell My Personal Information Acceptable Use Policy Advertise Advertising Choices Feedback © 2020 AT&T Intellectual Property All rights reserved. AT&T and Globe logo are registered trademarks of AT&T Intellectual Property. Close this content, you can also use the Escape key at anytime"
