,crawl_date,domain,url,mime_type_web_server,mime_type_tika,language,content
6686,20200417,currently.att.yahoo.com,https://currently.att.yahoo.com/,text/html,text/html,en,"Currently.com - AT&T Yahoo Email, News, Sports & More AT&T Search Powered by Yahoo Skip to Navigation Skip to Main Content Skip to Related Content Sign in Mail Sign in to view your mail Mail News Finance Sports Entertainment Lifestyle Weather myAT&T More... Coronavirus: Over 2.1M confirmed cases with more than 146K deaths globallyRead more Bezos signs off letter with unexpected quote Amazon CEO and billionaire Jeff Bezos rounded off this year's shareholder letter with a quote from children's book author Dr. Seuss.What the quote said » 991 people reacting Scottie Pippen reveals he is 'no longer employed' by Bulls China's epicenter Wuhan raises virus death toll by 50% 10 states hit hardest by pandemic job losses Dr. Oz walks back controversial comments Experts reveal the 3 steps to ending the virus lockdown News CNN A 'giant' of New Orleans culture and 'scholar of the people' dies of coronavirus When a man like Ronald Lewis dies there's supposed to be brass bands marching the streets, sharply dressed members of the New Orleans social clubs falling in behind the musicians, and Mardi Gras Indians dancing alongside them in their elaborately beaded suits. Start the conversation Celebrity Yahoo TV Kylie Jenner gets surgery on her eyes because she can't see daughter Stormi's face On ""KUWTK,"" Kylie opens up about her post-pregnancy vision problems: ""It's starting to just affect my daily life."" Kris Jenner Hand Fed Kylie Tacos After Lasik Surgery Entertainment Tonight Videos Kylie Jenner shuts down body-shamers who said she looked 'better' before giving birth The Independent 163163 reactions Celebrity Cosmopolitan Harry and Meghan Are Spotted for the First Time Since Moving to Los Angeles The couple dressed in masks and delivered food. 3131 reactions Health The Conversation Coronavirus: heavy use of hand sanitisers could boost antimicrobial resistance Misuse of common cleaning products or hand sanitisers can lead to antimcrobial resistance in bacteria. 5555 reactions World The Telegraph Police name intelligence analyst who was killed while cycling to work A Scotland Yard intelligence analyst was killed after two vehicles collided with her bike as she cycled to work. Rachel Brown, 25, was commuting through Worcester Park, Greater London, when the crash occurred just before 9am on April 7. Despite the efforts of police, London Ambulance Service paramedics and members of the public, she was pronounced dead at the scene. There have been no arrests made and all parties remained at the site of the incident, according to Scotland Yard. The Metropolitan Police confirmed that Ms Brown, originally from Staines, Middlesex, was a member of staff, though they would not say in what capacity. It is understood that she had worked in the forces analytical unit. Friends described her as a “talented and very special young woman” who helped domestic assault victims in London through her work. On a Facebook tribute page for Ms Brown, Gemma Charge, her friend and former colleague, said: “Rachel, you were a beautiful, talented and very special young woman. From the moment you joined our team, your energy and drive was such an inspiration. It was a joy and a privilege to have you in my team.” Ms Brown, who studied law at Queen's University Belfast, was also known as a keen rower who represented Staines Boat Club senior women's team for several years. The university's rowing club said: “Yet whilst she was both a talented and technical oarswoman, Rachel was also a popular crew member, loved and appreciated by so many for her bright nature, her kind heart, her constant encouragement and her colourful kit.” 2626 reactions Politics GeekWire Gates Foundation’s CEO worries about pandemic politics — and says ‘we have nothing to hide’ Seattle's Bill & Melinda Gates Foundation is in the public health spotlight, thanks to its efforts to head off just the sort of global pandemic we're now experiencing — but not all the exposure it's getting is healthy. In some corners of the online world, the Gates Foundation is painted as a villain, stoking fears and pushing a global vaccination agenda for the sake of ""Big Pharma."" Anti-vaccine activists link Microsoft co-founder Bill Gates with the World Health Organization and infectious-disease expert Anthony Fauci — and not in a good way. The conspiracy theories have always been there, but Gates… Read More Trumpists Believe Bill Gates Is Using Coronavirus to Implant Brain Chips The Daily Beast 'Covid-19 does not obey border laws', says Bill Gates, donates $150 million more Hindustan Times 7070 reactions World Harper's Bazaar The 15 Skincare Products Our Editors Are Shopping Right Now These must-haves will make you look good and feel good.From Harper's BAZAAR The Best Gifts for Husbands Harper's Bazaar The Best Summer Jackets Harper's Bazaar 11 reaction Business The Guardian EasyJet weighs up empty middle seats once coronavirus rules ease EasyJet weighs up empty middle seats once coronavirus rules easeCEO says drop in passenger demand will make option more viable when travel restrictions lift * Coronavirus – latest updates * See all our coronavirus coverage Founder of easyJet calls for CEO and chairman to go Reuters India Coronavirus positive: good news round-up - a glimpse of normality returning The Telegraph 1313 reactions Trending Now 1. Dakota Fanning 2. Coronavirus 3. Robin Wright 4. Kourtney Kardashian 5. Ron Perlman 6. Omaha Steaks Deals 7. Michelle Pfeiffer 8. Humana Medicare 9. Camila Cabello 10. Mortgage Rates Refinance San Francisco View your Locations Remove from favorite locations Detect my location Enter City or Zipcode Manage Locations Today 57°52° Sat 59°54° Sun 57°53° Mon 57°53° Popular Searches Cell Phone Plans Meal Delivery Service Horoscope Aries3/21 - 4/19 Taurus4/20 - 5/20 Gemini5/21 - 6/20 Cancer6/21 - 7/22 Leo7/23 - 8/22 Virgo8/23 - 9/22 Libra9/23 - 10/22 Scorpio10/23 - 11/21 Sagittarius11/22 - 12/21 Capricorn12/22 - 1/19 Aquarius1/20 - 2/18 Pisces2/19 - 3/20 Aries(change) April 17 - Even for an independent spirit like you, working as part of a team can be very beneficial now. People appreciate your willingness to take risks and challenge assumptions. At times, they'll try reining you in, but that's only because they want to get the timing of a project just right. If you're willing to slow your pace just a little, you can create something fresh and dynamic. After taking the first steps, make a strategic retreat. Watch and listen to how people react to your work. Their feedback today can help you turn something good into something great. See more » Terms (Updated) Privacy (Updated) Do not sell my info Acceptable Use Policy Advertise Advertising Choices Feedback © 2020 AT&T Intellectual Property All rights reserved. AT&T and Globe logo are registered trademarks of AT&T Intellectual Property. Close this content, you can also use the Escape key at anytime"
18149,20200504,currently.att.yahoo.com,https://currently.att.yahoo.com/,text/html,text/html,en,"Currently.com - AT&T Yahoo Email, News, Sports & More AT&T Search Powered by Yahoo Skip to Navigation Skip to Main Content Skip to Related Content Sign in Mail Sign in to view your mail Mail News Finance Sports Entertainment Lifestyle Weather myAT&T More... Coronavirus: Latest news and updates on the pandemicRead more Predecessor's call for unity leads to attack from Trump In a tweet, President Trump quoted a Fox News commentator who said George W. Bush was ""nowhere to be found"" during Trump's impeachment hearing.Bush praises health care workers » 17,537 people reacting Country singer Cady Groves dead at 30 Black man was chased, killed while jogging, mother says 373 workers at a pork plant test positive for coronavirus Demi Lovato wows fans with makeup-free, swimsuit selfie Deadly giant 'murder hornets' arrive in U.S. for first time News Bleacher Report Spike Lee 'Was Completely Surprised' Michael Jordan's Nike Commercial 'Blew Up' Spike Lee starred in and directed one of the most famous shoe commercials in history, but he didn't think it would become as popular as it did... Start the conversation World The Telegraph Bodies on the streets and presidents in denial: how Latin America is emerging as a new virus epicentre Bodies pile up in the city of Manaus, northern Brazil, as the town is brought to its knees by the Covid-19 pandemic. The local health system collapsed over two weeks ago, while gravediggers resorted to burying the dead in mass graves known as ""trenches."" A shortage of gravediggers forced one family to bury their father themselves, after spending three days searching for his body among the heaps of corpses. ""There were lots of bodies on top of each other, without any identification"", said one man, speaking to the local press. Brazil is fast becoming the new epicentre of the Covid-19 crisis in Latin America, with the daily death toll now beginning to outstrip some of the worst affected countries in Europe. 3232 reactions Entertainment The Independent 50 Cent says ‘enemy’ Oprah Winfrey was ‘completely against everything that was in my music’ 50 Cent has said that he deliberately became “enemies” with Oprah Winfrey after she condemned his lyrics on her US talk show.In his new book, Hustle Harder, Hustle Smarter, the rapper recalls wanting to be on Winfrey’s show when he first came to fame, to prove to his grandmother that he had achieved greatness. 44 reactions Science The Telegraph China releases animation mocking US response to coronavirus outbreak China has published a short animation titled ""Once Upon a Virus"" mocking the US response to the new coronavirus using Lego-like figures to represent the two countries. Washington and Beijing are locked in a war of words over the origins of the disease, which emerged in the Chinese city of Wuhan and has grown into a global pandemic. US President Donald Trump said on Thursday he was confident the coronavirus may have originated in a Chinese virology lab, but declined to describe the evidence. In the animation posted online by China's official Xinhua news agency, red curtains open to reveal a stage featuring Lego-like figures in the form of a terracotta warrior wearing a face mask and the Statue of Liberty. ""We discovered a new virus,"" says the warrior. ""So what?"" replies the Statue of Liberty. ""It's only a flu."" 202202 reactions Lifestyle Good Housekeeping You Can Still Buy Face Masks Online If You Don't Feel Like DIYing One Just make sure the mask you get is following these recommendations from the CDC. 1414 reactions Lifestyle Esquire Coronavirus Ground Zero: 'In 12 Days, the World Had Turned Upside Down' In this exclusive Hearst Magazines portfolio, meet the everyday heroes treating patients, cleaning rooms, and comforting families at the height of the COVID-19 outbreak in New York City. 11 reaction U.S. Quartz Coronavirus hasn’t killed the anti-vax movement On May 1, the Freedom Angels Foundation, a group that opposes mandatory vaccines, led a protest of hundreds of people in Sacramento, California, demanding the end to the state's lockdown restrictions. This group represents a branch of anti-vaccination protestors who emphasize individual autonomy and strongly resist government oversight. They use the same arguments rejecting mandatory vaccines to push back against the ongoing mandatory lockdowns. 1212 reactions Lifestyle The Mighty How It Feels Being Quarantined at Home With My 3 Adult Kids During the Pandemic A mother of three adult children describes their experience while under quarantine together. 184184 reactions Trending Now 1. William Shatner 2. Coronavirus 3. Mary Steenburgen 4. Adrienne Bailon 5. Car Insurance Cost 6. 2020 Cadillac XT5 7. Jane Levy 8. Free Taxes 9. Natalie Portman 10. Abby Hornacek United States View your Locations Remove from favorite locations Detect my location Enter City or Zipcode Manage Locations Today 75°61° Tue 71°54° Wed 71°50° Thu 64°48° Popular Searches Probiotics Dental Implants Horoscope Taurus4/20 - 5/20 Gemini5/21 - 6/20 Cancer6/21 - 7/22 Leo7/23 - 8/22 Virgo8/23 - 9/22 Libra9/23 - 10/22 Scorpio10/23 - 11/21 Sagittarius11/22 - 12/21 Capricorn12/22 - 1/19 Aquarius1/20 - 2/18 Pisces2/19 - 3/20 Aries3/21 - 4/19 Taurus(change) May 4 - It's possible your well-being is flourishing right now, thanks to mindful decisions you've been making about your health regimen. This newfound vibrancy acts as a powerful attractant to others; dont be surprised if you get several queries from a job site. Instead of trying to fit in with your idea of success, focus on distinguishing yourself from the crowd. Originality is your strong suit, so emphasize it. If youve been thinking about changing your image in some way, put your dream into motion. Even the slightest change could do you a world of good. See more » Terms (Updated) Privacy (Updated) Do not sell my info Acceptable Use Policy Advertise Advertising Choices Feedback © 2020 AT&T Intellectual Property All rights reserved. AT&T and Globe logo are registered trademarks of AT&T Intellectual Property. Close this content, you can also use the Escape key at anytime"
21972,20200515,currently.att.yahoo.com,https://currently.att.yahoo.com/,text/html,text/html,en,"Currently.com - AT&T Yahoo Email, News, Sports & More AT&T Search Powered by Yahoo Skip to Navigation Skip to Main Content Skip to Related Content Sign in Mail Sign in to view your mail Mail News Finance Sports Entertainment Lifestyle Weather myAT&T More... Coronavirus: Latest news and updates on the pandemic Video footage suggests new twist in Arbery shooting Security camera footage taken in December outside a house construction site raises new questions about what Ahmaud Arbery was doing at the site.'It now appears that ... ' » 8,405 people reacting Barber who refused to close tests positive Fighter jet crashes at Air Force base Trump touts new 'super-duper missile' House nears passage of $3 trillion virus relief bill Zach Hoffpauir, former Stanford safety, dies at 26 News Bleacher Report Jalen Brunson Didn't Want Jordan Autograph to Ruin Wizards Jersey at Age 6 If ESPN's The Last Dance has proved anything, it's shown just how difficult it was to score an autograph from Michael Jordan . Even more stunning is the idea that someone would turn down an autograph from His Airness... Start the conversation Politics The Telegraph 'Obamagate': Donald Trump calls for Barack Obama to testify and wants officials to be 'jailed for 50 years' Donald Trump has called for Barack Obama to be hauled before Congress, and for his predecessor's officials to be ""jailed for 50 years"". The US president has defined as ""Obamagate"" an episode involving the ""unmasking"" of his first national security adviser Michael Flynn after his name appeared in redacted form in intelligence reports related to Russia. He claims that, during the presidential transition period at the end of 2016, the Obama administration abused its power for political reasons in targeting Mr Flynn. Mr Trump appeared set to make it an issue in the upcoming election campaign. He told Fox Business that senior Obama officials should ""have been in jail a long time ago, and I'm talking with 50-year sentences. It is a disgrace what's happened. This is the greatest political scam, hoax in the history of our country."" The president added: ""People should be going to jail for this stuff and hopefully, a lot of people are going to have to pay."" Mr Obama responded by tweeting: ""Vote."" Judge Napolitano on Flynn 'unmasking,' Wisconsin Supreme Court striking down state state-at-home order FOX News Videos What You Need To Know About The Flynn, Biden And 'Unmasking' Story www.kosu.org 445445 reactions Entertainment Evening Standard Katy Perry bares her baby bump as she goes nude in new video Pregnant Katy Perry reveals her baby bump as she goes nude in her latest music video.The pop star, 35, is expecting her first child with actor fiance Orlando Bloom and is preparing for the release of her new album in August. Watch Pregnant Katy Perry's Magical “Daisies” Music Video E! Online Katy Perry Shares Empowering New Song 'Daisies' From Upcoming Fifth Album 101.5 The River 5353 reactions Celebrity Yahoo Celebrity Melissa Etheridge's son Beckett dies: David Crosby says it's 'not true' that he was just a 'donor' After retweeting a story with the sad news, Crosby replied to a commenter who “respectfully” posted that Crosby was merely a “donor” for Etheridge and her former partner Julie Cypher. Melissa Etheridge's son dies at 21 of opioid addiction Arizona Daily Sun Melissa Etheridge's daughter pays tribute to brother after his death at 21 TODAY.com 20042,004 reactions Science Yahoo Style UK Coronavirus: Scientists want to investigate if mouthwash kills the infection Ingredients in oral rinses may inactivate the pathogen in the throat, researchers said. 10921,092 reactions Science Popular Mechanics The Magnetic North Pole Is Rapidly Moving Because of Some Blobs It started in Canada and now it's inching closer to Siberia. Thanks a lot, blobs. 99 reactions World The Conversation Coronavirus: crime cartels helping communities will extract a high price in years to come Many governments can't afford to offer the sort of economic stimulus we've seen in the west, and organised crime is only too happy to fill the gap. 4545 reactions Lifestyle Epicurious 37 Best Easy Cookie Recipes to Make Again and Again Discover delicious (but easy) cookies to make the next time you're in the mood for something sweet. Originally Appeared on Epicurious 1717 reactions Trending Now 1. Maya Hawke 2. Coronavirus 3. Sarah Chalke 4. Michelle Dockery 5. Avocado Green Mattress 6. Best Stocks 7. Garcelle Beauvais 8. Jennifer Aniston 9. RTA Kitchen Cabinets 10. Kourtney Kardashian United States View your Locations Remove from favorite locations Detect my location Enter City name Manage Locations Today 72°60° Sat 75°64° Sun 74°61° Mon 68°53° Popular Searches Scar Removal Cream Website Builder Horoscope Taurus4/20 - 5/20 Gemini5/21 - 6/20 Cancer6/21 - 7/22 Leo7/23 - 8/22 Virgo8/23 - 9/22 Libra9/23 - 10/22 Scorpio10/23 - 11/21 Sagittarius11/22 - 12/21 Capricorn12/22 - 1/19 Aquarius1/20 - 2/18 Pisces2/19 - 3/20 Aries3/21 - 4/19 Taurus(change) May 15 - Pursuing your dreams may become an obsession while driven Mars is urging you to realize your tremendous potential. Unless youre involved with work that truly captivates your soul, you could feel listless and irritable. Instead of mindlessly checking things off your to-do list, focus on a creative project, fitness goal, or career objective that gives you excitement. You may even get what you want through sheer charisma with the Sun moving through your 1st House of Self. Its trine to influential Pluto today can turn the tide in your favor. See more » Terms (Updated) Privacy (Updated) Privacy dashboard Acceptable Use Policy Advertise Advertising Choices Feedback © 2020 AT&T Intellectual Property All rights reserved. AT&T and Globe logo are registered trademarks of AT&T Intellectual Property. Close this content, you can also use the Escape key at anytime"
