,crawl_date,domain,url,mime_type_web_server,mime_type_tika,language,content
195946,20200824,dr.library.brocku.ca,https://dr.library.brocku.ca/handle/10464/13923,text/html,text/html,en,"Letter from Harold L. Grout to Gladys Drope Toggle navigation Login Toggle navigation View Item Repository Home Archives & Special Collections Archival Resources William Henry Nelles Hull Family Fonds, 1794-2013, n.d. RG 667 View Item Repository Home Archives & Special Collections Archival Resources William Henry Nelles Hull Family Fonds, 1794-2013, n.d. RG 667 View Item JavaScript is disabled for your browser. Some features of this site may not work without it. Letter from Harold L. Grout to Gladys Drope View/Open 1_911May_1916p1.jpg (283.4Kb) 1_911May_1916p2.jpg (901.2Kb) 1_911May_1916p3.jpg (856.3Kb) 1_911May_1916p4.jpg (888.4Kb) 1_911May_1916p5.jpg (769.8Kb) Date 1916-05-11 Author Grout, Harold L. Metadata Show full item record Abstract A letter from a soldier, Harold L. Grout to Gladys Drope. In the letter, Grout discusses the ""76th"" and their location at Shorncliffe. He mentions Lake Lodge, ""You seem to be losing all your boys from 'Lake Lodge'. I hope this war doesn't last till they all have to go. Some say the first 7 years of it will be the worst. Hoping you are all well and remember me to all my friends at L.L. Yours sincerely, Driver Harold L. Grout 302189"". URI http://hdl.handle.net/10464/13923 Collections William Henry Nelles Hull Family Fonds, 1794-2013, n.d. RG 667 Brock University | Copyright © 2006-2015 Contact Us | Send Feedback Search Everything This Collection Browse All of DSpaceCommunities & CollectionsBy Issue DateAuthorsTitlesSubjectsThis CollectionBy Issue DateAuthorsTitlesSubjects My Account LoginRegister Statistics View Usage Statistics Brock University | Copyright © 2006-2015 Contact Us | Send Feedback"
195948,20200824,dr.library.brocku.ca,https://dr.library.brocku.ca/handle/10464/13922,text/html,text/html,en,"Post card to Gladys Drope Toggle navigation Login Toggle navigation View Item Repository Home Archives & Special Collections Archival Resources William Henry Nelles Hull Family Fonds, 1794-2013, n.d. RG 667 View Item Repository Home Archives & Special Collections Archival Resources William Henry Nelles Hull Family Fonds, 1794-2013, n.d. RG 667 View Item JavaScript is disabled for your browser. Some features of this site may not work without it. Post card to Gladys Drope View/Open 1_9War_Postcardp1.jpg (211.1Kb) 1_9War_Postcardp2.jpg (319.7Kb) Date 1916-04-09 Metadata Show full item record Abstract A post card with an image of a soldier kissing the cheek of a girl. The post card is titled ""Tommy's Farewell"". The reverse of the post card is a brief message that is mostly faded. A couple of the lines read ""So I hope you will like this card seeing it came from France."" The card also mentions the trenches, but the writing is faded. URI http://hdl.handle.net/10464/13922 Collections William Henry Nelles Hull Family Fonds, 1794-2013, n.d. RG 667 Brock University | Copyright © 2006-2015 Contact Us | Send Feedback Search Everything This Collection Browse All of DSpaceCommunities & CollectionsBy Issue DateAuthorsTitlesSubjectsThis CollectionBy Issue DateAuthorsTitlesSubjects My Account LoginRegister Statistics View Usage Statistics Brock University | Copyright © 2006-2015 Contact Us | Send Feedback"
195950,20200824,dr.library.brocku.ca,https://dr.library.brocku.ca/handle/10464/13939,text/html,text/html,en,"Photograph - Edward and Gladys Hull Toggle navigation Login Toggle navigation View Item Repository Home Archives & Special Collections Archival Resources William Henry Nelles Hull Family Fonds, 1794-2013, n.d. RG 667 View Item Repository Home Archives & Special Collections Archival Resources William Henry Nelles Hull Family Fonds, 1794-2013, n.d. RG 667 View Item JavaScript is disabled for your browser. Some features of this site may not work without it. Photograph - Edward and Gladys Hull View/Open 2_26Ed_GladysWedding.jpg (227.2Kb) Date 1925 Metadata Show full item record Abstract A wedding photograph of Edward and Gladys Hull, 1925. URI http://hdl.handle.net/10464/13939 Collections William Henry Nelles Hull Family Fonds, 1794-2013, n.d. RG 667 Brock University | Copyright © 2006-2015 Contact Us | Send Feedback Search Everything This Collection Browse All of DSpaceCommunities & CollectionsBy Issue DateAuthorsTitlesSubjectsThis CollectionBy Issue DateAuthorsTitlesSubjects My Account LoginRegister Statistics View Usage Statistics Brock University | Copyright © 2006-2015 Contact Us | Send Feedback"
195952,20200824,dr.library.brocku.ca,https://dr.library.brocku.ca/handle/10464/13937,text/html,text/html,en,"Photograph - Drope Children Toggle navigation Login Toggle navigation View Item Repository Home Archives & Special Collections Archival Resources William Henry Nelles Hull Family Fonds, 1794-2013, n.d. RG 667 View Item Repository Home Archives & Special Collections Archival Resources William Henry Nelles Hull Family Fonds, 1794-2013, n.d. RG 667 View Item JavaScript is disabled for your browser. Some features of this site may not work without it. Photograph - Drope Children View/Open 2_23DropeChildren2.jpg (439.2Kb) Date 1903 Metadata Show full item record Abstract A photograph of the Drope children (Harold, Gordon, Gladys) ca. 1903. URI http://hdl.handle.net/10464/13937 Collections William Henry Nelles Hull Family Fonds, 1794-2013, n.d. RG 667 Brock University | Copyright © 2006-2015 Contact Us | Send Feedback Search Everything This Collection Browse All of DSpaceCommunities & CollectionsBy Issue DateAuthorsTitlesSubjectsThis CollectionBy Issue DateAuthorsTitlesSubjects My Account LoginRegister Statistics View Usage Statistics Brock University | Copyright © 2006-2015 Contact Us | Send Feedback"
195954,20200824,dr.library.brocku.ca,https://dr.library.brocku.ca/handle/10464/14002,text/html,text/html,en,"Photograph - Football Team, 1919 Toggle navigation Login Toggle navigation View Item Repository Home Archives & Special Collections Archival Resources William Henry Nelles Hull Family Fonds, 1794-2013, n.d. RG 667 View Item Repository Home Archives & Special Collections Archival Resources William Henry Nelles Hull Family Fonds, 1794-2013, n.d. RG 667 View Item JavaScript is disabled for your browser. Some features of this site may not work without it. Photograph - Football Team, 1919 View/Open O_16FootballTeam1919.jpg (2.188Mb) Date 1919 Metadata Show full item record Abstract A photograph a football team (Lake Lodge School?). There is a list of names on the bottom of the photograph, including: T.A.C. Jones, W. Townsend, B. Peene, R. Watkins, J. Phin, N. Andrewes, W. Brown, H. Dawe, B. Baker, G. Eastman, W. Williams, F. Scarlett, K. Joyner, J. Atkins, E. Stock, J. Morris and L. Venning. URI http://hdl.handle.net/10464/14002 Collections William Henry Nelles Hull Family Fonds, 1794-2013, n.d. RG 667 Brock University | Copyright © 2006-2015 Contact Us | Send Feedback Search Everything This Collection Browse All of DSpaceCommunities & CollectionsBy Issue DateAuthorsTitlesSubjectsThis CollectionBy Issue DateAuthorsTitlesSubjects My Account LoginRegister Statistics View Usage Statistics Brock University | Copyright © 2006-2015 Contact Us | Send Feedback"
196045,20200824,dr.library.brocku.ca,https://dr.library.brocku.ca/handle/10464/13956,text/html,text/html,en,"The Grimsby Preparatory School for Young Boys: Lake Lodge, Grimsby, Ont. Toggle navigation Login Toggle navigation View Item Repository Home Archives & Special Collections Archival Resources William Henry Nelles Hull Family Fonds, 1794-2013, n.d. RG 667 View Item Repository Home Archives & Special Collections Archival Resources William Henry Nelles Hull Family Fonds, 1794-2013, n.d. RG 667 View Item JavaScript is disabled for your browser. Some features of this site may not work without it. The Grimsby Preparatory School for Young Boys: Lake Lodge, Grimsby, Ont. View/Open 4_10Lake_Lodge_Booklet.pdf (2.692Mb) Date n.d. Metadata Show full item record Abstract A booklet about Lake Lodge School titled ""The Grimsby Preparatory School for Young Boys"". It mentions ""the object of this school is to prepare young boys for admission to the High Schools and the larger boarding Schools. In addition to this they are trained to habits of morality, manliness and integrity, and are furnished a comfortable home free from evil influences."" There are also sections describing the following: course of study, religious instruction, record, prizes, athletics, cricket, fees, hours of study, sessions, vacation, and list of boys past and present. URI http://hdl.handle.net/10464/13956 Collections William Henry Nelles Hull Family Fonds, 1794-2013, n.d. RG 667 Brock University | Copyright © 2006-2015 Contact Us | Send Feedback Search Everything This Collection Browse All of DSpaceCommunities & CollectionsBy Issue DateAuthorsTitlesSubjectsThis CollectionBy Issue DateAuthorsTitlesSubjects My Account LoginRegister Statistics View Usage Statistics Brock University | Copyright © 2006-2015 Contact Us | Send Feedback"
196047,20200824,dr.library.brocku.ca,https://dr.library.brocku.ca/handle/10464/13932,text/html,text/html,en,"Photograph - Gordon, William, and Harold Drope Toggle navigation Login Toggle navigation View Item Repository Home Archives & Special Collections Archival Resources William Henry Nelles Hull Family Fonds, 1794-2013, n.d. RG 667 View Item Repository Home Archives & Special Collections Archival Resources William Henry Nelles Hull Family Fonds, 1794-2013, n.d. RG 667 View Item JavaScript is disabled for your browser. Some features of this site may not work without it. Photograph - Gordon, William, and Harold Drope View/Open 2_15Photo_Gordan_William_Harold_Dropep1.jpg (382.4Kb) 2_15Photo_Gordan_William_Harold_Dropep2.jpg (493.3Kb) Date n.d. Metadata Show full item record Abstract A copy of a photograph showing (from left to right) Gordon, William and Harold Drope. William Drope is seated in the centre with the boys standing on either side of him. URI http://hdl.handle.net/10464/13932 Collections William Henry Nelles Hull Family Fonds, 1794-2013, n.d. RG 667 Brock University | Copyright © 2006-2015 Contact Us | Send Feedback Search Everything This Collection Browse All of DSpaceCommunities & CollectionsBy Issue DateAuthorsTitlesSubjectsThis CollectionBy Issue DateAuthorsTitlesSubjects My Account LoginRegister Statistics View Usage Statistics Brock University | Copyright © 2006-2015 Contact Us | Send Feedback"
196049,20200824,dr.library.brocku.ca,https://dr.library.brocku.ca/handle/10464/13974,text/html,text/html,en,"Old Boys and Girls Reunion Edition - The Independent, 1921 Toggle navigation Login Toggle navigation View Item Repository Home Archives & Special Collections Archival Resources William Henry Nelles Hull Family Fonds, 1794-2013, n.d. RG 667 View Item Repository Home Archives & Special Collections Archival Resources William Henry Nelles Hull Family Fonds, 1794-2013, n.d. RG 667 View Item JavaScript is disabled for your browser. Some features of this site may not work without it. Old Boys and Girls Reunion Edition - The Independent, 1921 View/Open 4_28Old_Boys_Girlsp1.jpg (5.116Mb) 4_28Old_Boys_Girlsp2.jpg (6.936Mb) 4_28Old_Boys_Girlsp3.jpg (8.226Mb) 4_28Old_Boys_Girlsp4.jpg (6.999Mb) Date 1921-08-24 Metadata Show full item record Abstract An issue of Old Boys and Girls Reunion Edition - The Independent, focused on Grimsby, 24 August, 1921. The first page of the issue includes photographs of several men and brief descriptions of their roles in Grimsby Village. The men featured include: W.J. Drope, H. H. Marsh, William Mitchell, John H. Grout, W. F. Randall, Charles H. Bromley, David Allen, Lieut. J. A. M. Livingston, John C. Farrell. Inside are several photographs of ""scenes in and around Grimsby Village"". Some of the photographs included are: Factory Number 7 Dominion Canners, Village Inn, Plant of the Canadian Stoves, Grimsby Public School, Memorial Gates at Lake Lodge School, Hotel Grimsby, Canning Factory of the Grimsby Fruit Growers, Basket Factory and more. URI http://hdl.handle.net/10464/13974 Collections William Henry Nelles Hull Family Fonds, 1794-2013, n.d. RG 667 Brock University | Copyright © 2006-2015 Contact Us | Send Feedback Search Everything This Collection Browse All of DSpaceCommunities & CollectionsBy Issue DateAuthorsTitlesSubjectsThis CollectionBy Issue DateAuthorsTitlesSubjects My Account LoginRegister Statistics View Usage Statistics Brock University | Copyright © 2006-2015 Contact Us | Send Feedback"
196051,20200824,dr.library.brocku.ca,https://dr.library.brocku.ca/handle/10464/13930,text/html,text/html,en,"Photograph - J.W. Drope Toggle navigation Login Toggle navigation View Item Repository Home Archives & Special Collections Archival Resources William Henry Nelles Hull Family Fonds, 1794-2013, n.d. RG 667 View Item Repository Home Archives & Special Collections Archival Resources William Henry Nelles Hull Family Fonds, 1794-2013, n.d. RG 667 View Item JavaScript is disabled for your browser. Some features of this site may not work without it. Photograph - J.W. Drope View/Open 2_15JW_Drope_Class1889.jpg (332.7Kb) Date 1889 Metadata Show full item record Abstract A photograph of J. W. ""Will"" Drope, Class of 1889, Victoria College. There is a note on the photograph that reads ""Uncle Will, mothers brother"" URI http://hdl.handle.net/10464/13930 Collections William Henry Nelles Hull Family Fonds, 1794-2013, n.d. RG 667 Brock University | Copyright © 2006-2015 Contact Us | Send Feedback Search Everything This Collection Browse All of DSpaceCommunities & CollectionsBy Issue DateAuthorsTitlesSubjectsThis CollectionBy Issue DateAuthorsTitlesSubjects My Account LoginRegister Statistics View Usage Statistics Brock University | Copyright © 2006-2015 Contact Us | Send Feedback"
196202,20200824,dr.library.brocku.ca,https://dr.library.brocku.ca/handle/10464/13948,text/html,text/html,en,"Photograph - Barn at Lake Lodge Toggle navigation Login Toggle navigation View Item Repository Home Archives & Special Collections Archival Resources William Henry Nelles Hull Family Fonds, 1794-2013, n.d. RG 667 View Item Repository Home Archives & Special Collections Archival Resources William Henry Nelles Hull Family Fonds, 1794-2013, n.d. RG 667 View Item JavaScript is disabled for your browser. Some features of this site may not work without it. Photograph - Barn at Lake Lodge View/Open 4_19Barn_Lake_Lodge.jpg (476.5Kb) 4_19Barn_Lake_Lodge_back.jpg (331.1Kb) Date n.d. Metadata Show full item record Abstract A photograph of a ""Barn at Lake Lodge used to house American prisoners during War of 1812"". Another note mentions that the barn will be dismantled to be replaced by a new one ""early 20th century"" URI http://hdl.handle.net/10464/13948 Collections William Henry Nelles Hull Family Fonds, 1794-2013, n.d. RG 667 Brock University | Copyright © 2006-2015 Contact Us | Send Feedback Search Everything This Collection Browse All of DSpaceCommunities & CollectionsBy Issue DateAuthorsTitlesSubjectsThis CollectionBy Issue DateAuthorsTitlesSubjects My Account LoginRegister Statistics View Usage Statistics Brock University | Copyright © 2006-2015 Contact Us | Send Feedback"
196204,20200824,dr.library.brocku.ca,https://dr.library.brocku.ca/handle/10464/13999,text/html,text/html,en,"Photograph - Cricket Team Lake Lodge School, 1922 Toggle navigation Login Toggle navigation View Item Repository Home Archives & Special Collections Archival Resources William Henry Nelles Hull Family Fonds, 1794-2013, n.d. RG 667 View Item Repository Home Archives & Special Collections Archival Resources William Henry Nelles Hull Family Fonds, 1794-2013, n.d. RG 667 View Item JavaScript is disabled for your browser. Some features of this site may not work without it. Photograph - Cricket Team Lake Lodge School, 1922 View/Open O_15Cricket_Team1922p1.jpg (1.921Mb) O_15Cricket_Team1922p2.jpg (1.726Mb) Date 1922 Metadata Show full item record Abstract A photograph of the cricket team at Lake Lodge school in 1922. The individuals in the photograph are named: ""Back row - G. McKune, M. Lounsbury, T. Taylor, K. Joyner, C. Joyner, Front row - T. A. C. Jones, Esq, J. Morris (Captain), G. Foster, J. Barregar, G. Clapperton, M. Frankland, J. Atkins, C. Andrewes"". URI http://hdl.handle.net/10464/13999 Collections William Henry Nelles Hull Family Fonds, 1794-2013, n.d. RG 667 Brock University | Copyright © 2006-2015 Contact Us | Send Feedback Search Everything This Collection Browse All of DSpaceCommunities & CollectionsBy Issue DateAuthorsTitlesSubjectsThis CollectionBy Issue DateAuthorsTitlesSubjects My Account LoginRegister Statistics View Usage Statistics Brock University | Copyright © 2006-2015 Contact Us | Send Feedback"
196206,20200824,dr.library.brocku.ca,https://dr.library.brocku.ca/handle/10464/13998,text/html,text/html,en,"Photograph - Cricket Team Lake Lodge School, 1916 Toggle navigation Login Toggle navigation View Item Repository Home Archives & Special Collections Archival Resources William Henry Nelles Hull Family Fonds, 1794-2013, n.d. RG 667 View Item Repository Home Archives & Special Collections Archival Resources William Henry Nelles Hull Family Fonds, 1794-2013, n.d. RG 667 View Item JavaScript is disabled for your browser. Some features of this site may not work without it. Photograph - Cricket Team Lake Lodge School, 1916 View/Open O_15Cricket_Team1916.jpg (1.836Mb) Date 1916 Metadata Show full item record Abstract A photograph of the cricket team in front of Lake Lodge School. There are eleven boys and three adults in the photograph. One of the adults appears to be W.J. Drope. URI http://hdl.handle.net/10464/13998 Collections William Henry Nelles Hull Family Fonds, 1794-2013, n.d. RG 667 Brock University | Copyright © 2006-2015 Contact Us | Send Feedback Search Everything This Collection Browse All of DSpaceCommunities & CollectionsBy Issue DateAuthorsTitlesSubjectsThis CollectionBy Issue DateAuthorsTitlesSubjects My Account LoginRegister Statistics View Usage Statistics Brock University | Copyright © 2006-2015 Contact Us | Send Feedback"
196208,20200824,dr.library.brocku.ca,https://dr.library.brocku.ca/handle/10464/13947,text/html,text/html,en,"Photograph - Lake Lodge Rowers Toggle navigation Login Toggle navigation View Item Repository Home Archives & Special Collections Archival Resources William Henry Nelles Hull Family Fonds, 1794-2013, n.d. RG 667 View Item Repository Home Archives & Special Collections Archival Resources William Henry Nelles Hull Family Fonds, 1794-2013, n.d. RG 667 View Item JavaScript is disabled for your browser. Some features of this site may not work without it. Photograph - Lake Lodge Rowers View/Open 4_19Rowing_Lake_Lodge1928p1.jpg (482.0Kb) 4_19Rowing_Lake_Lodge1928p2.jpg (539.3Kb) Date 1928 Metadata Show full item record Abstract A photograph of an 8 person team of rowers with one coxswain (Ron Wilford). There is a list of the rowers included: Coxswain Ron Wilford, Stroke Bert Arnott, 7. Tom Rymer, 6. Bill Thom, 5. Al Evans, 4. Herbert Hawley, 3. Freddy Fidler, 2. Carl Warner, Bow Harry Harper. URI http://hdl.handle.net/10464/13947 Collections William Henry Nelles Hull Family Fonds, 1794-2013, n.d. RG 667 Brock University | Copyright © 2006-2015 Contact Us | Send Feedback Search Everything This Collection Browse All of DSpaceCommunities & CollectionsBy Issue DateAuthorsTitlesSubjectsThis CollectionBy Issue DateAuthorsTitlesSubjects My Account LoginRegister Statistics View Usage Statistics Brock University | Copyright © 2006-2015 Contact Us | Send Feedback"
196210,20200824,dr.library.brocku.ca,https://dr.library.brocku.ca/handle/10464/13950,text/html,text/html,en,"Photograph - Cricket Team Lake Lodge School, 1908 Toggle navigation Login Toggle navigation View Item Repository Home Archives & Special Collections Archival Resources William Henry Nelles Hull Family Fonds, 1794-2013, n.d. RG 667 View Item Repository Home Archives & Special Collections Archival Resources William Henry Nelles Hull Family Fonds, 1794-2013, n.d. RG 667 View Item JavaScript is disabled for your browser. Some features of this site may not work without it. Photograph - Cricket Team Lake Lodge School, 1908 View/Open 4_19Cricket_team_Lake_Lodge1908p1.jpg (222.3Kb) 4_19Cricket_team_Lake_Lodge1908p2.jpg (308.1Kb) Date 1908 Metadata Show full item record Abstract A photograph of the junior Lake Lodge School cricket team, 1908. On the reverse of the photograph are some of the names of the team. There is also a caption that reads ""Lake Lodge School Junior Cricket Team 1908. Picture taken by Mr. Drope at Gran Trunk Railway Station, Grimsby, while waiting for train to St. Catharines for game with Ridley. Back Row: Harold Drope, Mrs. Drope, Archibald Minhinic, Burns, Billy Bailey, Willison Nelles, Cyril Pinney, White, Stewart. Front Row: Gordon Drope, Bailey (Mascot), Lawrence Clubb, 'Mose' Stewart, Allen Nelles."" URI http://hdl.handle.net/10464/13950 Collections William Henry Nelles Hull Family Fonds, 1794-2013, n.d. RG 667 Brock University | Copyright © 2006-2015 Contact Us | Send Feedback Search Everything This Collection Browse All of DSpaceCommunities & CollectionsBy Issue DateAuthorsTitlesSubjectsThis CollectionBy Issue DateAuthorsTitlesSubjects My Account LoginRegister Statistics View Usage Statistics Brock University | Copyright © 2006-2015 Contact Us | Send Feedback"
196212,20200824,dr.library.brocku.ca,https://dr.library.brocku.ca/handle/10464/13952,text/html,text/html,en,"Photograph - Lake Lodge Hockey Team Toggle navigation Login Toggle navigation View Item Repository Home Archives & Special Collections Archival Resources William Henry Nelles Hull Family Fonds, 1794-2013, n.d. RG 667 View Item Repository Home Archives & Special Collections Archival Resources William Henry Nelles Hull Family Fonds, 1794-2013, n.d. RG 667 View Item JavaScript is disabled for your browser. Some features of this site may not work without it. Photograph - Lake Lodge Hockey Team View/Open 4_18Lake_Lodge_Hockey.jpg (261.9Kb) Date n.d. Metadata Show full item record Abstract A photograph of the Lake Lodge hockey team. The photograph features, H. Cope, W. Page, W. Parker, F. Lindsay, V. Woodhall, E.H. Hull, W. Reynolds, W. Shore, R. Timms and D. Owen. URI http://hdl.handle.net/10464/13952 Collections William Henry Nelles Hull Family Fonds, 1794-2013, n.d. RG 667 Brock University | Copyright © 2006-2015 Contact Us | Send Feedback Search Everything This Collection Browse All of DSpaceCommunities & CollectionsBy Issue DateAuthorsTitlesSubjectsThis CollectionBy Issue DateAuthorsTitlesSubjects My Account LoginRegister Statistics View Usage Statistics Brock University | Copyright © 2006-2015 Contact Us | Send Feedback"
196214,20200824,dr.library.brocku.ca,https://dr.library.brocku.ca/handle/10464/13953,text/html,text/html,en,"Photograph -  Lake Lodge Choir Toggle navigation Login Toggle navigation View Item Repository Home Archives & Special Collections Archival Resources William Henry Nelles Hull Family Fonds, 1794-2013, n.d. RG 667 View Item Repository Home Archives & Special Collections Archival Resources William Henry Nelles Hull Family Fonds, 1794-2013, n.d. RG 667 View Item JavaScript is disabled for your browser. Some features of this site may not work without it. Photograph - Lake Lodge Choir View/Open 4_18Lake_Lodge_Choir.jpg (347.5Kb) Date n.d. Metadata Show full item record Abstract A photograph of the Lake Lodge School Choir. URI http://hdl.handle.net/10464/13953 Collections William Henry Nelles Hull Family Fonds, 1794-2013, n.d. RG 667 Brock University | Copyright © 2006-2015 Contact Us | Send Feedback Search Everything This Collection Browse All of DSpaceCommunities & CollectionsBy Issue DateAuthorsTitlesSubjectsThis CollectionBy Issue DateAuthorsTitlesSubjects My Account LoginRegister Statistics View Usage Statistics Brock University | Copyright © 2006-2015 Contact Us | Send Feedback"
196216,20200824,dr.library.brocku.ca,https://dr.library.brocku.ca/handle/10464/13951,text/html,text/html,en,"Photograph - Lake Lodge School Cadets Toggle navigation Login Toggle navigation View Item Repository Home Archives & Special Collections Archival Resources William Henry Nelles Hull Family Fonds, 1794-2013, n.d. RG 667 View Item Repository Home Archives & Special Collections Archival Resources William Henry Nelles Hull Family Fonds, 1794-2013, n.d. RG 667 View Item JavaScript is disabled for your browser. Some features of this site may not work without it. Photograph - Lake Lodge School Cadets View/Open 4_18Lake_Lodge_Cadets.jpg (421.7Kb) Date 1930s Metadata Show full item record Abstract A photograph of some Lake Lodge cadets. The photograph is from the early 1930s before the school closed in 1933 due to the depression. URI http://hdl.handle.net/10464/13951 Collections William Henry Nelles Hull Family Fonds, 1794-2013, n.d. RG 667 Brock University | Copyright © 2006-2015 Contact Us | Send Feedback Search Everything This Collection Browse All of DSpaceCommunities & CollectionsBy Issue DateAuthorsTitlesSubjectsThis CollectionBy Issue DateAuthorsTitlesSubjects My Account LoginRegister Statistics View Usage Statistics Brock University | Copyright © 2006-2015 Contact Us | Send Feedback"
