,crawl_date,domain,url,mime_type_web_server,mime_type_tika,language,content
41392,20200626,durhamregion.com,https://www.durhamregion.com/news-story/9937576-opp-urges-ontarians-not-to-travel-on-weekend-citing-coronavirus-fight/,text/html,application/xhtml+xml,en,"OPP urges Ontarians not to travel on weekend, citing coronavirus fight | DurhamRegion.com Top Stories Top Stories More News More News"
42112,20200626,durhamregion.com,https://www.durhamregion.com/community-story/9913556-salt-painting-shirley-temples-and-more-tips-to-keep-kids-happy-at-home/,text/html,application/xhtml+xml,en,"Salt painting, shirley temples and more tips to keep kids happy at home | DurhamRegion.com Top Stories Top Stories More News More News"
319200,20201030,durhamregion.com,https://www.durhamregion.com/,text/html,text/html,en,"Durham Region News - Latest Daily Breaking News Stories | DurhamRegion.com Save.caHomefinder.caWheels.ca loading... Sign In Show Navigation 4°CFriday Oct 30 Close Navigation Local news Local newsBusinessCrimeCouncilCannabis And YouCommunity VoicesReaders' ChoiceCoronavirus Crisis Things to do Things to doEvent ListingsFood and DrinkBooks & AuthorsContestsCommunity Voices Opinion OpinionAdviceColumnsCommunity VoicesEditorialLetters Life LifeFashion and beautyHoroscopesPersonal FinanceTravelWellnessCommunity Voices Announcements AnnouncementsAnniversariesBirthdaysBirthsEngagementsGraduationsIn MemoriamObituariesWeddings Marketplace MarketplaceClassifiedsBusiness ListingsCouponsFlyersLocal sales and servicesHousing RentalsJobsReal EstateCars Search Sign In Save.caHomefinder.caWheels.ca Editor's picks Business 'The Tartan goes down as the Tartan': Popular Oshawa pub closing after four decades in business COVID-19 pandemic forces closure of Oshawa Tartan Tavern36 minutes ago News Fifth week of Adam Strong murder trial ends with another missing witness1 hour ago News Scugog family strikes 'Lightning Lotto' luckOct 28, 2020 Business You voted and here are your 2020 Readers' Choice Award Winners2 hours ago News 'Very scary': Should masks be mandatory in Durham's retirement home dining rooms?11 hours ago News Pickering drivers pay more than Ontario average in car insurance11 hours ago Community Things to do: 7 spooky Halloween events for kids in DurhamOct 28, 2020 News How many active cases of COVID-19 are there in Durham schools?Oct 27, 2020 News How many COVID-19 cases are there in Durham Region?Oct 28, 2020 OPEN DIGITAL ACCESS LIVE VIDEO: Ontario Premier Doug Ford provides daily update on COVID-19 October 304 hours ago News 3 stories to update you on COVID-19 in Ontario today1 hour ago Events Fri Oct 30, 2020 Not Important SkillsAjax | 3:00 pm - 4:00 pm Fri Oct 30, 2020 Cancelled - boaa karaoke night in partnership with then and now soundsClarington | 7:00 pm - 10:00 pm Sat Oct 31, 2020 Hallowe'en Home MovieAjax | 10:00 am - 10:30 am Sat Oct 31, 2020 Virtual Tween Tech ClubAjax | 2:00 pm - 2:30 pm Sun Nov 1, 2020 Simcoe Street United Church Worship serviceOshawa | 10:30 am - 11:30 am Post Your Event Events Fri Oct 30, 2020 Not Important SkillsAjax | 3:00 pm - 4:00 pm Fri Oct 30, 2020 Cancelled - boaa karaoke night in partnership with then and now soundsClarington | 7:00 pm - 10:00 pm Sat Oct 31, 2020 Hallowe'en Home MovieAjax | 10:00 am - 10:30 am Sat Oct 31, 2020 Virtual Tween Tech ClubAjax | 2:00 pm - 2:30 pm Post Your Event Things to do Things to do Parade past Santa Claus in Bowmanville COVID-19 won’t cancel event11 hours ago WhatsOn Help the Goodwood Lions support Loaves and FishesOct 29, 2020 Books Local author's new book tells story of NHL team logos, jerseys, namesOct 28, 2020 Things to do COVID cancels Sunderland Remembrance Day servicesOct 23, 2020 Featured News How many COVID-19 cases are there in Durham Region? Durham reported 25 new cases of COVID-19 on Wednesday. As of Oct. 28 authorities were monitoring 240 active cases, with 229 of those people in isolation as they recover at home. As of Sunday, 11 patients were hospitalized, five of them inOct 28, 2020 News How many active cases of COVID-19 are there in Durham schools?Oct 27, 2020 Local Index Durham Region Walk-in & Urgent Care ClinicsNov 01, 2015 Go in depth with our coverage of Back To School in the time of COVID-19Jul 31, 2020 Opinion Opinion Homo sapiens: ‘the only naked ape’ ‘Losing hair was a useful evolutionary trick for keeping cool’Oct 29, 2020 Opinion Leave the Pickering beavers alone11 hours ago Opinion My ex has stayed bitter for years. Can I cut ties? Ask Ellie11 hours ago Horoscopes Horoscope for Friday, Oct. 30, 202013 hours ago Opinion Reader asks, how about a regional tax decrease for onceOct 29, 2020 Coronavirus Crisis Canada Canada aims for 1.2M newcomers in next three years Open arms in an era of closed borders: pandemic-era immigration plan to be released12 minutes ago Ontario Ontario outlines plan to help sport, tourism26 minutes ago Ontario Plan to ease COVID-19 restrictions coming: Ford32 minutes ago Ontario Ontario hospitals say they need funding urgently36 minutes ago Business 'The Tartan goes down as the Tartan': Popular Oshawa pub closing after four decades in business36 minutes ago Life Community 'Night and day' recovery for Brock woman who suffered traumatic brain injury One Brock resident is touting a new health technology that helped her learn to walk again following a traumatic brain injury.Oct 28, 2020 Community School photo day 2020: smiles, masks and sanitizer4 hours ago Wellness Researchers test novel Parkinson's treatment17 hours ago Community Expect a scaled-back COVID Christmas: expertsOct 29, 2020 Community Things to do: 7 spooky Halloween events for kids in DurhamOct 28, 2020 Flyers powered by Vince's Market Dollar Sale 2020Fri Oct 30, 2020 - Thu Nov 12, 2020 SobeysThu Oct 29, 2020 - Wed Nov 4, 2020 SobeysThu Oct 29, 2020 - Wed Nov 4, 2020 RexallFri Oct 30, 2020 - Thu Nov 5, 2020 Pro Hockey LifeFri Oct 30, 2020 - Thu Nov 5, 2020 Canadian TireFri Oct 30, 2020 - Thu Nov 5, 2020 Real estate Business Real estate disrupted by pandemic, says RioCan CEO RioCan says pandemic had less effect on Q3 than Q2 but profit down from last yearOct 29, 2020 News Condo rents may have plunged, but that doesn’t mean Toronto has become more affordableOct 28, 2020 Opinion Need to move fast on a home purchase but aren’t sure how? Try these tipsOct 26, 2020 Opinion When it comes to building homes, time really is money in the Greater Toronto AreaOct 24, 2020 Autos Wheels Review - 2020 Jeep Grand Cherokee Laredo North Edition 4X4 The Jeep Grand Cherokee has been setting a mid-size sport ute benchmark since its debut as a 1993 model. Blending varying degrees of legendary off-road abilities with a graduated list of on-road refinements, this five-passenger pinnacle of the Jeep lOct 28, 2020 Wheels Comparing Running Costs - 2020 MINI Cooper SE vs. 2006 MINI CooperOct 27, 2020 Wheels First Drive - 2021 Nissan RogueOct 26, 2020 Wheels Volvo Car Canada Ltd. announces pricing for its fully electric XC-40 RechargeOct 23, 2020 Headlines Newsletter TOP STORIES, delivered to your inbox. Sign Up Submit Content Submit ContentContact UsGive us feedbackJoin our team Subscribe to The Star Subscribe to The StarSignup for email newslettersFAQsE-editions Place an Ad Place an AdPost an ObituaryPost a ClassifiedFlyer Distribution and Printing About Durhamregion.com About Durhamregion.comCommenting guidelinesTorstar's StoryInvestor Relations Join Us! © Copyright 2020 Metroland Media Group Ltd. All Rights Reserved Metroland NewsAdvertising TermsTerms of useCorporate Privacy PolicyAccessibility Policy"
341988,20201113,durhamregion.com,https://www.durhamregion.com/,text/html,text/html,en,"Durham Region News - Latest Daily Breaking News Stories | DurhamRegion.com Save.caHomefinder.caWheels.ca loading... Sign In Show Navigation 7°CFriday Nov 13 Close Navigation Local news Local newsBusinessCrimeCouncilCannabis And YouCommunity VoicesReaders' ChoiceCoronavirus Crisis Things to do Things to doEvent ListingsFood and DrinkBooks & AuthorsContestsCommunity Voices Opinion OpinionAdviceColumnsCommunity VoicesEditorialLetters Life LifeFashion and beautyHoroscopesPersonal FinanceTravelWellnessCommunity Voices Announcements AnnouncementsAnniversariesBirthdaysBirthsEngagementsGraduationsIn MemoriamObituariesWeddings Marketplace MarketplaceClassifiedsBusiness ListingsCouponsFlyersLocal sales and servicesHousing RentalsJobsReal EstateCars Search Sign In Save.caHomefinder.caWheels.ca Editor's picks OPEN DIGITAL ACCESS 'Immediately stop using': Toy sold at Toys R Us stores across Canada recalled due to choking hazard A toy widely sold at Toys R Us stores in Canada has been recalled over concerns it could create a sharp edge or choking hazard.18 hours ago News Penitentiary time for driver in crash that killed Oshawa cyclist Emily ShieldsNov 12, 2020 News 'Simple measures' can halt rising Durham COVID-19 caseload: doc6 hours ago News Oshawa man with 22 driving bans charged with dangerous driving21 hours ago Community Uxbridge businesses forging ahead amid rising COVID numbersNov 12, 2020 News Ajax house party linked to COVID outbreak in YorkNov 12, 2020 Business 'Very, very exciting:' Company confident of developing Ajax site that will be future Amazon warehouseNov 12, 2020 News How many active cases of COVID-19 are there in Durham schools?Nov 11, 2020 News How many COVID-19 cases are there in Durham Region?21 hours ago News What's going on here: Construction begins at the Pickering GO station6 hours ago News 'Getting ready to open the doors for compassionate care'6 hours ago Events Fri Nov 13, 2020 Dance Social DurhamAjax | 7:00 pm - 10:30 pm Fri Nov 13, 2020 Dance Social Durham!Ajax | 7:00 pm - 10:30 pm Sat Nov 14, 2020 Christmas Drive-Thru Tours10:00 am - 4:00 pm Sat Nov 14, 2020 Cricut Workshop with Lynne LyonClarington | 1:00 pm - 4:00 pm Sat Nov 14, 2020 Dungeon Divers Virtual RPG GroupAjax | 1:00 pm - 4:00 pm Post Your Event Events Fri Nov 13, 2020 Dance Social DurhamAjax | 7:00 pm - 10:30 pm Fri Nov 13, 2020 Dance Social Durham!Ajax | 7:00 pm - 10:30 pm Sat Nov 14, 2020 Christmas Drive-Thru Tours10:00 am - 4:00 pm Sat Nov 14, 2020 Cricut Workshop with Lynne LyonClarington | 1:00 pm - 4:00 pm Post Your Event Things to do Food and Drink #OshawaLovesLocal: What you can do to help Oshawa businesses stay open City's #OshawaLovesLocal campaign aims to support businesses impacted by pandemicNov 12, 2020 WhatsOn 'I’m not Carrie Underwood, it’s like a dream:' TikTok truck challenge drives Uxbridge singer straight to record dealNov 10, 2020 Food and Drink Cold weather, warm outdoor dining at CopperworksNov 10, 2020 Community Pickering teacher creates Canadian content for children's bookNov 10, 2020 Featured Business You voted and here are your 2020 Readers' Choice Award Winners 2020 Readers Choice Award winners announced for Durham RegionOct 30, 2020 News How many COVID-19 cases are there in Durham Region? Local Index Durham Region Walk-in & Urgent Care Clinics Go in depth with our coverage of Back To School in the time of COVID-19 Opinion Opinion Owls are the stealthiest of raptors No owls were identified or photographed for this columnNov 12, 2020 Opinion Owning home ‘should not be penalized or deterred’6 hours ago Opinion He noticed I’d cut my hair, but I couldn’t tell him I was recovering from cancer: Dating Diaries6 hours ago Opinion My friend’s husband just walked out turning his daughters’ world upside down. Ask Ellie6 hours ago Horoscopes Horoscope for Friday, Nov. 13, 20208 hours ago Coronavirus Crisis Business Pandemic pushes Cineplex to $121.2M Q3 loss Cineplex saw 91 per cent fewer moviegoers this summer, sales drop 85 per cent1 hour ago Canada Testing down even as COVID-19 cases soar2 hours ago News How many cases of coronavirus are there in Toronto?2 hours ago News OPP probing Ministry of Education employee after COVID-19 relief funds for families stolen4 hours ago Business AI can help in fight against COVID-19: Bengio5 hours ago Life Community Uxbridge businesses forging ahead amid rising COVID numbers Area businesses bracing for further impacts if new COVID restrictions put in placeNov 12, 2020 Wellness Indigenous-led health centre focuses on culture19 hours ago Wellness Cdn. study touts new alcohol poisoning treatmentNov 12, 2020 sponsored Be winter wise: Carbon monoxide home safety tipsNov 11, 2020 Books Colder months can be perfect time to photograph gardensNov 10, 2020 Flyers powered by Vince's Market Holiday Entertaining Savings Fri Nov 13, 2020 - Thu Nov 26, 2020 SobeysThu Nov 12, 2020 - Wed Nov 18, 2020 SobeysThu Nov 12, 2020 - Wed Nov 18, 2020 Foody MartFri Oct 30, 2020 - Sat Dec 5, 2020 2001 Audio VideoFri Nov 13, 2020 - Thu Nov 19, 2020 Best BuyFri Nov 13, 2020 - Sun Nov 15, 2020 Fashion and beauty Real estate Business Selling a cottage can yield a tricky tax bill Tax issues can become complicated when selling a cottageNov 05, 2020 Business Toronto homebuyers favour suburbs; condos languishNov 04, 2020 News Condo rents may have plunged, but that doesn’t mean Toronto has become more affordableOct 28, 2020 Opinion Need to move fast on a home purchase but aren’t sure how? Try these tipsOct 26, 2020 Autos Wheels First Look - 2021 Yamaha MT-09 the all-new 2021 MT-09 that boasts sharper styling, less weight and more power with boosted performance and handling.50 minutes ago Wheels Review - 2021 Jaguar F-TYPE R Convertible1 hour ago Wheels Review - 2021 Jeep Gladiator MojaveNov 11, 2020 Wheels Review - 2021 Mazda CX-9 KuroNov 11, 2020 Headlines Newsletter TOP STORIES, delivered to your inbox. Sign Up Submit Content Submit ContentContact UsGive us feedbackJoin our team Subscribe to The Star Subscribe to The StarSignup for email newslettersFAQsE-editions Place an Ad Place an AdPost an ObituaryPost a ClassifiedFlyer Distribution and Printing About Durhamregion.com About Durhamregion.comCommenting guidelinesTorstar's StoryInvestor Relations Join Us! © Copyright 2020 Metroland Media Group Ltd. All Rights Reserved Metroland NewsAdvertising TermsTerms of useCorporate Privacy PolicyAccessibility Policy"
352735,20201120,durhamregion.com,https://www.durhamregion.com/,text/html,text/html,en,"Durham Region News - Latest Daily Breaking News Stories | DurhamRegion.com Save.caHomefinder.caWheels.ca loading... Sign In Show Navigation 13°CFriday Nov 20 Close Navigation Local news Local newsBusinessCrimeCouncilCannabis And YouCommunity VoicesReaders' ChoiceCoronavirus Crisis Things to do Things to doEvent ListingsFood and DrinkBooks & AuthorsContestsCommunity Voices Opinion OpinionAdviceColumnsCommunity VoicesEditorialLetters Life LifeFashion and beautyHoroscopesPersonal FinanceTravelWellnessCommunity Voices Announcements AnnouncementsAnniversariesBirthdaysBirthsEngagementsGraduationsIn MemoriamObituariesWeddings Marketplace MarketplaceClassifiedsBusiness ListingsCouponsFlyersLocal sales and servicesHousing RentalsJobsReal EstateCars Search Sign In Save.caHomefinder.caWheels.ca Editor's picks News Whitby man, 61, charged with child pornography, luring The charges, announced Nov. 20, are the result of an investigation that began in October2 hours ago News New case of COVID-19 confirmed at Pickering High School1 hour ago News Doctor says Durham residents waiting too long to get COVID-19 tests5 hours ago Business What’s Going On Here: New plaza closes lanes in Courtice5 hours ago Books Black Oshawa author writes about a world without the slave trade5 hours ago News Durham MPPs vote to scrap 412, 418 tolls23 hours ago News 'It saved me and it could save someone else': Ajax man says new COVID-19 treatment saved his life23 hours ago News COVID-19 outbreak at Ajax elementary schoolNov 18, 2020 Council Collisions down but fatalities remain steady on Durham roads5 hours ago News Pfizer vs. Moderna: Comparing 2 of the top COVID-19 vaccine candidates14 minutes ago News How many cases of coronavirus are there in Toronto?1 hour ago Events Fri Nov 20, 2020 Cancelled boaa social dances with the beech nutsClarington | 1:00 pm - 4:00 pm Fri Nov 20, 2020 Festive NightsUxbridge | 5:00 pm - 8:00 pm Fri Nov 20, 2020 Annual Tree Lighting and Pickering Christmas MarketPickering | 6:00 pm - 9:00 pm Sat Nov 21, 2020 Christmas Food DrivePickering | 11:00 am - 12:00 pm Sat Nov 21, 2020 Saturday Crafternoons: Geronimo StiltonAjax | 1:00 pm - 2:00 pm Post Your Event Events Fri Nov 20, 2020 Cancelled boaa social dances with the beech nutsClarington | 1:00 pm - 4:00 pm Fri Nov 20, 2020 Festive NightsUxbridge | 5:00 pm - 8:00 pm Fri Nov 20, 2020 Annual Tree Lighting and Pickering Christmas MarketPickering | 6:00 pm - 9:00 pm Sat Nov 21, 2020 Christmas Food DrivePickering | 11:00 am - 12:00 pm Post Your Event Things to do Books Black Oshawa author writes about a world without the slave trade Oshawa Black author Solange Burrell used the pandemic lock-down to write her first fiction book imagining a better world — a world without the history of the slave trade. Now she needs the reader’s help to make it a reality.5 hours ago Food and Drink Best places in Durham to get a hot chocolateNov 19, 2020 Things to do Clarington’s Community Christmas Party ‘more Christmasy than COVID’Nov 18, 2020 Things to do Better be good Newcastle, Santa Claus is coming through townNov 15, 2020 Featured Business You voted and here are your 2020 Readers' Choice Award Winners 2020 Readers Choice Award winners announced for Durham RegionOct 30, 2020 News How many COVID-19 cases are there in Durham Region? Local Index Durham Region Walk-in & Urgent Care Clinics Go in depth with our coverage of Back To School in the time of COVID-19 Opinion Opinion Hang a bird feeder to get outside during COVID Take part in Project FeederWatchNov 19, 2020 Opinion Whitby woman’s ‘attitude, spirit are indeed inspiring’9 minutes ago Advice I love my boyfriend but I fear he’s sleeping around and getting back on meth! Ask Ellie5 hours ago Opinion ASK THE MONEY LADY: Does having a financial planner encourage an expanded portfolio?5 hours ago Opinion Entertaining Family Movies for the Holidays!5 hours ago Coronavirus Crisis News Pfizer vs. Moderna: Comparing 2 of the top COVID-19 vaccine candidates With recent announcements by pharmaceutical companies Moderna and, it appears we now have two promising COVID-19 vaccine candidates.14 minutes ago News How many cases of coronavirus are there in Toronto?1 hour ago News New case of COVID-19 confirmed at Pickering High School1 hour ago News Liberal Leader Steven Del Duca urging Premier Doug Ford to lock things down for 28 days to curb COVID-19 infections2 hours ago News Doctor says Durham residents waiting too long to get COVID-19 tests5 hours ago Life Food and Drink Best places in Durham to get a hot chocolate Here's a list of places to grab a cup of hot chocolate in Durham.Nov 19, 2020 Opinion ASK THE MONEY LADY: Does having a financial planner encourage an expanded portfolio?5 hours ago Fashion and Beauty 9 sex toys and accessories that make perfect gifts18 hours ago sponsored The Future is FROZEN! – M&M Food Market Franchise OpportunitiesNov 19, 2020 Community Support for Scugog family has 'blown our minds'Nov 19, 2020 Flyers powered by Sobeys The Greatest Gift Is FamilyThu Nov 19, 2020 - Wed Nov 25, 2020 SobeysThu Nov 19, 2020 - Wed Nov 25, 2020 Vince's MarketFri Nov 13, 2020 - Thu Nov 26, 2020 Foody MartFri Oct 30, 2020 - Sat Dec 5, 2020 Pro Hockey LifeFri Nov 20, 2020 - Thu Nov 26, 2020 Canadian TireFri Nov 20, 2020 - Thu Nov 26, 2020 Fashion and beauty Fashion and Beauty 9 sex toys and accessories that make perfect gifts At the beginning of the year, who could have predicted that kissing would soon be labelled a high-risk activity? As various government bodies have reminded us, the safest sexual partner during the COVID-19 pandemic is yourself, but that doesn’t18 hours ago Fashion and Beauty These are the best gifts under $100Nov 17, 2020 Fashion and Beauty This year’s best person-who-has-everything giftNov 12, 2020 Fashion and Beauty This natural throat spray tastes amazing and is this year’s best stocking stufferNov 11, 2020 Real estate News Condo rents may have plunged, but that doesn’t mean Toronto has become more affordable Toronto rents may have stopped climbing in recent months, but don’t hold your breath for a sustained shift in affordability until the city’s building boom includes more purpose-built rentals, says a senior analyst with Canada Mortgage andOct 28, 2020 Opinion Need to move fast on a home purchase but aren’t sure how? Try these tipsOct 26, 2020 Opinion When it comes to building homes, time really is money in the Greater Toronto AreaOct 24, 2020 News Toronto’s hot condo market is cooling off. But COVID-19 is not entirely to blameSep 05, 2020 Autos Wheels Review = 2021 Lexus LC 500 Convertible It’s been said that vehicle purchases are often be driven by emotion, and if there was ever a vehicle designed to stir one’s soul, the LC convertible is it.18 hours ago Wheels Sneak Peak – 2022 Honda CivicNov 18, 2020 Wheels 2022 Infiniti QX55 Revealed in TokyoNov 18, 2020 Wheels First Look – Jeep Wrangler Rubicon 392Nov 17, 2020 Headlines Newsletter TOP STORIES, delivered to your inbox. Sign Up Submit Content Submit ContentContact UsGive us feedbackJoin our team Subscribe to The Star Subscribe to The StarSignup for email newslettersFAQsE-editions Place an Ad Place an AdPost an ObituaryPost a ClassifiedFlyer Distribution and Printing About Durhamregion.com About Durhamregion.comCommenting guidelinesTorstar's StoryInvestor Relations Join Us! © Copyright 2020 Metroland Media Group Ltd. All Rights Reserved Metroland NewsAdvertising TermsTerms of useCorporate Privacy PolicyAccessibility Policy"
