,crawl_date,domain,url,mime_type_web_server,mime_type_tika,language,content
319177,20201030,midwesternnewspapers.com,https://midwesternnewspapers.com/,text/html,text/html,en,"Home – Midwestern News Facebook News Sports Marketplace Contact News Sports Marketplace Contact Local News Local News • News • Wingham Advance Times Wingham Remembrance Day ceremony closed to the public 9 seconds ago NORTH HURON – Legion Branch 180 in Wingham says this year’s Remembrance Day ceremony, with COVID-19... Listowel Banner • Local News • News Huron Perth Public Health reports five new cases of COVID-19 1 hour ago STRATFORD – Huron Perth Public Health reported five new cases of COVID-19 in the region today. This... Local News • Wingham Advance Times Driver airlifted following collision east of Bluevale 2 hours ago HURON COUNTY – Huron County Ontario Provincial Police (OPP) officers remain on scene of a two... Local News • Wingham Advance Times Ashfield-Colborne-Wawanosh resident facing multiple charges... 5 hours ago WINGHAM – A resident of Ashfield-Colborne-Wawanosh will be heading to court later this year to... Listowel Banner Listowel Banner • Local News • News Huron Perth Public Health reports five new cases of COVID-19 1 hour ago STRATFORD – Huron Perth Public Health reported five new cases of COVID-19 in the region today. This... Independent Plus • Listowel Banner • Local News • Walkerton Herald-Times • Wingham Advance Times Ontario announces $500 million in funding for... 7 hours ago Independent Plus • Listowel Banner • News • Walkerton Herald-Times • Wingham Advance Times Ontario may have avoided worst-case COVID-19 scenario:... 24 hours ago Independent Plus Independent Plus • Listowel Banner • Local News • Walkerton Herald-Times • Wingham Advance Times Ontario announces $500 million in funding for municipalities 7 hours ago Local municipalities to benefit from Ontario Municipal Partnership Fund allocations TORONTO –... Independent Plus • Listowel Banner • News • Walkerton Herald-Times • Wingham Advance Times Ontario may have avoided worst-case COVID-19 scenario:... 24 hours ago Independent Plus • News MNR reminding hunters they are not alone in the woods 1 week ago Walkerton Herald-Times Local News • Walkerton Herald-Times Paisley woman wins $75K in Instant Uno lotto game 5 hours ago TORONTO – Linda McCleery of Paisley is $75,000 richer after winning with Instant Uno. The 61-year... Independent Plus • Listowel Banner • Local News • Walkerton Herald-Times • Wingham Advance Times Ontario announces $500 million in funding for... 7 hours ago Independent Plus • Listowel Banner • News • Walkerton Herald-Times • Wingham Advance Times Ontario may have avoided worst-case COVID-19 scenario:... 24 hours ago Wingham Advance Times Local News • News • Wingham Advance Times Wingham Remembrance Day ceremony closed to the public 9 seconds ago NORTH HURON – Legion Branch 180 in Wingham says this year’s Remembrance Day ceremony, with COVID-19... Local News • Wingham Advance Times Driver airlifted following collision east of Bluevale 2 hours ago Local News • Wingham Advance Times Ashfield-Colborne-Wawanosh resident facing multiple... 5 hours ago Midwestern Newspapers Corp. 185 Wallace Ave., Listowel, ON N4W 1K8 Tel: (519) 291-1660, Ext. 108 Listowel Banner, Independent Plus, Walkerton Herald-Times and the Wingham Advance Times Copyright © 2020. Created by City Media. News Sports Marketplace Contact"
342001,20201113,midwesternnewspapers.com,https://midwesternnewspapers.com/,text/html,text/html,en,"Home – Midwestern News Facebook News Sports Marketplace Contact News Sports Marketplace Contact Local News Listowel Banner • Local News • News • Wingham Advance Times HPPH region moving to COVID-19 alert level yellow on Nov. 16 1 min ago By Chris Daponte HURON-PERTH – The Huron Perth Public Health (HPPH) region will move to the yellow... Listowel Banner • Local News • News • Wingham Advance Times WDGPH region moving to COVID-19 alert level orange on Nov. 16 19 mins ago New measures include visitor restrictions at long-term care homes, restrictions at restaurants... Listowel Banner • Local News • News Injury at Listowel meat packing plant results in $50,000 fine... 21 hours ago Incident took place at Erie Meats in Listowel in October 2018 LISTOWEL – A local meat packing plant... Listowel Banner • Local News • News • Wingham Advance Times Fourth death tied to Cedarcroft outbreak as COVID-19 cases rise... 21 hours ago HURON-PERTH – An additional 16 positive cases of COVID-19 were announced on Nov. 12 bringing the... Listowel Banner Listowel Banner • Local News • News • Wingham Advance Times HPPH region moving to COVID-19 alert level yellow on Nov. 16 1 min ago By Chris Daponte HURON-PERTH – The Huron Perth Public Health (HPPH) region will move to the yellow... Listowel Banner • Local News • News • Wingham Advance Times WDGPH region moving to COVID-19 alert level orange on... 19 mins ago Listowel Banner • Local News • News Injury at Listowel meat packing plant results in... 21 hours ago Independent Plus Independent Plus • Listowel Banner • News • Walkerton Herald-Times • Wingham Advance Times Province releases new framework for keeping Ontario ‘safe and... 1 week ago TORONTO – A new framework for implementing and lifting COVID-19 restrictions was announced by the... Independent Plus • Listowel Banner • Local News • Walkerton Herald-Times • Wingham Advance Times Ontario announces $500 million in funding for... 2 weeks ago Independent Plus • Listowel Banner • News • Walkerton Herald-Times • Wingham Advance Times Ontario may have avoided worst-case COVID-19 scenario:... 2 weeks ago Walkerton Herald-Times Local News • News • Walkerton Herald-Times Grey Bruce OPP recover multiple stolen vehicles, two people... 1 week ago GREY HIGHLANDS – Grey Bruce OPP have arrested two people – one from West Grey, the other from South... Independent Plus • Listowel Banner • News • Walkerton Herald-Times • Wingham Advance Times Province releases new framework for keeping Ontario... 1 week ago Local News • Walkerton Herald-Times Paisley woman wins $75K in Instant Uno lotto game 2 weeks ago Wingham Advance Times Listowel Banner • Local News • News • Wingham Advance Times HPPH region moving to COVID-19 alert level yellow on Nov. 16 1 min ago By Chris Daponte HURON-PERTH – The Huron Perth Public Health (HPPH) region will move to the yellow... Listowel Banner • Local News • News • Wingham Advance Times WDGPH region moving to COVID-19 alert level orange on... 19 mins ago Listowel Banner • Local News • News • Wingham Advance Times Fourth death tied to Cedarcroft outbreak as COVID-19... 21 hours ago Midwestern Newspapers Corp. 185 Wallace Ave., Listowel, ON N4W 1K8 Tel: (519) 291-1660, Ext. 108 Listowel Banner, Independent Plus, Walkerton Herald-Times and the Wingham Advance Times Copyright © 2020. Created by City Media. News Sports Marketplace Contact"
352767,20201120,midwesternnewspapers.com,https://midwesternnewspapers.com/,text/html,text/html,en,"Home – Midwestern News Facebook News Sports Marketplace Contact News Sports Marketplace Contact Local News Listowel Banner • Local News • News • Wingham Advance Times HPPH region moving to COVID-19 alert level orange on Nov. 23 4 mins ago HURON-PERTH — The Huron Perth Public Health (HPPH) region will move to the orange (restrict) COVID... Local News • News • Uncategorized • Walkerton Herald-Times Hanover Hospital staff member tests positive for COVID-19 6 hours ago HANOVER – A staff member at the Hanover and District Hospital has tested positive for COVID-19. In... Listowel Banner • Local News • News • Wingham Advance Times Huron Perth Public Health encouraging residents to get the flu... 7 hours ago HURON-PERTH – Huron Perth Public Health (HPPH) says that influenza has arrived in Huron-Perth. In a... Independent Plus • Listowel Banner • Local News • News • Walkerton Herald-Times • Wingham Advance Times Ontario extends COVID-19 orders until Dec. 21 7 hours ago TORONTO — The Ontario government has extended all orders currently in place under the Reopening... Listowel Banner Listowel Banner • Local News • News • Wingham Advance Times HPPH region moving to COVID-19 alert level orange on Nov. 23 4 mins ago HURON-PERTH — The Huron Perth Public Health (HPPH) region will move to the orange (restrict) COVID... Listowel Banner • Local News • News • Wingham Advance Times Huron Perth Public Health encouraging residents to get... 7 hours ago Independent Plus • Listowel Banner • Local News • News • Walkerton Herald-Times • Wingham Advance Times Ontario extends COVID-19 orders until Dec. 21 7 hours ago Independent Plus Independent Plus • Listowel Banner • Local News • News • Walkerton Herald-Times • Wingham Advance Times Ontario extends COVID-19 orders until Dec. 21 7 hours ago TORONTO — The Ontario government has extended all orders currently in place under the Reopening... Independent Plus • Local News • News • Walkerton Herald-Times Brockton man charged with impaired driving 4 days ago Independent Plus • Listowel Banner • News • Walkerton Herald-Times • Wingham Advance Times Province releases new framework for keeping Ontario... 2 weeks ago Walkerton Herald-Times Local News • News • Uncategorized • Walkerton Herald-Times Hanover Hospital staff member tests positive for COVID-19 6 hours ago HANOVER – A staff member at the Hanover and District Hospital has tested positive for COVID-19. In... Independent Plus • Listowel Banner • Local News • News • Walkerton Herald-Times • Wingham Advance Times Ontario extends COVID-19 orders until Dec. 21 7 hours ago Local News • News • Walkerton Herald-Times Probable case of COVID-19 at Sacred Heart High School... 23 hours ago Wingham Advance Times Listowel Banner • Local News • News • Wingham Advance Times HPPH region moving to COVID-19 alert level orange on Nov. 23 4 mins ago HURON-PERTH — The Huron Perth Public Health (HPPH) region will move to the orange (restrict) COVID... Listowel Banner • Local News • News • Wingham Advance Times Huron Perth Public Health encouraging residents to get... 7 hours ago Independent Plus • Listowel Banner • Local News • News • Walkerton Herald-Times • Wingham Advance Times Ontario extends COVID-19 orders until Dec. 21 7 hours ago Midwestern Newspapers Corp. 185 Wallace Ave., Listowel, ON N4W 1K8 Tel: (519) 291-1660, Ext. 108 Listowel Banner, Independent Plus, Walkerton Herald-Times and the Wingham Advance Times Copyright © 2020. Created by City Media. News Sports Marketplace Contact"
364393,20201127,midwesternnewspapers.com,https://midwesternnewspapers.com/,text/html,text/html,en,"Home – Midwestern News Facebook News Sports Marketplace Contact News Sports Marketplace Contact Local News Local News • News • Walkerton Herald-Times Oh, deer! Collisions between vehicles, deer continue to be a... 30 seconds ago SOUTHERN BRUCE COUNTY – The South Bruce Ontario Provincial Police (OPP) continues to respond to... Listowel Banner • Local News • News North Perth mayor’s inclusivity, anti-racism charter silently... 4 hours ago PERTH COUNTY – When Coun. Todd Kasenberg brought forward a motion to Perth County council on Nov... Listowel Banner • Local News • News • Wingham Advance Times Northside Christian School in Listowel closed until December due... 22 hours ago Klassen asks residents to be polite when contacted by HPPH staff HURON-PERTH – Northside Christian... Local News • News • Walkerton Herald-Times Grey Bruce Health Unit reports 10 new cases of COVID-19, Nov. 26 23 hours ago GREY-BRUCE – The Grey Bruce Health Unit (GBHU) is reporting more than 10 new cases of COVID-19 for... Listowel Banner Listowel Banner • Local News • News North Perth mayor’s inclusivity, anti-racism charter silently... 4 hours ago PERTH COUNTY – When Coun. Todd Kasenberg brought forward a motion to Perth County council on Nov... Listowel Banner • Local News • News • Wingham Advance Times Northside Christian School in Listowel closed until... 22 hours ago Listowel Banner • Local News • News Assisted suicide: ‘A very civilized, pleasant, kind... 23 hours ago Independent Plus Independent Plus • Listowel Banner • Local News • News • Walkerton Herald-Times • Wingham Advance Times Province offers advice on how to celebrate holidays safely 2 days ago Ford: ‘Traditions will have to be adjusted’ TORONTO – The holidays, like many things in 2020, are... Independent Plus • Listowel Banner • Local News • News Perth County agrees to temporary traffic lights at... 5 days ago Independent Plus • Listowel Banner • Local News • News • Walkerton Herald-Times • Wingham Advance Times Ontario extends COVID-19 orders until Dec. 21 1 week ago Walkerton Herald-Times Local News • News • Walkerton Herald-Times Oh, deer! Collisions between vehicles, deer continue to be a... 30 seconds ago SOUTHERN BRUCE COUNTY – The South Bruce Ontario Provincial Police (OPP) continues to respond to... Local News • News • Walkerton Herald-Times Grey Bruce Health Unit reports 10 new cases of COVID... 23 hours ago Local News • News • Walkerton Herald-Times Brockton to host regional fire training centre at... 2 days ago Wingham Advance Times Listowel Banner • Local News • News • Wingham Advance Times Northside Christian School in Listowel closed until December due... 22 hours ago Klassen asks residents to be polite when contacted by HPPH staff HURON-PERTH – Northside Christian... Independent Plus • Listowel Banner • Local News • News • Walkerton Herald-Times • Wingham Advance Times Province offers advice on how to celebrate holidays... 2 days ago Listowel Banner • Local News • News • Wingham Advance Times HPPH recommends cloth masks over plastic ‘mingle... 3 days ago Midwestern Newspapers Corp. 185 Wallace Ave., Listowel, ON N4W 1K8 Tel: (519) 291-1660, Ext. 108 Listowel Banner, Independent Plus, Walkerton Herald-Times and the Wingham Advance Times Copyright © 2020. Created by City Media. News Sports Marketplace Contact"
375675,20201204,midwesternnewspapers.com,https://midwesternnewspapers.com/,text/html,text/html,en,"Home – Midwestern News Facebook News Sports Marketplace Contact News Sports Marketplace Contact Local News Listowel Banner • Local News Foot pursuit in Listowel ends with two arrested for break and... 3 hours ago LISTOWEL – Two people are facing charges after being accused of breaking into a residence in... Listowel Banner • Local News • News Perth County Warden expands on statement of commitment to... 4 hours ago Aitcheson gives rationale on county council’s rejection of committee establishment for potential... Listowel Banner • Local News • News COVID-19 outbreaks declared in two Listowel schools, Livingstone... 20 hours ago HURON-PERTH – COVID-19 outbreaks have been declared at two schools and one retirement residence in... Listowel Banner • Local News • News Aitcheson acclaimed to second consecutive term as Perth County... 22 hours ago PERTH COUNTY – Jim Aitcheson will serve a second consecutive term as Warden of Perth County... Listowel Banner Listowel Banner • Local News Foot pursuit in Listowel ends with two arrested for break and... 3 hours ago LISTOWEL – Two people are facing charges after being accused of breaking into a residence in... Listowel Banner • Local News • News Perth County Warden expands on statement of commitment... 4 hours ago Listowel Banner • Local News • News COVID-19 outbreaks declared in two Listowel schools... 20 hours ago Independent Plus Independent Plus • Listowel Banner • Local News • News Temporary traffic lights at ‘S-Bend’ should be installed by... 1 day ago WELLINGTON COUNTY – A temporary traffic light system is expected to be operating at the “S-Bend” by... Independent Plus • Listowel Banner • Local News • News • Walkerton Herald-Times • Wingham Advance Times Province offers advice on how to celebrate holidays... 1 week ago Independent Plus • Listowel Banner • Local News • News Perth County agrees to temporary traffic lights at... 2 weeks ago Walkerton Herald-Times Local News • News • Walkerton Herald-Times Bruce County elects new warden 23 hours ago BRUCE COUNTY – Bruce County has a new warden. Janice Jackson, mayor of South Bruce Peninsula... Local News • News • Walkerton Herald-Times Saugeen First Nation man charged in Arran Township... 1 day ago Local News • News • Walkerton Herald-Times • Wingham Advance Times Bruce Power calling on communities to be Grey*Bruce... 1 day ago Wingham Advance Times Local News • News • Walkerton Herald-Times • Wingham Advance Times Bruce Power calling on communities to be Grey*Bruce *Huron... 1 day ago TIVERTON – As we begin the final month of what has been an extremely challenging year for Canadians... Listowel Banner • Local News • News • Walkerton Herald-Times • Wingham Advance Times OPP offer safe winter driving tips 2 days ago Local News • News • Wingham Advance Times Victim Services Huron launches online 50/50 fundraiser 2 days ago Midwestern Newspapers Corp. 185 Wallace Ave., Listowel, ON N4W 1K8 Tel: (519) 291-1660, Ext. 108 Listowel Banner, Independent Plus, Walkerton Herald-Times and the Wingham Advance Times Copyright © 2020. Created by City Media. News Sports Marketplace Contact"
386499,20201211,midwesternnewspapers.com,https://midwesternnewspapers.com/,text/html,text/html,en,"Home – Midwestern News Facebook News Sports Marketplace Contact News Sports Marketplace Contact Local News Listowel Banner • Local News • News • Wingham Advance Times Klassen says she has ‘great confidence’ in COVID-19 vaccine 10 hours ago Northside Christian School and St. Mary’s Catholic School in Listowel remain in outbreak HURON... Local News • Walkerton Herald-Times Bruce Power donates to two community initiatives in Brockton 2 days ago Municipality to receive funding for outdoor ice skating oval, downtown park development BROCKTON –... Listowel Banner • Local News • News • Wingham Advance Times Student senators start pen pal program to connect with seniors... 2 days ago HURON-PERTH – Last school year, members of the Avon Maitland District School Board student senate... Local News • News • Wingham Advance Times Crash near Wroxeter claims life of Kitchener woman 2 days ago MORRIS-TURNBERRY – A two-vehicle crash southwest of Wroxeter has claimed the life of a Kitchener... Listowel Banner Listowel Banner • Local News • News • Wingham Advance Times Klassen says she has ‘great confidence’ in COVID-19 vaccine 10 hours ago Northside Christian School and St. Mary’s Catholic School in Listowel remain in outbreak HURON... Listowel Banner • Local News • News • Wingham Advance Times Student senators start pen pal program to connect with... 2 days ago Listowel Banner • Local News • News • Wingham Advance Times COVID-19 outbreak at Livingstone Manor declared over 4 days ago Independent Plus Independent Plus • Listowel Banner • Local News • News Temporary traffic lights at ‘S-Bend’ should be installed by... 1 week ago WELLINGTON COUNTY – A temporary traffic light system is expected to be operating at the “S-Bend” by... Independent Plus • Listowel Banner • Local News • News • Walkerton Herald-Times • Wingham Advance Times Province offers advice on how to celebrate holidays... 2 weeks ago Independent Plus • Listowel Banner • Local News • News Perth County agrees to temporary traffic lights at... 3 weeks ago Walkerton Herald-Times Local News • Walkerton Herald-Times Bruce Power donates to two community initiatives in Brockton 2 days ago Municipality to receive funding for outdoor ice skating oval, downtown park development BROCKTON –... Local News • News • Walkerton Herald-Times GBHU reports one positive COVID-19 case within... 5 days ago Local News • News • Walkerton Herald-Times Bruce County elects new warden 1 week ago Wingham Advance Times Listowel Banner • Local News • News • Wingham Advance Times Klassen says she has ‘great confidence’ in COVID-19 vaccine 10 hours ago Northside Christian School and St. Mary’s Catholic School in Listowel remain in outbreak HURON... Listowel Banner • Local News • News • Wingham Advance Times Student senators start pen pal program to connect with... 2 days ago Local News • News • Wingham Advance Times Crash near Wroxeter claims life of Kitchener woman 2 days ago Midwestern Newspapers Corp. 185 Wallace Ave., Listowel, ON N4W 1K8 Tel: (519) 291-1660, Ext. 108 Listowel Banner, Independent Plus, Walkerton Herald-Times and the Wingham Advance Times Copyright © 2020. Created by City Media. News Sports Marketplace Contact"
395484,20201218,midwesternnewspapers.com,https://midwesternnewspapers.com/,text/html,text/html,en,"Home – Midwestern News Facebook News Sports Marketplace Contact News Sports Marketplace Contact Local News Listowel Banner • Local News • News UPDATE: COVID-19 outbreak at Listowel Memorial Hospital continues 1 min ago LISTOWEL – A total of 12 people (four patients, eight staff members) have been identified as part... Listowel Banner • Local News • News • Wingham Advance Times Investigation continues into Listowel Memorial Hospital COVID... 21 hours ago HURON-PERTH – During the Huron Perth Public Health (HPPH) media briefing on Dec. 17, Dr. Miriam... Listowel Banner • Local News • News Wanted person located during traffic stop in Listowel, now... 22 hours ago LISTOWEL – A traffic stop in Listowel earlier this month has resulted in a wanted person facing... Local News • News • Wingham Advance Times Howick man charged with arson 1 day ago HOWICK – A Howick Township man remains in custody following an investigation conducted by members... Listowel Banner Listowel Banner • Local News • News UPDATE: COVID-19 outbreak at Listowel Memorial Hospital continues 1 min ago LISTOWEL – A total of 12 people (four patients, eight staff members) have been identified as part... Listowel Banner • Local News • News • Wingham Advance Times Investigation continues into Listowel Memorial... 21 hours ago Listowel Banner • Local News • News Wanted person located during traffic stop in Listowel... 22 hours ago Independent Plus Independent Plus • Listowel Banner • Local News • News Temporary traffic lights at ‘S-Bend’ should be installed by... 2 weeks ago WELLINGTON COUNTY – A temporary traffic light system is expected to be operating at the “S-Bend” by... Independent Plus • Listowel Banner • Local News • News • Walkerton Herald-Times • Wingham Advance Times Province offers advice on how to celebrate holidays... 3 weeks ago Independent Plus • Listowel Banner • Local News • News Perth County agrees to temporary traffic lights at... 4 weeks ago Walkerton Herald-Times Local News • Walkerton Herald-Times Bruce Power donates to two community initiatives in Brockton 1 week ago Municipality to receive funding for outdoor ice skating oval, downtown park development BROCKTON –... Local News • News • Walkerton Herald-Times GBHU reports one positive COVID-19 case within... 2 weeks ago Local News • News • Walkerton Herald-Times Bruce County elects new warden 2 weeks ago Wingham Advance Times Listowel Banner • Local News • News • Wingham Advance Times Investigation continues into Listowel Memorial Hospital COVID... 21 hours ago HURON-PERTH – During the Huron Perth Public Health (HPPH) media briefing on Dec. 17, Dr. Miriam... Local News • News • Wingham Advance Times Howick man charged with arson 1 day ago Local News • News • Wingham Advance Times Wingham woman wins $75,000 in instant lotto game 2 days ago Midwestern Newspapers Corp. 185 Wallace Ave., Listowel, ON N4W 1K8 Tel: (519) 291-1660, Ext. 108 Listowel Banner, Independent Plus, Walkerton Herald-Times and the Wingham Advance Times Copyright © 2020. Created by City Media. News Sports Marketplace Contact"
