,crawl_date,domain,url,mime_type_web_server,mime_type_tika,language,content
471151,20210212,midwesternnewspapers.com,https://midwesternnewspapers.com/,text/html,text/html,en,"Home – Midwestern News Facebook News Sports Marketplace Contact News Sports Marketplace Contact Local News Listowel Banner • Local News • News • Walkerton Herald-Times • Wingham Advance Times Huron-Perth moving to ‘orange’, Grey-Bruce to... 1 min ago TORONTO — The province is lifting the stay-at-home order and lockdown in 27 public health regions... Listowel Banner • Local News • News • Wingham Advance Times Huron-Perth positive COVID case count continues downward trend 22 hours ago Phase one of regional vaccination plan expects to wrap up Feb. 18, mass vaccination plan continues... Local News • News • Walkerton Herald-Times COVID-19 assessment centre in Hanover to have reduced hours on... 22 hours ago HANOVER – The COVID-19 assessment centre in Hanover will have reduced hours on the Family Day... Listowel Banner • Local News • News • Walkerton Herald-Times • Wingham Advance Times Province announces postponement of March Break 1 day ago TORONTO – Students in public schools across Ontario will be having April Break this year. Education... Listowel Banner Listowel Banner • Local News • News • Walkerton Herald-Times • Wingham Advance Times Huron-Perth moving to ‘orange’, Grey-Bruce to... 1 min ago TORONTO — The province is lifting the stay-at-home order and lockdown in 27 public health regions... Listowel Banner • Local News • News • Wingham Advance Times Huron-Perth positive COVID case count continues... 22 hours ago Listowel Banner • Local News • News • Walkerton Herald-Times • Wingham Advance Times Province announces postponement of March Break 1 day ago Independent Plus Independent Plus • Local News • News Huron, Perth, Wellington students returning to class on Feb. 8 1 week ago TORONTO – The anticipation before Education Minister Stephen Lecce’s announcement on... Independent Plus • Listowel Banner • Local News • News Temporary traffic lights at ‘S-Bend’ should be... 2 months ago Independent Plus • Listowel Banner • Local News • News • Walkerton Herald-Times • Wingham Advance Times Province offers advice on how to celebrate holidays... 3 months ago Walkerton Herald-Times Listowel Banner • Local News • News • Walkerton Herald-Times • Wingham Advance Times Huron-Perth moving to ‘orange’, Grey-Bruce to... 1 min ago TORONTO — The province is lifting the stay-at-home order and lockdown in 27 public health regions... Local News • News • Walkerton Herald-Times COVID-19 assessment centre in Hanover to have reduced... 22 hours ago Listowel Banner • Local News • News • Walkerton Herald-Times • Wingham Advance Times Province announces postponement of March Break 1 day ago Wingham Advance Times Listowel Banner • Local News • News • Walkerton Herald-Times • Wingham Advance Times Huron-Perth moving to ‘orange’, Grey-Bruce to... 1 min ago TORONTO — The province is lifting the stay-at-home order and lockdown in 27 public health regions... Listowel Banner • Local News • News • Wingham Advance Times Huron-Perth positive COVID case count continues... 22 hours ago Listowel Banner • Local News • News • Walkerton Herald-Times • Wingham Advance Times Province announces postponement of March Break 1 day ago Midwestern Newspapers Corp. 185 Wallace Ave., Listowel, ON N4W 1K8 Tel: (519) 291-1660, Ext. 108 Listowel Banner, Independent Plus, Walkerton Herald-Times and the Wingham Advance Times Copyright © 2021. Created by City Media. News Sports Marketplace Contact"
481346,20210219,midwesternnewspapers.com,https://midwesternnewspapers.com/,text/html,text/html,en,"Home – Midwestern News Facebook News Sports Marketplace Contact News Sports Marketplace Contact Local News Listowel Banner • Local News • News • Wingham Advance Times Kasenberg appointed to Huron Perth Public Health board following... 1 day ago PERTH COUNTY – Coun. Daryl Herlick’s resignation of his seat on the Huron Perth Public Health... Listowel Banner • Local News • News • Walkerton Herald-Times • Wingham Advance Times Midwestern Newspapers receives 9 OCNA nominations 1 day ago TORONTO – Midwestern Newspapers, publishers of the Listowel Banner, Independent Plus, Walkerton... Local News • News • Wingham Advance Times North Huron woman remains in custody after traffic stop leads to... 2 days ago Four arrested, close to $4,000 in drugs seized SOUTH HURON – Police are reporting that a traffic... Local News • Walkerton Herald-Times West Grey administration building reopening 2 days ago WEST GREY — The Municipality of West Grey administration building will reopen on Feb. 22 under... Listowel Banner Listowel Banner • Local News • News • Wingham Advance Times Kasenberg appointed to Huron Perth Public Health board following... 1 day ago PERTH COUNTY – Coun. Daryl Herlick’s resignation of his seat on the Huron Perth Public Health... Listowel Banner • Local News • News • Walkerton Herald-Times • Wingham Advance Times Midwestern Newspapers receives 9 OCNA nominations 1 day ago Listowel Banner • News Daryl Herlick resigns from Huron Perth Public Health... 2 days ago Independent Plus Independent Plus • Local News • News Huron, Perth, Wellington students returning to class on Feb. 8 2 weeks ago TORONTO – The anticipation before Education Minister Stephen Lecce’s announcement on... Independent Plus • Listowel Banner • Local News • News Temporary traffic lights at ‘S-Bend’ should be... 3 months ago Independent Plus • Listowel Banner • Local News • News • Walkerton Herald-Times • Wingham Advance Times Province offers advice on how to celebrate holidays... 3 months ago Walkerton Herald-Times Listowel Banner • Local News • News • Walkerton Herald-Times • Wingham Advance Times Midwestern Newspapers receives 9 OCNA nominations 1 day ago TORONTO – Midwestern Newspapers, publishers of the Listowel Banner, Independent Plus, Walkerton... Local News • Walkerton Herald-Times West Grey administration building reopening 2 days ago Listowel Banner • Opinion • Walkerton Herald-Times • Wingham Advance Times THE IVORY SILO: The risks of erosion 6 days ago Wingham Advance Times Listowel Banner • Local News • News • Wingham Advance Times Kasenberg appointed to Huron Perth Public Health board following... 1 day ago PERTH COUNTY – Coun. Daryl Herlick’s resignation of his seat on the Huron Perth Public Health... Listowel Banner • Local News • News • Walkerton Herald-Times • Wingham Advance Times Midwestern Newspapers receives 9 OCNA nominations 1 day ago Local News • News • Wingham Advance Times North Huron woman remains in custody after traffic... 2 days ago Midwestern Newspapers Corp. 185 Wallace Ave., Listowel, ON N4W 1K8 Tel: (519) 291-1660, Ext. 108 Listowel Banner, Independent Plus, Walkerton Herald-Times and the Wingham Advance Times Copyright © 2021. Created by City Media. News Sports Marketplace Contact"
491742,20210226,midwesternnewspapers.com,https://midwesternnewspapers.com/,text/html,text/html,en,"Home – Midwestern News Facebook News Sports Marketplace Contact News Sports Marketplace Contact Local News Listowel Banner • Local News • News • Wingham Advance Times Community seniors 80-plus next on queue for Huron-Perth vaccine... 3 hours ago COVID-19 vaccinations for demographic expected to commence by mid-March HURON-PERTH – As the... Listowel Banner • Local News • News • Wingham Advance Times HPPH provides update on COVID-19 vaccination plan 7 days ago HURON-PERTH – Huron Perth Public Health (HPPH), with partners, continues COVID-19 vaccination work... Listowel Banner • Local News • News • Wingham Advance Times Kasenberg appointed to Huron Perth Public Health board following... 1 week ago PERTH COUNTY – Coun. Daryl Herlick’s resignation of his seat on the Huron Perth Public Health... Listowel Banner • Local News • News • Walkerton Herald-Times • Wingham Advance Times Midwestern Newspapers receives 9 OCNA nominations 1 week ago TORONTO – Midwestern Newspapers, publishers of the Listowel Banner, Independent Plus, Walkerton... Listowel Banner Listowel Banner • Local News • News • Wingham Advance Times Community seniors 80-plus next on queue for Huron-Perth vaccine... 3 hours ago COVID-19 vaccinations for demographic expected to commence by mid-March HURON-PERTH – As the... Listowel Banner • Local News • News • Wingham Advance Times HPPH provides update on COVID-19 vaccination plan 7 days ago Listowel Banner • Local News • News • Wingham Advance Times Kasenberg appointed to Huron Perth Public Health board... 1 week ago Independent Plus Independent Plus • Local News • News Huron, Perth, Wellington students returning to class on Feb. 8 3 weeks ago TORONTO – The anticipation before Education Minister Stephen Lecce’s announcement on... Independent Plus • Listowel Banner • Local News • News Temporary traffic lights at ‘S-Bend’ should be... 3 months ago Independent Plus • Listowel Banner • Local News • News • Walkerton Herald-Times • Wingham Advance Times Province offers advice on how to celebrate holidays... 3 months ago Walkerton Herald-Times Listowel Banner • Local News • News • Walkerton Herald-Times • Wingham Advance Times Midwestern Newspapers receives 9 OCNA nominations 1 week ago TORONTO – Midwestern Newspapers, publishers of the Listowel Banner, Independent Plus, Walkerton... Local News • Walkerton Herald-Times West Grey administration building reopening 1 week ago Listowel Banner • Opinion • Walkerton Herald-Times • Wingham Advance Times THE IVORY SILO: The risks of erosion 2 weeks ago Wingham Advance Times Listowel Banner • Local News • News • Wingham Advance Times Community seniors 80-plus next on queue for Huron-Perth vaccine... 3 hours ago COVID-19 vaccinations for demographic expected to commence by mid-March HURON-PERTH – As the... Listowel Banner • Local News • News • Wingham Advance Times HPPH provides update on COVID-19 vaccination plan 7 days ago Listowel Banner • Local News • News • Wingham Advance Times Kasenberg appointed to Huron Perth Public Health board... 1 week ago Midwestern Newspapers Corp. 185 Wallace Ave., Listowel, ON N4W 1K8 Tel: (519) 291-1660, Ext. 108 Listowel Banner, Independent Plus, Walkerton Herald-Times and the Wingham Advance Times Copyright © 2021. Created by City Media. News Sports Marketplace Contact"
501864,20210305,midwesternnewspapers.com,https://midwesternnewspapers.com/,text/html,text/html,en,"Home – Midwestern News Facebook News Sports Marketplace Contact News Sports Marketplace Contact Local News Listowel Banner • Local News • News • Walkerton Herald-Times • Wingham Advance Times Government says Ontario is ready to roll out phase two of COVID... 14 mins ago Phase two will focus on older adults, those at risk of serious illness, hot spot areas TORONTO —... Listowel Banner • Local News • News • Wingham Advance Times Multicultural Association of Perth-Huron wants more transparency... 5 hours ago Anti-racism protest cancelled as good faith gesture PERTH COUNTY – After receiving an email update... Local News • News • Walkerton Herald-Times Chesley man wins $72,347 in Lotto 6/49 draw 1 day ago TORONTO – A 77-year-old Chesley man has that “6/49 feeling” after winning more than $72,000 in the... Listowel Banner • Local News • News • Wingham Advance Times Huron Perth Public Health COVID-19 vaccine booking system closed... 1 day ago HURON-PERTH – Less than 24 hours after opening their online and phone appointment booking systems... Listowel Banner Columns • Listowel Banner • Opinion THE IVORY SILO: Words matter 33 seconds ago By Stewart Skinner This is part one of a three-part opinion series with Derek Mendez. How many of... Listowel Banner • Local News • News • Walkerton Herald-Times • Wingham Advance Times Government says Ontario is ready to roll out phase two... 14 mins ago Listowel Banner • Local News • News • Wingham Advance Times Multicultural Association of Perth-Huron wants more... 5 hours ago Independent Plus Independent Plus • Local News • News Huron, Perth, Wellington students returning to class on Feb. 8 4 weeks ago TORONTO – The anticipation before Education Minister Stephen Lecce’s announcement on... Independent Plus • Listowel Banner • Local News • News Temporary traffic lights at ‘S-Bend’ should be... 3 months ago Independent Plus • Listowel Banner • Local News • News • Walkerton Herald-Times • Wingham Advance Times Province offers advice on how to celebrate holidays... 3 months ago Walkerton Herald-Times Listowel Banner • Local News • News • Walkerton Herald-Times • Wingham Advance Times Government says Ontario is ready to roll out phase two of COVID... 14 mins ago Phase two will focus on older adults, those at risk of serious illness, hot spot areas TORONTO —... Local News • News • Walkerton Herald-Times Chesley man wins $72,347 in Lotto 6/49 draw 1 day ago Local News • News • Walkerton Herald-Times Grey-Bruce one of six health units giving provincial... 2 days ago Wingham Advance Times Listowel Banner • Local News • News • Walkerton Herald-Times • Wingham Advance Times Government says Ontario is ready to roll out phase two of COVID... 14 mins ago Phase two will focus on older adults, those at risk of serious illness, hot spot areas TORONTO —... Listowel Banner • Local News • News • Wingham Advance Times Multicultural Association of Perth-Huron wants more... 5 hours ago Listowel Banner • Local News • News • Wingham Advance Times Huron Perth Public Health COVID-19 vaccine booking... 1 day ago Midwestern Newspapers Corp. 185 Wallace Ave., Listowel, ON N4W 1K8 Tel: (519) 291-1660, Ext. 108 Listowel Banner, Independent Plus, Walkerton Herald-Times and the Wingham Advance Times Copyright © 2021. Created by City Media. News Sports Marketplace Contact"
512319,20210312,midwesternnewspapers.com,https://midwesternnewspapers.com/,text/html,text/html,en,"Home – Midwestern News Facebook News Sports Marketplace Contact News Sports Marketplace Contact Local News Listowel Banner • Local News • News • Wingham Advance Times Huron-Perth to remain in province’s yellow COVID-19 level until... 34 seconds ago HURON-PERTH – The Huron Perth Public Health (HPPH) region will spend at least another week in the... Listowel Banner • Local News • News North Perth council endorses conceptual plan for Listowel... 3 hours ago NORTH PERTH – Following much discussion, council endorsed a conceptual plan for the Listowel... Local News • News • Walkerton Herald-Times Paisley man wins $100,000 in Lotto 6/49 draw 3 hours ago TORONTO – Saying “yes” to Encore paid off for Anthony Block of Paisley. Block matched the last six... Listowel Banner • Local News • News • Wingham Advance Times Community Support Services Network helps Huron-Perth residents... 6 hours ago HURON-PERTH – March 11 marked one year since the World Health Organization declared COVID-19... Listowel Banner Listowel Banner • Local News • News • Wingham Advance Times Huron-Perth to remain in province’s yellow COVID-19 level until... 34 seconds ago HURON-PERTH – The Huron Perth Public Health (HPPH) region will spend at least another week in the... Listowel Banner • Local News • News North Perth council endorses conceptual plan for... 3 hours ago Listowel Banner • Local News • News • Wingham Advance Times Community Support Services Network helps Huron-Perth... 6 hours ago Independent Plus Independent Plus • Local News • News Huron, Perth, Wellington students returning to class on Feb. 8 1 month ago TORONTO – The anticipation before Education Minister Stephen Lecce’s announcement on... Independent Plus • Listowel Banner • Local News • News Temporary traffic lights at ‘S-Bend’ should be... 3 months ago Independent Plus • Listowel Banner • Local News • News • Walkerton Herald-Times • Wingham Advance Times Province offers advice on how to celebrate holidays... 4 months ago Walkerton Herald-Times Local News • News • Walkerton Herald-Times Paisley man wins $100,000 in Lotto 6/49 draw 3 hours ago TORONTO – Saying “yes” to Encore paid off for Anthony Block of Paisley. Block matched the last six... Listowel Banner • Local News • News • Walkerton Herald-Times • Wingham Advance Times Government says Ontario is ready to roll out phase two... 1 week ago Local News • News • Walkerton Herald-Times Chesley man wins $72,347 in Lotto 6/49 draw 1 week ago Wingham Advance Times Listowel Banner • Local News • News • Wingham Advance Times Huron-Perth to remain in province’s yellow COVID-19 level until... 34 seconds ago HURON-PERTH – The Huron Perth Public Health (HPPH) region will spend at least another week in the... Listowel Banner • Local News • News • Wingham Advance Times Community Support Services Network helps Huron-Perth... 6 hours ago Listowel Banner • Local News • News • Wingham Advance Times HPPH announces second dose appointments extended for... 2 days ago Midwestern Newspapers Corp. 185 Wallace Ave., Listowel, ON N4W 1K8 Tel: (519) 291-1660, Ext. 108 Listowel Banner, Independent Plus, Walkerton Herald-Times and the Wingham Advance Times Copyright © 2021. Created by City Media. News Sports Marketplace Contact"
522441,20210319,midwesternnewspapers.com,https://midwesternnewspapers.com/,text/html,text/html,en,"Home – Midwestern News Facebook News Sports Marketplace Contact News Sports Marketplace Contact Local News Listowel Banner • Local News • News • Wingham Advance Times Huron-Perth to remain in province’s yellow COVID-19 level... 1 min ago HURON-PERTH – Eight public health regions across Ontario will be moving to a new level of the... Listowel Banner • Local News • News • Wingham Advance Times HPPH confirms four positive COVID cases containing variants 1 hour ago Despite emergence of mutated strains in region, case counts continue to remain low HURON-PERTH –... Listowel Banner • Local News • News Ten years later: Remembering Kenneth Rea and Raymond Walter 3 days ago March 17, 2011 tragedy claimed lives of local firefighters By Colin Burrowes and Mike Wilson NORTH... Listowel Banner • Local News • News • Wingham Advance Times Huron-Perth residents to book vaccine appointments through... 5 days ago HURON-PERTH – Huron Perth Public Health (HPPH) will continue to use their own system to book... Listowel Banner Listowel Banner • Local News • News • Wingham Advance Times Huron-Perth to remain in province’s yellow COVID-19 level... 1 min ago HURON-PERTH – Eight public health regions across Ontario will be moving to a new level of the... Listowel Banner • News • Wingham Advance Times Huron-Perth residents ages 75-79 can book COVID-19... 21 mins ago Listowel Banner • Local News • News • Wingham Advance Times HPPH confirms four positive COVID cases containing... 1 hour ago Independent Plus Independent Plus • Local News • News Huron, Perth, Wellington students returning to class on Feb. 8 1 month ago TORONTO – The anticipation before Education Minister Stephen Lecce’s announcement on... Independent Plus • Listowel Banner • Local News • News Temporary traffic lights at ‘S-Bend’ should be... 4 months ago Independent Plus • Listowel Banner • Local News • News • Walkerton Herald-Times • Wingham Advance Times Province offers advice on how to celebrate holidays... 4 months ago Walkerton Herald-Times Local News • News • Walkerton Herald-Times Paisley man wins $100,000 in Lotto 6/49 draw 1 week ago TORONTO – Saying “yes” to Encore paid off for Anthony Block of Paisley. Block matched the last six... Listowel Banner • Local News • News • Walkerton Herald-Times • Wingham Advance Times Government says Ontario is ready to roll out phase two... 2 weeks ago Local News • News • Walkerton Herald-Times Chesley man wins $72,347 in Lotto 6/49 draw 2 weeks ago Wingham Advance Times Listowel Banner • Local News • News • Wingham Advance Times Huron-Perth to remain in province’s yellow COVID-19 level... 1 min ago HURON-PERTH – Eight public health regions across Ontario will be moving to a new level of the... Listowel Banner • News • Wingham Advance Times Huron-Perth residents ages 75-79 can book COVID-19... 21 mins ago Listowel Banner • Local News • News • Wingham Advance Times HPPH confirms four positive COVID cases containing... 1 hour ago Midwestern Newspapers Corp. 185 Wallace Ave., Listowel, ON N4W 1K8 Tel: (519) 291-1660, Ext. 108 Listowel Banner, Independent Plus, Walkerton Herald-Times and the Wingham Advance Times Copyright © 2021. Created by City Media. News Sports Marketplace Contact"
532548,20210326,midwesternnewspapers.com,https://midwesternnewspapers.com/,text/html,text/html,en,"Home – Midwestern News Facebook News Sports Marketplace Contact News Sports Marketplace Contact Local News Listowel Banner • Local News • News Pettapiece, Smith continue push for enhanced firefighter safety... 9 hours ago NORTH PERTH – Perth-Wellington MPP Randy Pettapiece said the reason he introduced Bill 33, the Rea... Local News • News • Walkerton Herald-Times Saugeen Valley Children’s Safety Village pivots to virtual... 3 days ago HANOVER – The Saugeen Valley Children’s Safety Village is counting the days until it can welcome... Local News • News • Wingham Advance Times Huron County paramedic wins prestigious award for the third time 1 week ago HURON COUNTY – Local paramedic Zia Khogyani was honoured at the 2020 Paramedic Recognition Awards... Listowel Banner • Local News • News • Wingham Advance Times Huron-Perth to remain in province’s yellow COVID-19 level... 1 week ago HURON-PERTH – Eight public health regions across Ontario will be moving to a new level of the... Listowel Banner Listowel Banner • News Tavistock couple revealed as winners of March 16 Lotto Max draw... 9 hours ago Couple left ticket in unlocked vehicle for a week before checking the numbers TORONTO – Ontario’s... Listowel Banner • Local News • News Pettapiece, Smith continue push for enhanced... 9 hours ago Listowel Banner • Opinion THE IVORY SILO: Opportunity for all 3 days ago Independent Plus Independent Plus • Local News • News Huron, Perth, Wellington students returning to class on Feb. 8 2 months ago TORONTO – The anticipation before Education Minister Stephen Lecce’s announcement on... Independent Plus • Listowel Banner • Local News • News Temporary traffic lights at ‘S-Bend’ should be... 4 months ago Independent Plus • Listowel Banner • Local News • News • Walkerton Herald-Times • Wingham Advance Times Province offers advice on how to celebrate holidays... 4 months ago Walkerton Herald-Times Local News • News • Walkerton Herald-Times Saugeen Valley Children’s Safety Village pivots to virtual... 3 days ago HANOVER – The Saugeen Valley Children’s Safety Village is counting the days until it can welcome... Local News • News • Walkerton Herald-Times Paisley man wins $100,000 in Lotto 6/49 draw 2 weeks ago Listowel Banner • Local News • News • Walkerton Herald-Times • Wingham Advance Times Government says Ontario is ready to roll out phase two... 3 weeks ago Wingham Advance Times Local News • News • Wingham Advance Times Huron County paramedic wins prestigious award for the third time 1 week ago HURON COUNTY – Local paramedic Zia Khogyani was honoured at the 2020 Paramedic Recognition Awards... Listowel Banner • Local News • News • Wingham Advance Times Huron-Perth to remain in province’s yellow COVID-19... 1 week ago Listowel Banner • News • Wingham Advance Times Huron-Perth residents ages 75-79 can book COVID-19... 1 week ago Midwestern Newspapers Corp. 185 Wallace Ave., Listowel, ON N4W 1K8 Tel: (519) 291-1660, Ext. 108 Listowel Banner, Independent Plus, Walkerton Herald-Times and the Wingham Advance Times Copyright © 2021. Created by City Media. News Sports Marketplace Contact"
