,crawl_date,domain,url,mime_type_web_server,mime_type_tika,language,content
614788,20210521,midwesternnewspapers.com,https://midwesternnewspapers.com/,text/html,text/html,en,"Home – Midwestern News Facebook News Sports Marketplace Contact News Sports Marketplace Contact Local News Local News • News • Walkerton Herald-Times Grey-Bruce COVID-19 assessment centres announce hours for... 1 day ago GREY-BRUCE – The COVID-19 assessment centres in Kincardine and Owen Sound will be open on... Independent Plus • Listowel Banner • Local News Eden Grove Village purchases former Midwestern Centre site... 4 days ago Not-for-profit corporation takes ownership of extensive Highway 23 property NORTH PERTH – The long... Listowel Banner • Local News • News • Walkerton Herald-Times • Wingham Advance Times Ontario extends stay-at-home order until June 2 1 week ago Golf courses to remain closed, schools to remain in remote learning TORONTO – As expected, the... Listowel Banner • Local News • News Dave Tanner uses pandemic downtime to record songs of hope... 2 weeks ago Passerine Dream album released on all streaming services May 3 Dave Tanner was born and bred in... Listowel Banner Independent Plus • Listowel Banner • Local News Eden Grove Village purchases former Midwestern Centre site... 4 days ago Not-for-profit corporation takes ownership of extensive Highway 23 property NORTH PERTH – The long... Listowel Banner • News • Walkerton Herald-Times • Wingham Advance Times Ontario expands COVID-19 vaccine eligibility to... 4 days ago Listowel Banner • Opinion THE IVORY SILO: Pandemic decisions continue to show... 7 days ago Independent Plus Independent Plus • Listowel Banner • Local News Eden Grove Village purchases former Midwestern Centre site... 4 days ago Not-for-profit corporation takes ownership of extensive Highway 23 property NORTH PERTH – The long... Independent Plus • Listowel Banner • Local News • News • Walkerton Herald-Times • Wingham Advance Times Midwestern Newspapers tallies nine awards at OCNA... 3 weeks ago Independent Plus • Local News • News Huron, Perth, Wellington students returning to class... 4 months ago Walkerton Herald-Times Local News • News • Walkerton Herald-Times Grey-Bruce COVID-19 assessment centres announce hours for... 1 day ago GREY-BRUCE – The COVID-19 assessment centres in Kincardine and Owen Sound will be open on... Listowel Banner • News • Walkerton Herald-Times • Wingham Advance Times Ontario expands COVID-19 vaccine eligibility to... 4 days ago Listowel Banner • Local News • News • Walkerton Herald-Times • Wingham Advance Times Ontario extends stay-at-home order until June 2 1 week ago Wingham Advance Times Listowel Banner • News • Walkerton Herald-Times • Wingham Advance Times Ontario expands COVID-19 vaccine eligibility to everyone 18 and... 4 days ago TORONTO – The Ontario government says anyone born in 2003 or earlier will soon be able to book an... Listowel Banner • Local News • News • Walkerton Herald-Times • Wingham Advance Times Ontario extends stay-at-home order until June 2 1 week ago Listowel Banner • News • Walkerton Herald-Times • Wingham Advance Times Ontario announces paid sick days plan for those... 3 weeks ago Midwestern Newspapers Corp. 185 Wallace Ave., Listowel, ON N4W 1K8 Tel: (519) 291-1660, Ext. 108 Listowel Banner, Independent Plus, Walkerton Herald-Times and the Wingham Advance Times Copyright © 2021. Created by City Media. News Sports Marketplace Contact"
625208,20210528,midwesternnewspapers.com,https://midwesternnewspapers.com/,text/html,text/html,en,"Home – Midwestern News Facebook News Sports Marketplace Contact News Sports Marketplace Contact Local News Local News • News • Wingham Advance Times Morris-Turnberry to end shared building department agreement... 1 min ago By Mike Wilson and Cory Bilyea, Local Journalism Initiative Reporter MORRIS-TURNBERRY – Morris... Listowel Banner • Local News • News • Walkerton Herald-Times • Wingham Advance Times Ontario to accelerate rollout of second doses of COVID-19 vaccine 6 hours ago Province says 65 per cent of adults have received first doses, ahead of schedule TORONTO – The... Listowel Banner • Local News • News North Perth Chamber of Commerce rolling out free COVID rapid... 1 day ago NORTH PERTH – The North Perth Chamber of Commerce and the Ontario Chamber of Commerce, in... Local News • News • Wingham Advance Times Royal Homes celebrates 50 years of business 2 days ago Royal Homes president Pieter Venema talks 50 years in business, impact of COVID-19 virus WINGHAM –... Listowel Banner Listowel Banner • Local News • News • Walkerton Herald-Times • Wingham Advance Times Ontario to accelerate rollout of second doses of COVID-19 vaccine 6 hours ago Province says 65 per cent of adults have received first doses, ahead of schedule TORONTO – The... Listowel Banner • Local News • News North Perth Chamber of Commerce rolling out free COVID... 1 day ago Independent Plus • Listowel Banner • Local News Eden Grove Village purchases former Midwestern Centre... 2 weeks ago Independent Plus Independent Plus • Listowel Banner • Local News Eden Grove Village purchases former Midwestern Centre site... 2 weeks ago Not-for-profit corporation takes ownership of extensive Highway 23 property NORTH PERTH – The long... Independent Plus • Listowel Banner • Local News • News • Walkerton Herald-Times • Wingham Advance Times Midwestern Newspapers tallies nine awards at OCNA... 1 month ago Independent Plus • Local News • News Huron, Perth, Wellington students returning to class... 4 months ago Walkerton Herald-Times Listowel Banner • Local News • News • Walkerton Herald-Times • Wingham Advance Times Ontario to accelerate rollout of second doses of COVID-19 vaccine 6 hours ago Province says 65 per cent of adults have received first doses, ahead of schedule TORONTO – The... Local News • News • Walkerton Herald-Times Grey-Bruce COVID-19 assessment centres announce hours... 1 week ago Listowel Banner • News • Walkerton Herald-Times • Wingham Advance Times Ontario expands COVID-19 vaccine eligibility to... 2 weeks ago Wingham Advance Times Local News • News • Wingham Advance Times Morris-Turnberry to end shared building department agreement... 1 min ago By Mike Wilson and Cory Bilyea, Local Journalism Initiative Reporter MORRIS-TURNBERRY – Morris... Listowel Banner • Local News • News • Walkerton Herald-Times • Wingham Advance Times Ontario to accelerate rollout of second doses of COVID... 6 hours ago Local News • News • Wingham Advance Times Royal Homes celebrates 50 years of business 2 days ago Midwestern Newspapers Corp. 185 Wallace Ave., Listowel, ON N4W 1K8 Tel: (519) 291-1660, Ext. 108 Listowel Banner, Independent Plus, Walkerton Herald-Times and the Wingham Advance Times Copyright © 2021. Created by City Media. News Sports Marketplace Contact"
635851,20210604,midwesternnewspapers.com,https://midwesternnewspapers.com/,text/html,text/html,en,"Home – Midwestern News Facebook News Sports Marketplace Contact News Sports Marketplace Contact Local News Listowel Banner • Local News • News • Wingham Advance Times Listowel, Wingham hospitals update visitors’ guidelines 29 seconds ago LISTOWEL-WINGHAM – With the provincial stay-at-home order lifted, the Listowel Wingham Hospitals... Listowel Banner • Local News • News • Wingham Advance Times Wordofa encourages residents to roll up their sleeves, get... 5 hours ago PERTH COUNTY – Gezahgn Wordofa, the founder of the Multicultural Association of Perth-Huron, wanted... Listowel Banner • Local News • News Local resident wants more information about LGBTQ+ community... 5 hours ago Throughout Pride Month, the Listowel Banner will feature a series of articles exploring the lives... Listowel Banner • Local News • News North Perth Family Health Team, It Takes A Village start vaccine... 6 hours ago LISTOWEL – An initiative connecting members of the North Perth Family Health Team with It Takes a... Listowel Banner Listowel Banner • Local News • News • Wingham Advance Times Listowel, Wingham hospitals update visitors’ guidelines 29 seconds ago LISTOWEL-WINGHAM – With the provincial stay-at-home order lifted, the Listowel Wingham Hospitals... Listowel Banner • Local News • News • Wingham Advance Times Wordofa encourages residents to roll up their sleeves... 5 hours ago Listowel Banner • Local News • News Local resident wants more information about LGBTQ+... 5 hours ago Independent Plus Independent Plus • Listowel Banner • Local News Eden Grove Village purchases former Midwestern Centre site... 3 weeks ago Not-for-profit corporation takes ownership of extensive Highway 23 property NORTH PERTH – The long... Independent Plus • Listowel Banner • Local News • News • Walkerton Herald-Times • Wingham Advance Times Midwestern Newspapers tallies nine awards at OCNA... 1 month ago Independent Plus • Local News • News Huron, Perth, Wellington students returning to class... 4 months ago Walkerton Herald-Times Listowel Banner • Local News • News • Walkerton Herald-Times • Wingham Advance Times Premier: no in-class learning until fall 2 days ago Stay-at-home order expires but emergency orders remain in place By Jordan Snobelen, Wellington... Local News • News • Walkerton Herald-Times Golf Fore Hospice garage sale postponed to June 10-12 2 days ago Local News • News • Walkerton Herald-Times Hanover and District Hospital adjusts hours of... 2 days ago Wingham Advance Times Listowel Banner • Local News • News • Wingham Advance Times Listowel, Wingham hospitals update visitors’ guidelines 29 seconds ago LISTOWEL-WINGHAM – With the provincial stay-at-home order lifted, the Listowel Wingham Hospitals... Listowel Banner • Local News • News • Wingham Advance Times Wordofa encourages residents to roll up their sleeves... 5 hours ago Listowel Banner • Local News • News • Walkerton Herald-Times • Wingham Advance Times Premier: no in-class learning until fall 2 days ago Midwestern Newspapers Corp. 185 Wallace Ave., Listowel, ON N4W 1K8 Tel: (519) 291-1660, Ext. 108 Listowel Banner, Independent Plus, Walkerton Herald-Times and the Wingham Advance Times Copyright © 2021. Created by City Media. News Sports Marketplace Contact"
646412,20210611,midwesternnewspapers.com,https://midwesternnewspapers.com/,text/html,text/html,en,"Home – Midwestern News Facebook News Sports Marketplace Contact News Sports Marketplace Contact Local News Listowel Banner • Local News • News Garnet Jobagy finds comfort in the community of LGBTQ+ supports 4 hours ago Throughout Pride Month, the Listowel Banner will feature a series of articles exploring the lives... Local News • News • Walkerton Herald-Times Brockton among 43 communities getting natural gas in phase 2 of... 2 days ago BRUCE COUNTY – MPP Bill Walker, associate minister of energy, joined Premier Doug Ford on... Listowel Banner • Local News • News • Walkerton Herald-Times • Wingham Advance Times Ontario moving to step one of reopening plan on Friday 4 days ago TORONTO – The Ontario government announced on Monday its intention to move the province into step... Listowel Banner • Local News • News Local resident raises awareness of high cost of living for North... 5 days ago NORTH PERTH – Brenda Brunton was tired of seeing people living on fixed incomes discussing the high... Listowel Banner Listowel Banner • Local News • News Garnet Jobagy finds comfort in the community of LGBTQ+ supports 4 hours ago Throughout Pride Month, the Listowel Banner will feature a series of articles exploring the lives... Listowel Banner • Local News • News • Walkerton Herald-Times • Wingham Advance Times Ontario moving to step one of reopening plan on Friday 4 days ago Listowel Banner • Local News • News Local resident raises awareness of high cost of living... 5 days ago Independent Plus Independent Plus • Listowel Banner • Local News Eden Grove Village purchases former Midwestern Centre site... 4 weeks ago Not-for-profit corporation takes ownership of extensive Highway 23 property NORTH PERTH – The long... Independent Plus • Listowel Banner • Local News • News • Walkerton Herald-Times • Wingham Advance Times Midwestern Newspapers tallies nine awards at OCNA... 1 month ago Independent Plus • Local News • News Huron, Perth, Wellington students returning to class... 4 months ago Walkerton Herald-Times Local News • News • Walkerton Herald-Times Brockton among 43 communities getting natural gas in phase 2 of... 2 days ago BRUCE COUNTY – MPP Bill Walker, associate minister of energy, joined Premier Doug Ford on... Listowel Banner • Local News • News • Walkerton Herald-Times • Wingham Advance Times Ontario moving to step one of reopening plan on Friday 4 days ago Listowel Banner • Local News • News • Walkerton Herald-Times • Wingham Advance Times Premier: no in-class learning until fall 1 week ago Wingham Advance Times Listowel Banner • Local News • News • Walkerton Herald-Times • Wingham Advance Times Ontario moving to step one of reopening plan on Friday 4 days ago TORONTO – The Ontario government announced on Monday its intention to move the province into step... Listowel Banner • Local News • News • Wingham Advance Times Listowel, Wingham hospitals update visitors’... 1 week ago Listowel Banner • Local News • News • Wingham Advance Times Wordofa encourages residents to roll up their sleeves... 1 week ago Midwestern Newspapers Corp. 185 Wallace Ave., Listowel, ON N4W 1K8 Tel: (519) 291-1660, Ext. 108 Listowel Banner, Independent Plus, Walkerton Herald-Times and the Wingham Advance Times Copyright © 2021. Created by City Media. News Sports Marketplace Contact"
657225,20210618,midwesternnewspapers.com,https://midwesternnewspapers.com/,text/html,text/html,en,"Home – Midwestern News Facebook News Sports Marketplace Contact News Sports Marketplace Contact Local News Local News • News • Walkerton Herald-Times • Wingham Advance Times Lisa Thompson named Ontario’s new agriculture minister in... 6 seconds ago TORONTO – Lisa Thompson, MPP for Huron-Bruce, former education minister and most recently... Listowel Banner • Local News • News 100 Feline Friends Who Care work to reduce cat overpopulation... 5 hours ago PERTH COUNTY – In the spirit of the established format of groups of 100 people forming to make a... Listowel Banner • Local News • News LGBTQ2S+ discussions in local classroom bring education full... 6 hours ago Throughout Pride Month, the Listowel Banner will feature a series of articles exploring the lives... Listowel Banner • Local News • News Listowel family doctor publishes penicillin allergy research in... 1 day ago Dr. Gateman: ‘If you pick the right patient and the right situation, 95 per cent of people don’t... Listowel Banner Listowel Banner • Local News • News 100 Feline Friends Who Care work to reduce cat overpopulation... 5 hours ago PERTH COUNTY – In the spirit of the established format of groups of 100 people forming to make a... Listowel Banner • Local News • News LGBTQ2S+ discussions in local classroom bring... 6 hours ago Listowel Banner • Local News • News Listowel family doctor publishes penicillin allergy... 1 day ago Independent Plus Independent Plus • Listowel Banner • Local News Eden Grove Village purchases former Midwestern Centre site... 1 month ago Not-for-profit corporation takes ownership of extensive Highway 23 property NORTH PERTH – The long... Independent Plus • Listowel Banner • Local News • News • Walkerton Herald-Times • Wingham Advance Times Midwestern Newspapers tallies nine awards at OCNA... 2 months ago Independent Plus • Local News • News Huron, Perth, Wellington students returning to class... 4 months ago Walkerton Herald-Times Local News • News • Walkerton Herald-Times • Wingham Advance Times Lisa Thompson named Ontario’s new agriculture minister in... 7 seconds ago TORONTO – Lisa Thompson, MPP for Huron-Bruce, former education minister and most recently... Columns • Listowel Banner • Opinion • Walkerton Herald-Times • Wingham Advance Times The impact of genocide in Canada 4 days ago Local News • News • Walkerton Herald-Times Brockton among 43 communities getting natural gas in... 1 week ago Wingham Advance Times Local News • News • Walkerton Herald-Times • Wingham Advance Times Lisa Thompson named Ontario’s new agriculture minister in... 7 seconds ago TORONTO – Lisa Thompson, MPP for Huron-Bruce, former education minister and most recently... Columns • Listowel Banner • Opinion • Walkerton Herald-Times • Wingham Advance Times The impact of genocide in Canada 4 days ago Listowel Banner • Local News • News • Walkerton Herald-Times • Wingham Advance Times Ontario moving to step one of reopening plan on Friday 2 weeks ago Midwestern Newspapers Corp. 185 Wallace Ave., Listowel, ON N4W 1K8 Tel: (519) 291-1660, Ext. 108 Listowel Banner, Independent Plus, Walkerton Herald-Times and the Wingham Advance Times Copyright © 2021. Created by City Media. News Sports Marketplace Contact"
663059,20210625,midwesternnewspapers.com,https://midwesternnewspapers.com/,text/html,text/html,en,"Home – Midwestern News Facebook News Sports Marketplace Contact News Sports Marketplace Contact Local News Listowel Banner • Local News • News As North Perth becomes more diverse, it is being asked to... 9 mins ago Throughout Pride Month, the Listowel Banner will feature a series of articles exploring the lives... Local News • News • Walkerton Herald-Times Saugeen Valley Conservation Authority issues flood outlook... 1 day ago GREY-BRUCE – The Saugeen Valley Conservation Authority advises that a strong storm system will be... Listowel Banner • Local News • News • Walkerton Herald-Times • Wingham Advance Times Ontario to move to Step 2 of reopening plan on June 30 1 day ago TORONTO — Ontario will be entering step two of its “Roadmap to Reopen” plan on June 30... Local News • News • Walkerton Herald-Times • Wingham Advance Times Lisa Thompson named Ontario’s new agriculture minister in... 7 days ago TORONTO – Lisa Thompson, MPP for Huron-Bruce, former education minister and most recently... Listowel Banner Listowel Banner • News Perth County officially adopts Diversity, Equity and Anti-Racism... 56 seconds ago PERTH COUNTY – After reluctantly addressing the issue of racism in Perth County, council adopted a... Listowel Banner • Local News • News As North Perth becomes more diverse, it is being asked... 9 mins ago Listowel Banner • Local News • News • Walkerton Herald-Times • Wingham Advance Times Ontario to move to Step 2 of reopening plan on June 30 1 day ago Independent Plus Independent Plus • Listowel Banner • Local News Eden Grove Village purchases former Midwestern Centre site... 1 month ago Not-for-profit corporation takes ownership of extensive Highway 23 property NORTH PERTH – The long... Independent Plus • Listowel Banner • Local News • News • Walkerton Herald-Times • Wingham Advance Times Midwestern Newspapers tallies nine awards at OCNA... 2 months ago Independent Plus • Local News • News Huron, Perth, Wellington students returning to class... 5 months ago Walkerton Herald-Times Local News • News • Walkerton Herald-Times Saugeen Valley Conservation Authority issues flood outlook... 1 day ago GREY-BRUCE – The Saugeen Valley Conservation Authority advises that a strong storm system will be... Listowel Banner • Local News • News • Walkerton Herald-Times • Wingham Advance Times Ontario to move to Step 2 of reopening plan on June 30 1 day ago Local News • News • Walkerton Herald-Times • Wingham Advance Times Lisa Thompson named Ontario’s new agriculture minister... 7 days ago Wingham Advance Times Listowel Banner • Local News • News • Walkerton Herald-Times • Wingham Advance Times Ontario to move to Step 2 of reopening plan on June 30 1 day ago TORONTO — Ontario will be entering step two of its “Roadmap to Reopen” plan on June 30... Local News • News • Walkerton Herald-Times • Wingham Advance Times Lisa Thompson named Ontario’s new agriculture minister... 7 days ago Columns • Listowel Banner • Opinion • Walkerton Herald-Times • Wingham Advance Times The impact of genocide in Canada 2 weeks ago Midwestern Newspapers Corp. 185 Wallace Ave., Listowel, ON N4W 1K8 Tel: (519) 291-1660, Ext. 108 Listowel Banner, Independent Plus, Walkerton Herald-Times and the Wingham Advance Times Copyright © 2021. Created by City Media. News Sports Marketplace Contact"
668849,20210702,midwesternnewspapers.com,https://midwesternnewspapers.com/,text/html,text/html,en,"Home – Midwestern News Facebook News Sports Marketplace Contact News Sports Marketplace Contact Local News Listowel Banner • Local News • News • Walkerton Herald-Times • Wingham Advance Times Province scaling back visitor restrictions at long-term care... 3 days ago By Jordan Snobelen, Wellington Advertiser TORONTO – Residents living in long-term care facilities... Local News • News • Walkerton Herald-Times Flood watch downgraded to water safety statement 4 days ago GREY-BRUCE – The Saugeen Valley Conservation Authority advises that the flood watch issued over the... Local News • News • Walkerton Herald-Times Saugeen Valley Conservation Authority upgrades flood statement... 6 days ago GREY-BRUCE – The Saugeen Valley Conservation Authority advises that the watershed received between... Listowel Banner • Local News • News As North Perth becomes more diverse, it is being asked to... 1 week ago Throughout Pride Month, the Listowel Banner will feature a series of articles exploring the lives... Listowel Banner Listowel Banner • Local News • News • Walkerton Herald-Times • Wingham Advance Times Province scaling back visitor restrictions at long-term care... 3 days ago By Jordan Snobelen, Wellington Advertiser TORONTO – Residents living in long-term care facilities... Listowel Banner • News Perth County officially adopts Diversity, Equity and... 1 week ago Listowel Banner • Local News • News As North Perth becomes more diverse, it is being asked... 1 week ago Independent Plus Independent Plus • Listowel Banner • Local News Eden Grove Village purchases former Midwestern Centre site... 2 months ago Not-for-profit corporation takes ownership of extensive Highway 23 property NORTH PERTH – The long... Independent Plus • Listowel Banner • Local News • News • Walkerton Herald-Times • Wingham Advance Times Midwestern Newspapers tallies nine awards at OCNA... 2 months ago Independent Plus • Local News • News Huron, Perth, Wellington students returning to class... 5 months ago Walkerton Herald-Times Listowel Banner • Local News • News • Walkerton Herald-Times • Wingham Advance Times Province scaling back visitor restrictions at long-term care... 3 days ago By Jordan Snobelen, Wellington Advertiser TORONTO – Residents living in long-term care facilities... Local News • News • Walkerton Herald-Times Flood watch downgraded to water safety statement 4 days ago Local News • News • Walkerton Herald-Times Saugeen Valley Conservation Authority upgrades flood... 6 days ago Wingham Advance Times Listowel Banner • Local News • News • Walkerton Herald-Times • Wingham Advance Times Province scaling back visitor restrictions at long-term care... 3 days ago By Jordan Snobelen, Wellington Advertiser TORONTO – Residents living in long-term care facilities... Listowel Banner • Local News • News • Walkerton Herald-Times • Wingham Advance Times Ontario to move to Step 2 of reopening plan on June 30 1 week ago Local News • News • Walkerton Herald-Times • Wingham Advance Times Lisa Thompson named Ontario’s new agriculture minister... 2 weeks ago Midwestern Newspapers Corp. 185 Wallace Ave., Listowel, ON N4W 1K8 Tel: (519) 291-1660, Ext. 108 Listowel Banner, Independent Plus, Walkerton Herald-Times and the Wingham Advance Times Copyright © 2021. Created by City Media. News Sports Marketplace Contact"
