,crawl_date,domain,url,mime_type_web_server,mime_type_tika,language,content
90607,20200612,news.ontario.ca,https://news.ontario.ca/medg/en/2020/06/ontario-and-canada-helping-small-businesses-go-digital.html,text/html,text/html,en,"Newsroom : Ontario and Canada Helping Small Businesses Go Digital COVID-19: Get the latest updates or take a self-assessment. Skip to main Content Français Newsroomhome page Ontario Newsroom Ontario and Canada Helping Small Businesses Go Digital News Release Ontario and Canada Helping Small Businesses Go Digital $57 Million Investment in Digital Main Street Will Help Businesses Reopen, Recover and Grow Long after COVID-19 June 11, 2020 10:00 A.M. Ministry of Economic Development, Job Creation and Trade TORONTO — The Ontario government, in partnership with the federal government, is helping small businesses reach more customers through the Digital Main Street platform. It is a $57-million program which will help up to 22,900 Ontario businesses create and enhance their online presence and generate jobs for more than 1,400 students. The new program was unveiled today by Prabmeet Sarkaria, Associate Minister of Small Business and Red Tape Reduction, joined by Mélanie Joly, Minister of Economic Development and Official Languages and Minister responsible for the Federal Economic Development Agency for Southern Ontario. ""Ontario's small businesses are the backbone of our economy, and their recovery is critical to Ontario's recovery,"" said Minister Sarkaria. ""As thousands of small businesses across the province closed their doors and halted business during the COVID-19 outbreak, many struggled to shift sales or services online. I am very pleased, that together with Minister Joly and our federal partners, we are providing small businesses with the tools they need to recover, and flourish, as Ontario reopens."" Through the $57-million contribution to the Digital Main Street platform, businesses will be able to take advantage of three new programs to support their digital transformation: shopHERE powered by Google will leverage Ontario's strengths by hiring highly skilled and trained students to build and support the launch of online stores for businesses that previously did not have the capacity to do so themselves. The core goal will be to help small businesses compete and grow, in a world that is increasingly online, and help them recover as quickly as possible following COVID-19. Digital Main Street Grant will help main street small businesses be digitally more effective. Through a $2,500 grant administered by the Ontario BIA Association, small businesses will be able to adopt new technologies and embrace digital marketing. Municipalities, Chambers of Commerce, and Business Improvement Areas (BIAs) can apply for a Digital Service Squad grant, which will allow them to establish teams to provide personalized, one-on-one support. Future-Proofing Main Street will provide specialized and in-depth digital transformation services and support that helps existing main-street firms adapt to changes in their sector and thrive in the new economy. By leveraging teams of digital marketing professionals and talented students, these firms will be able to create new online business models, develop and implement digital and e-commerce marketing strategies, and maximize digital tools, platforms and content. In addition, the Recovery Activation Program, operated through the Toronto Region Board of Trade, will help businesses grow and digitize their operations with custom consulting sessions, online resource sharing, learning webcasts and business planning. As a result of the investment announced today, the program will be offered province-wide and at no cost to businesses. ""As local economies across Ontario reopen, we're focused on ensuring that our main streets don't just survive, but thrive,"" said Mélanie Joly, Canada's Minister of Economic Development and Official Languages and Minister responsible for the Federal Economic Development Agency for Southern Ontario.""These businesses are the backbone of our economy, a source of local jobs - and local pride. Thanks to the expanded Digital Main Street platform, they'll be able to expand their offerings and take advantage of more and more people shopping online. Our message to Ontario's small businesses and those whose livelihoods rely on them is clear: we're working with you to support good jobs and help our economy come back stronger than ever."" ""The global marketplace is rapidly changing, and in order to compete and succeed Ontario must adapt,"" said Vic Fedeli, Minister of Economic Development, Job Creation and Trade. ""By using innovative tools and technologies, Digital Main Street will help our businesses in expanding their reach to meet new markets and adjust to the new realities of doing business during the pandemic and into the next phase of economic recovery."" About 60 percent of Ontario's small enterprises have a website, and only seven percent have an online payment solution. Digitally, Canadian businesses are estimated to be two years behind their U.S. counterparts. In response, the Ontario government is providing significant support to small business. Along with the Digital Main Street platform, the province is investing an additional $150 million in rural broadband which will help open the digital road for many Ontario small businesses. In addition, the province has proposed a ban on commercial evictions to help businesses that have been impacted by restrictions due to COVID-19. Quick Facts The Ontario Government reduced the small business Corporate Income Tax rate by 8.7 percent starting January 1, 2020. This will deliver up to $1,500 in annual savings to more than 275,000 businesses. Ontario’s Small Business Success Strategy, launched prior to COVID-19, identified the need for small businesses across the province to build or enhance their online presence to remain competitive and expand their markets. The 2020 pandemic has further reinforced the need for Ontario small businesses to embrace digital tools, including having online storefronts and expanding them. To further support small businesses with physical storefronts impacted by COVID-19 restrictions, Ontario is Proposing a Temporary Ban on Commercial Evictions. The planned expansion of these Digital Main Street programs, including ShopHERE powered by Google and the Future-Proofing Main Street program, are the next evolution in efforts to help businesses embrace digital tools that began with the City of Toronto. Through the leadership of Mayor John Tory and the City of Toronto, the Toronto Association of Business Improvement Areas (TABIA) pioneered the creation of Digital Main Street and laid the foundation for it to be expanded and scaled-up to serve businesses across the province. The expansion of the Toronto Association of Business Improvement Areas’ (TABIA) Digital Main Street platform and program is delivered by the Ontario Business Improvement Area Association (OBIAA) with the financial support of the provincial and federal governments. shopHERE is a Digital Main Street program operated by TABIA. TABIA will also support the delivery of the Future-Proofing Main Street program, along with Communitech and Invest Ottawa. The Recovery Activation Program is operated by the Toronto Region Board of Trade. Background Information Stakeholder Response to Digital Main Street Additional Resources For more information on the Digital Main Street, go to: digitalmainstreet.ca/ontario Visit Ontario.ca/reopen for more information on economic reopening Learn more about A Framework for Reopening our Province: Stage 1 Find more Resources to prevent COVID-19 in the workplace Tell us about the economic impacts of the COVID-19 outbreak See how Ontario is Improving Broadband and Cell Service for Rural Communities Media Contacts Ian Allen Minister Sarkaria’s Office ian.allen@ontario.ca Kwok Wong Communications Branch kwok.wong@ontario.ca 647-504-2774 Share Share this story on Facebook Tweet a link to this story Email this story Print this story Tags Business and Economy Government Jobs and Employment Download Download Text Download Electronic Press Kit Choose which press-ready content you'd prefer to download. News Release (.doc) Backgrounder Stay Connected Register to receive email updates directly to your inbox. Customize your subscription to get the news you want, when you want it. SUBSCRIBE Share RSS Youtube Flickr Twitter Newsroom Ontario's official news source. Recent News All News Contact Us Subscription Help For the Press Media Contacts ABOUT ONTARIO Privacy Accessibility Queen's Printer for Ontario, 2020"
90613,20200612,news.ontario.ca,https://news.ontario.ca/ene/en/2020/06/beaches-and-campsites-to-open-at-ontario-parks.html,text/html,text/html,en,"Newsroom : Beaches and Campsites to Open at Ontario Parks COVID-19: Get the latest updates or take a self-assessment. Skip to main Content Français Newsroomhome page Ontario Newsroom Beaches and Campsites to Open at Ontario Parks News Release Beaches and Campsites to Open at Ontario Parks People encouraged to enjoy the outdoors responsibly during COVID-19 June 10, 2020 2:00 P.M. Ministry of the Environment, Conservation and Parks TORONTO — As part of the Ontario government's Stage 2 reopening plan, more facilities and services will be available at provincial parks in certain regions beginning on June 12, 2020. Gradually over the next several weeks, Ontario Parks will start opening campgrounds, providing more washrooms and drinking water, along with roofed accommodations, park store and rental operations, visitor centres, and sports fields. It's important to check what facilities and services are available before visiting a provincial park. ""Due to the tremendous progress we have made to contain the spread of COVID-19, more services and activities will soon be available at our provincial parks,"" said Jeff Yurek, Minister of the Environment, Conservation and Parks. ""While this is encouraging, it is not business as usual. I encourage everyone to be responsible and continue to follow public health advice, including physical distancing, when enjoying our outdoor amenities."" The following is a list of recreational activities and facilities that will be opening soon at provincial parks in regions entering Stage 2: On June 12, beaches at Ontario Parks will begin opening to the public as maintenance and water testing are completed. On June 15, campers enrolled in this year's Ontario Parks' Seasonal Campsite Program will now have access to their campsites at the majority of participating provincial parks. Those who were preselected in 2019 for the program will be contacted by Ontario Parks directly regarding the status of their reservation. Beginning the week of June 22, all other campgrounds in regions entering Stage 2 will gradually open at provincial parks, along with washrooms, water taps and trailer sanitation stations. Roofed accommodations (e.g., yurts, cabins and lodges, where available), park store and rental operations, visitor centers, and sports fields will be phased in over the next several weeks. Facilities such as showers, laundry, group camping, picnic shelter rentals and swimming pools will remain closed for the rest of the 2020 season. Visitors should check OntarioParks.com to see what facilities and services are available before visiting a provincial park. To help protect visitors and staff, Ontario Parks will be implementing measures to address overcrowding and promote physical distancing in park spaces and buildings during busy visitation times, by limiting occupancy for day-use and camping in select provincial parks. This may include limiting the number of daily vehicle permits sold or the number of campsites available for reservations. Ministry officers will be present in provincial parks to provide information, assist with emergencies and enforce provincial park rules and regulations. Additionally, these areas may be patrolled by local police or other enforcement agencies. Quick Facts Any reservations for campgrounds (and select backcountry campsites that currently remain closed) up to and into the week of June 22 will be automatically cancelled and you will receive a full refund with no penalty. To ensure the safety of visitors and staff, Ontario Parks will continue to be guided by public health advice and will continually assess and adjust operational and safety protocols as required. Ontario Parks manages 340 provincial parks and 295 conservation reserves, covering over nine million hectares of land in the province. Ontario Parks operates almost 19,000 campground campsites throughout the province. Additional Resources Visit Ontario Parks for up to date information about your local park Find a provincial park or conservation reserve near you Learn more about the first phase of Ontario’s Action Plan: Responding to COVID-19 Visit Ontario’s website to learn more about how the province continues to protect Ontarians from COVID-19 Media Contacts Gary Wheeler Communications Branch Gary.S.Wheeler@ontario.ca 416-314-6666 Andrew Buttigieg Minister's Office Andrew.Buttigieg@ontario.ca 437-224-4599 Share Share this story on Facebook Tweet a link to this story Email this story Print this story Tags Environment and Energy Government Home and Community Download Download Text Stay Connected Register to receive email updates directly to your inbox. Customize your subscription to get the news you want, when you want it. SUBSCRIBE Share RSS Youtube Flickr Twitter Newsroom Ontario's official news source. Recent News All News Contact Us Subscription Help For the Press Media Contacts ABOUT ONTARIO Privacy Accessibility Queen's Printer for Ontario, 2020"
90620,20200612,news.ontario.ca,https://news.ontario.ca/opo/en/2020/06/ontario-unveils-a-plan-to-reopen-postsecondary-education.html,text/html,text/html,en,"Newsroom : Ontario Unveils a Plan to Reopen Postsecondary Education COVID-19: Get the latest updates or take a self-assessment. Skip to main Content Français Newsroomhome page Ontario Newsroom Ontario Unveils a Plan to Reopen Postsecondary Education News Release Ontario Unveils a Plan to Reopen Postsecondary Education Phased Approach Prioritizes the Health and Safety of Students and Staff June 10, 2020 1:30 P.M. Office of the Premier TORONTO — The Ontario government has developed a plan for the gradual and safe resumption of in-person instruction at postsecondary institutions across the province for the summer term. The plan was developed in consultation with the Chief Medical Officer of Health. Starting in July 2020, limited in-person education and training may restart for students who were not able to graduate due to COVID-19 closures. This first phase will allow institutions to reopen to provide in-person instruction to students in essential, frontline, and high labour market demand areas, such as nursing, personal support workers, engineering, and other critical professions. Thousands of students across the province could benefit from this summer's reopening. In September, all students will have the opportunity to attend postsecondary education through virtual learning, in-class instruction, or hybrid formats. ""Whether it's donating PPE, researching a vaccine or treatment, or helping with contact tracing, our students, researchers and postsecondary community in Ontario have stepped up in a big way to support our frontline health care workers in response to COVID-19,"" said Premier Doug Ford. ""Now, we have to have their backs and make sure our students can keep learning, in class or virtually, and become the next generation of frontline heroes, innovators and community builders."" The limited summer reopening will help individual institutions prepare for the fall term by ensuring proper health and safety protocols are in place. The province is developing a framework to be released to the sector in the coming days, which will provide guidance on the summer reopening and on health and safety measures. Publicly assisted colleges and universities, Indigenous Institutes, private career colleges and other postsecondary education institutions may participate in this voluntary reopening. Institutions that choose to participate will be responsible for establishing their own plans for this limited reopening in accordance with public health advice and any ministry guidance. ""It's critical that we allow students to complete their studies and graduate so they can join the workforce in high-demand, frontline roles and help put the province back on the path to prosperity,"" said Ross Romano, Minister of Colleges and Universities. ""I will continue to collaborate with the postsecondary sector to determine how best to move forward on reopening our campuses in the fall and beyond in a way that is responsible and safe for our students and staff."" In order to maintain Ontario's position as a global leader in higher education and research, the government will also begin working on a digital and academic modernization framework this summer. Through this exercise, it will look at unlocking the potential of virtual learning, adapting postsecondary education and training to meet the needs of a rapidly changing job market and economy, increasing the accountability of postsecondary education, developing the necessary physical and digital infrastructure, and fully realizing the value of research, innovation, and intellectual property licensing in the domestic and global marketplace. Quick Facts In 2018-19, more than 800,000 students enrolled in Ontario’s colleges, universities, Indigenous Institutes and private career colleges located in every region of the province. Led by the work of the Ontario Jobs and Recovery Committee, and in consultation with the Chief Medical Officer of Health and health experts, the government is planning a measured and phased approach outlined in A Framework for Reopening our Province. Background Information A Path Forward for Advanced Education, Research and Science in Ontario Additional Resources Visit Ontario's website to learn more about how the province continues to protect Ontarians from COVID-19 or to take a self assessment. Read more about the province’s Ontario Together initiative. Quotes “We're pleased the government continues to demonstrate such strong support for colleges and to ensuring students complete their programs, particularly in areas where there is a clear demand for more graduates. Throughout Ontario, faculty and staff have found creative and effective ways to continue delivering high-quality programs. We're excited to be collaborating with the government on further measures to modernize post-secondary education, including creating more opportunities for people who need to retrain for new careers during Ontario's economic recovery.” Linda Franklin President and CEO, Colleges Ontario “The health and safety of our students, faculty and staff remains a top priority for Ontario’s universities. Our institutions will continue to work diligently to provide the safest options for summer and fall enrolment that both align with public health regulations and ensure students continue to receive a high quality education and an enriching university experience that ensures they graduate with the adaptable skills required to help retool and reimagine industries, stimulate economic growth and rebuild Ontario.” David Lindsay President & CEO, Council of Ontario Universities Media Contacts Ivana Yelich Premier's Office Ivana.Yelich@ontario.ca Scott Ramsay Minister Romano’s Office Scott.Ramsay@ontario.ca Ciara Byrne Communications Branch 416 325-2746 Public Inquiries: 416 325-2929 TTY: 1 800 268-7095 Share Share this story on Facebook Tweet a link to this story Email this story Print this story Tags Education and Training Government Health and Wellness Download Download Text Download Electronic Press Kit Choose which press-ready content you'd prefer to download. News Release (.doc) Backgrounder Stay Connected Register to receive email updates directly to your inbox. Customize your subscription to get the news you want, when you want it. SUBSCRIBE Share RSS Youtube Flickr Twitter Newsroom Ontario's official news source. Recent News All News Contact Us Subscription Help For the Press Media Contacts ABOUT ONTARIO Privacy Accessibility Queen's Printer for Ontario, 2020"
