,crawl_date,domain,url,mime_type_web_server,mime_type_tika,language,content
423669,20210108,niagaraanglican.news,https://niagaraanglican.news/,text/html,text/html,en,"The Niagara Anglican – A Gathering Place and a Sounding Board for the People of the Diocese of Niagara – Since 1955 Skip to content The Niagara Anglican A Gathering Place and a Sounding Board for the People of the Diocese of Niagara – Since 1955 Menu Primary Navigation Home About Contact Us Social Navigation Twitter The online presence of The Niagara Anglican monthly print newspaper. We serve the Diocese of Niagara and its' many parishes. An archive of the monthly print edition can be found here. Search for: Follow The Niagara Anglican via Email Enter your email address to follow The Niagara Anglican and receive notifications of new posts by email. Email Address: Follow Recent Posts A Big Dig starts at  St. Matthew’s House January 7, 2021 The Story of the Magi and the Story of the Bible January 6, 2021 Hope: the Great Conqueror January 5, 2021 Synod Delegates Reflect January 4, 2021 Other Links The Diocese of Niagara Anglican Journal Americans need Canadian prayers. They also need Canadian action. January 7, 2021 Pandemic year ends with surplus—but cuts likely at national office from 2022, CoGS hears January 7, 2021 Dismantling Racism Task Force appointed January 7, 2021 Anglican Church of Canada Happy New Year! January 1, 2021 Primate calls on Anglicans to ring bells at Christmas December 19, 2020 A joint Christmas message from the Primate and National Bishop December 17, 2020 The Diocese of NiagaraMy Tweets The Niagara AnglicanMy Tweets St. Matthew's House Hamilton A Big Dig starts at  St. Matthew’s House The first phase of the first #GreenMyCity project got underway in November at St. Matthew’s House – with big machinery … Continue reading A Big Dig starts at  St. Matthew’s House Epiphany, In Other Words The Story of the Magi and the Story of the Bible John Bowen One of the joys for me in recent years has been telling Bible stories to children and families … Continue reading The Story of the Magi and the Story of the Bible Hope, Suffering Hope: the Great Conqueror By the Reverend Michael Coren A new year, a new start, a new hope. It’s a time to look to … Continue reading Hope: the Great Conqueror Diocese of Niagara, Synod Synod Delegates Reflect Sue Thibodeau, St. John’s, Port Dalhousie A Zoom version of Synod—not what I was looking forward to on the morning … Continue reading Synod Delegates Reflect Bishop's Charge, Diocese of Niagara, Synod The Bishop’s Charge to the 146th Synod of the Diocese of Niagara by The Right Reverend Susan J.A. Bell + In the name of God: Father, Son and Holy Spirit. Amen. Well, … Continue reading The Bishop’s Charge to the 146th Synod of the Diocese of Niagara Diocese of Niagara, Synod Unique and Uplifting Synod Charts Course for 2021 “Enlighten the eyes of our hearts,” was the response to the opening prayers of the 146th synod of the diocese … Continue reading Unique and Uplifting Synod Charts Course for 2021 Climate Justice Niagara Climate Justice Niagara’s 2021 Resolutions By Sue Carson The beginning of 2020 was probably the worst time for us to make environmental resolutions. Climate Justice … Continue reading Climate Justice Niagara’s 2021 Resolutions Diocese of Niagara, gender identity Bishop Authorizes New Naming Liturgy Bishop Susan Bell has authorized for use in the Diocese of Niagara an interim rite to enable clergy to better … Continue reading Bishop Authorizes New Naming Liturgy Now Playing An Ancient Present Again By The Venerable Max Woolaver “Old men ought to be explorers…” wrote T.S. Eliot in the East Coker section of … Continue reading An Ancient Present Again Archbishop Linda Nicholls, Bishop Susan Bell, Bishop's Company Primate Joins Bishop for Virtual Event Bishop Susan Bell recently hosted Archbishop Linda Nicholls, Primate of the Anglican Church of Canada, for a special evening of … Continue reading Primate Joins Bishop for Virtual Event Posts navigation Older posts Website Powered by WordPress.com. Add your thoughts here... (optional) Post to Cancel"
433104,20210115,niagaraanglican.news,https://niagaraanglican.news/,text/html,text/html,en,"The Niagara Anglican – A Gathering Place and a Sounding Board for the People of the Diocese of Niagara – Since 1955 Skip to content The Niagara Anglican A Gathering Place and a Sounding Board for the People of the Diocese of Niagara – Since 1955 Menu Primary Navigation Home About Contact Us Social Navigation Twitter The online presence of The Niagara Anglican monthly print newspaper. We serve the Diocese of Niagara and its' many parishes. An archive of the monthly print edition can be found here. Search for: Follow The Niagara Anglican via Email Enter your email address to follow The Niagara Anglican and receive notifications of new posts by email. Email Address: Follow Recent Posts Toonie Loonie fundraiser January 13, 2021 Late Have I Loved You: On Beauty January 12, 2021 The Deacon’s Bench January 11, 2021 Human trafficking and a cup of tea January 9, 2021 Other Links The Diocese of Niagara Anglican Journal CoGS hears of ‘transformative change’ across church January 12, 2021 Hildegard of Bingen January 12, 2021 Edmonton church avoids COVID-19 outbreak after presence of infected person at service January 11, 2021 Anglican Church of Canada World Interfaith Harmony Week: February 1-7, 2021 January 14, 2021 2021 Week of Prayer for Christian Unity video service January 11, 2021 Happy New Year! January 1, 2021 The Diocese of NiagaraMy Tweets The Niagara AnglicanMy Tweets PWRDF, St. Mark’s Orangeville Toonie Loonie fundraiser St Mark’s Orangeville held their annual Toonie Loonie fundraiser in October 2020. The $1000 raised will go towards the … Continue reading Toonie Loonie fundraiser Theology Late Have I Loved You: On Beauty The Rev’d Dr. Daniel Tatarnic Two years ago, I visited the Italian city of Ravenna, the world’s most significant region … Continue reading Late Have I Loved You: On Beauty Leadership, The Deacon's Bench The Deacon’s Bench The Reverend Deacon Paul Bates I have been working on a book titled, For Others To Follow: An Ethos of … Continue reading The Deacon’s Bench Human trafficking, Climate Justice Niagara Human trafficking and a cup of tea By Dierdre Pike “Human trafficking and slavery are evil, violent crimes against God, creation and humanity. They take root and … Continue reading Human trafficking and a cup of tea Hope God In The Darkness By the Reverend Canon Sharyn Hall In these winter days, we are well aware of the physical contrast between light … Continue reading God In The Darkness St. Matthew's House Hamilton A Big Dig starts at  St. Matthew’s House The first phase of the first #GreenMyCity project got underway in November at St. Matthew’s House – with big machinery … Continue reading A Big Dig starts at  St. Matthew’s House Epiphany, In Other Words The Story of the Magi and the Story of the Bible John Bowen One of the joys for me in recent years has been telling Bible stories to children and families … Continue reading The Story of the Magi and the Story of the Bible Hope, Suffering Hope: the Great Conqueror By the Reverend Michael Coren A new year, a new start, a new hope. It’s a time to look to … Continue reading Hope: the Great Conqueror Diocese of Niagara, Synod Synod Delegates Reflect Sue Thibodeau, St. John’s, Port Dalhousie A Zoom version of Synod—not what I was looking forward to on the morning … Continue reading Synod Delegates Reflect Bishop's Charge, Diocese of Niagara, Synod The Bishop’s Charge to the 146th Synod of the Diocese of Niagara by The Right Reverend Susan J.A. Bell + In the name of God: Father, Son and Holy Spirit. Amen. Well, … Continue reading The Bishop’s Charge to the 146th Synod of the Diocese of Niagara Posts navigation Older posts Website Powered by WordPress.com. Add your thoughts here... (optional) Post to Cancel"
442357,20210122,niagaraanglican.news,https://niagaraanglican.news/,text/html,text/html,en,"The Niagara Anglican – A Gathering Place and a Sounding Board for the People of the Diocese of Niagara – Since 1955 Skip to content The Niagara Anglican A Gathering Place and a Sounding Board for the People of the Diocese of Niagara – Since 1955 Menu Primary Navigation Home About Contact Us Social Navigation Twitter The online presence of The Niagara Anglican monthly print newspaper. We serve the Diocese of Niagara and its' many parishes. An archive of the monthly print edition can be found here. Search for: Follow The Niagara Anglican via Email Enter your email address to follow The Niagara Anglican and receive notifications of new posts by email. Email Address: Follow Recent Posts The Prophetess January 21, 2021 Generosity Gives Hope During the Holidays! January 20, 2021 The Lenten Disciplines of an Easter Disciple January 19, 2021 A Season of Gratitude January 18, 2021 Other Links The Diocese of Niagara Anglican Journal First steps in knowing God January 20, 2021 Orthodox school finds ‘natural home’ at Trinity January 19, 2021 CoGS hears of ‘transformative change’ across church January 12, 2021 Anglican Church of Canada World Interfaith Harmony Week: February 1-7, 2021 January 14, 2021 2021 Week of Prayer for Christian Unity video service January 11, 2021 Happy New Year! January 1, 2021 The Diocese of NiagaraMy Tweets The Niagara AnglicanMy Tweets Poetry The Prophetess “Anna, a prophetess… of a great age,…departed not from the temple, but served God with fastings and prayers night and … Continue reading The Prophetess St. John’s Ancaster, St. Matthew's House Hamilton Generosity Gives Hope During the Holidays! Hundreds of Hamilton families and seniors will have a brighter holiday season this year thanks to the generosity of people … Continue reading Generosity Gives Hope During the Holidays! In Other Words, Lent The Lenten Disciplines of an Easter Disciple John Bowen I had decided to give up my favorite chocolate biscotti during Lent. The server in my favorite coffee … Continue reading The Lenten Disciplines of an Easter Disciple COVID-19, Stewardship A Season of Gratitude By Gillian Doucet Campbell “Into this climate of fear and apprehension, Christmas enters,Streaming lights of joy, ringing bells of hopeAnd … Continue reading A Season of Gratitude COVID-19, Diocese of Niagara All Parishes Moved to Lockdown as COVD-19 Cases Surge Shortly before Christmas, Bishop Susan Bell suspended all permissions previously granted for parishes to re-open for in-person worship in accordance … Continue reading All Parishes Moved to Lockdown as COVD-19 Cases Surge Diocese of Niagara, In Memoriam In Memoriam: Canon Judy Dodman 1938-2020 With great sadness, we share the news that Canon Judy Dodman has passed away. In a ministry which spanned seven … Continue reading In Memoriam: Canon Judy Dodman 1938-2020 PWRDF, St. Mark’s Orangeville Toonie Loonie fundraiser St Mark’s Orangeville held their annual Toonie Loonie fundraiser in October 2020. The $1000 raised will go towards the … Continue reading Toonie Loonie fundraiser Theology Late Have I Loved You: On Beauty The Rev’d Dr. Daniel Tatarnic Two years ago, I visited the Italian city of Ravenna, the world’s most significant region … Continue reading Late Have I Loved You: On Beauty Leadership, The Deacon's Bench The Deacon’s Bench The Reverend Deacon Paul Bates I have been working on a book titled, For Others To Follow: An Ethos of … Continue reading The Deacon’s Bench Climate Justice Niagara, Human trafficking Human trafficking and a cup of tea By Dierdre Pike “Human trafficking and slavery are evil, violent crimes against God, creation and humanity. They take root and … Continue reading Human trafficking and a cup of tea Posts navigation Older posts Website Powered by WordPress.com. Add your thoughts here... (optional) Post to Cancel"
452404,20210129,niagaraanglican.news,https://niagaraanglican.news/,text/html,text/html,en,"The Niagara Anglican – A Gathering Place and a Sounding Board for the People of the Diocese of Niagara – Since 1955 Skip to content The Niagara Anglican A Gathering Place and a Sounding Board for the People of the Diocese of Niagara – Since 1955 Menu Primary Navigation Home About Contact Us Social Navigation Twitter The online presence of The Niagara Anglican monthly print newspaper. We serve the Diocese of Niagara and its' many parishes. An archive of the monthly print edition can be found here. Search for: Follow The Niagara Anglican via Email Enter your email address to follow The Niagara Anglican and receive notifications of new posts by email. Email Address: Follow Recent Posts WOW Grant Recipient WOWed! January 28, 2021 Remembering Walter: friend and story keeper January 27, 2021 Loving Mother Earth January 26, 2021 The Bishop’s Lenten Books January 25, 2021 Other Links The Diocese of Niagara Anglican Journal Puzzled by God January 29, 2021 COVID-19 and global hunger: a Zimbabwe case study January 25, 2021 ‘We have to help one another to survive’: A conversation with Jonas Allooloo January 25, 2021 Anglican Church of Canada Ecumenical Letter on the deteriorating human rights situation in the Philippines January 28, 2021 World Interfaith Harmony Week: February 1-7, 2021 January 14, 2021 2021 Week of Prayer for Christian Unity video service January 11, 2021 The Diocese of NiagaraMy Tweets The Niagara AnglicanMy Tweets Christ Church Wainfleet WOW Grant Recipient WOWed! Submitted by the Parish Christ Church, Wainfleet received a WOW grant two years ago to welcome community youth to a … Continue reading WOW Grant Recipient WOWed! Relationships Remembering Walter: friend and story keeper By The Reverend Michael Coren My dear friend Walter died in the second week of Advent. Kind, humble, clever Walter … Continue reading Remembering Walter: friend and story keeper Climate Justice Niagara Loving Mother Earth By Sue Carson Climate Justice Niagara Chair The evening is dark and the weather outside is not inviting. Gone are … Continue reading Loving Mother Earth Bishop's Lenten Book The Bishop’s Lenten Books This year, Bishop Susan Bell has chosen to recommend two books for Lent: Seven Spiritual Gifts of Waiting by Holly … Continue reading The Bishop’s Lenten Books Now Playing Acting a Fool The Venerable Max Woolaver A very serious decision was called for … and quickly. I was hurtling down a steep … Continue reading Acting a Fool Anti-Racism Anti-Racism Awareness in our Diocesan and Church Cultures By The Reverend Naomi Kabugi As someone who was not born in this land, I am humbled to walk with … Continue reading Anti-Racism Awareness in our Diocesan and Church Cultures Poetry The Prophetess “Anna, a prophetess… of a great age,…departed not from the temple, but served God with fastings and prayers night and … Continue reading The Prophetess St. John’s Ancaster, St. Matthew's House Hamilton Generosity Gives Hope During the Holidays! Hundreds of Hamilton families and seniors will have a brighter holiday season this year thanks to the generosity of people … Continue reading Generosity Gives Hope During the Holidays! In Other Words, Lent The Lenten Disciplines of an Easter Disciple John Bowen I had decided to give up my favorite chocolate biscotti during Lent. The server in my favorite coffee … Continue reading The Lenten Disciplines of an Easter Disciple COVID-19, Stewardship A Season of Gratitude By Gillian Doucet Campbell “Into this climate of fear and apprehension, Christmas enters,Streaming lights of joy, ringing bells of hopeAnd … Continue reading A Season of Gratitude Posts navigation Older posts Website Powered by WordPress.com. Add your thoughts here... (optional) Post to Cancel"
462465,20210205,niagaraanglican.news,https://niagaraanglican.news/,text/html,text/html,en,"The Niagara Anglican – A Gathering Place and a Sounding Board for the People of the Diocese of Niagara – Since 1955 Skip to content The Niagara Anglican A Gathering Place and a Sounding Board for the People of the Diocese of Niagara – Since 1955 Menu Primary Navigation Twitter Social Navigation Twitter The online presence of The Niagara Anglican monthly print newspaper. We serve the Diocese of Niagara and its' many parishes. An archive of the monthly print edition can be found here. Search for: Follow The Niagara Anglican via Email Enter your email address to follow The Niagara Anglican and receive notifications of new posts by email. Email Address: Follow Recent Posts Being the Face of Christ February 4, 2021 Anglican Foundation Releases New Book on Generosity Tailored for Children and Youth February 3, 2021 Nurturing Opportunities for Children & Youth February 2, 2021 Vestry Meetings To Be Held Virtually in 2021 February 1, 2021 Other Links The Diocese of Niagara Anglican Journal Five Regina churches merge to form new parish February 5, 2021 Seeing God through the seeking of others February 4, 2021 Canadian Anglican archbishops sign anti-conversion therapy declaration February 3, 2021 Anglican Church of Canada CLAY 2021 update from the National Planning Committee February 4, 2021 Ecumenical Letter on the deteriorating human rights situation in the Philippines January 28, 2021 World Interfaith Harmony Week: February 1-7, 2021 January 14, 2021 The Diocese of NiagaraMy Tweets The Niagara AnglicanMy Tweets Pandemic Response Fund Being the Face of Christ As the pandemic persists, parishes continue to creatively adapt to respond to human need with loving service. The diocesan Pandemic … Continue reading Being the Face of Christ Anglican Foundation of Canada Anglican Foundation Releases New Book on Generosity Tailored for Children and Youth “Nurturing generous-hearted living may be one of the greatest things we can do for young people,” says Judy Rois, Executive … Continue reading Anglican Foundation Releases New Book on Generosity Tailored for Children and Youth Children, Youth, and Family Ministry Nurturing Opportunities for Children & Youth Sparking Children’s Faith Since January, the diocese has been offering weekly online “Sunday” School programming for children in grades 1 … Continue reading Nurturing Opportunities for Children & Youth Vestry Meetings Vestry Meetings To Be Held Virtually in 2021 With the pandemic persisting and restrictions on in-person public gatherings continuing for the foreseeable future, all vestry meetings will be … Continue reading Vestry Meetings To Be Held Virtually in 2021 Diocese of Niagara Niagara School for Missional Leadership Pilots Courses After months of discernment, planning, and hard work, the Niagara School for Missional Leadership is taking shape, and the first … Continue reading Niagara School for Missional Leadership Pilots Courses Christ Church Wainfleet WOW Grant Recipient WOWed! Submitted by the Parish Christ Church, Wainfleet received a WOW grant two years ago to welcome community youth to a … Continue reading WOW Grant Recipient WOWed! Relationships Remembering Walter: friend and story keeper By The Reverend Michael Coren My dear friend Walter died in the second week of Advent. Kind, humble, clever Walter … Continue reading Remembering Walter: friend and story keeper Climate Justice Niagara Loving Mother Earth By Sue Carson Climate Justice Niagara Chair The evening is dark and the weather outside is not inviting. Gone are … Continue reading Loving Mother Earth Bishop's Lenten Book The Bishop’s Lenten Books This year, Bishop Susan Bell has chosen to recommend two books for Lent: Seven Spiritual Gifts of Waiting by Holly … Continue reading The Bishop’s Lenten Books Now Playing Acting a Fool The Venerable Max Woolaver A very serious decision was called for … and quickly. I was hurtling down a steep … Continue reading Acting a Fool Posts navigation Older posts Website Powered by WordPress.com. Add your thoughts here... (optional) Post to Cancel"
472644,20210212,niagaraanglican.news,https://niagaraanglican.news/,text/html,text/html,en,"The Niagara Anglican – A Gathering Place and a Sounding Board for the People of the Diocese of Niagara – Since 1955 Skip to content The Niagara Anglican A Gathering Place and a Sounding Board for the People of the Diocese of Niagara – Since 1955 Menu Primary Navigation Twitter Social Navigation Twitter The online presence of The Niagara Anglican monthly print newspaper. We serve the Diocese of Niagara and its' many parishes. An archive of the monthly print edition can be found here. Search for: Follow The Niagara Anglican via Email Enter your email address to follow The Niagara Anglican and receive notifications of new posts by email. Email Address: Follow Recent Posts The Pandemic Church February 8, 2021 Celebrity Break-Ups & The Body of Christ February 6, 2021 Hindsight is 2020, Foresight is 2021 February 5, 2021 Being the Face of Christ February 4, 2021 Other Links The Diocese of Niagara Anglican Journal Rethinking darkness and light February 10, 2021 ‘A narrative of light, hope and truth’: Jubilee Commission launches archival history research project February 9, 2021 White Jesus and me February 9, 2021 Anglican Church of Canada Join us in marking Freedom Sunday on February 21 February 11, 2021 This Saturday: Online Gospel Jam 7 February 10, 2021 CLAY 2021 update from the National Planning Committee February 4, 2021 The Diocese of NiagaraMy Tweets The Niagara AnglicanMy Tweets Poetry The Pandemic Church We’ll never forget this pandemic year, The virus brought with it isolation and fear. We all washed our hands fifty … Continue reading The Pandemic Church Relationships, The Niagara Anglican Celebrity Break-Ups & The Body of Christ The Reverend Canon Martha Tatarnic My daughter and I had been watching the Instagram feed of one celebrity couple over … Continue reading Celebrity Break-Ups & The Body of Christ Mission to Seafarers, Suicide and Self-Harm Hindsight is 2020, Foresight is 2021 By the Reverend Deacon Diane Elliot Just where is God out there ahead of us in all of this? For … Continue reading Hindsight is 2020, Foresight is 2021 Pandemic Response Fund Being the Face of Christ As the pandemic persists, parishes continue to creatively adapt to respond to human need with loving service. The diocesan Pandemic … Continue reading Being the Face of Christ Anglican Foundation of Canada Anglican Foundation Releases New Book on Generosity Tailored for Children and Youth “Nurturing generous-hearted living may be one of the greatest things we can do for young people,” says Judy Rois, Executive … Continue reading Anglican Foundation Releases New Book on Generosity Tailored for Children and Youth Children, Youth, and Family Ministry Nurturing Opportunities for Children & Youth Sparking Children’s Faith Since January, the diocese has been offering weekly online “Sunday” School programming for children in grades 1 … Continue reading Nurturing Opportunities for Children & Youth Vestry Meetings Vestry Meetings To Be Held Virtually in 2021 With the pandemic persisting and restrictions on in-person public gatherings continuing for the foreseeable future, all vestry meetings will be … Continue reading Vestry Meetings To Be Held Virtually in 2021 Diocese of Niagara Niagara School for Missional Leadership Pilots Courses After months of discernment, planning, and hard work, the Niagara School for Missional Leadership is taking shape, and the first … Continue reading Niagara School for Missional Leadership Pilots Courses Christ Church Wainfleet WOW Grant Recipient WOWed! Submitted by the Parish Christ Church, Wainfleet received a WOW grant two years ago to welcome community youth to a … Continue reading WOW Grant Recipient WOWed! Relationships Remembering Walter: friend and story keeper By The Reverend Michael Coren My dear friend Walter died in the second week of Advent. Kind, humble, clever Walter … Continue reading Remembering Walter: friend and story keeper Posts navigation Older posts Website Powered by WordPress.com. Add your thoughts here... (optional) Post to Cancel"
