,crawl_date,domain,url,mime_type_web_server,mime_type_tika,language,content
224647,20200904,niagaraanglican.news,https://niagaraanglican.news/,text/html,text/html,en,"The Niagara Anglican – A Gathering Place and a Sounding Board for the People of the Diocese of Niagara – Since 1955 Skip to content The Niagara Anglican A Gathering Place and a Sounding Board for the People of the Diocese of Niagara – Since 1955 Menu Primary Navigation Home About Contact Us Social Navigation Twitter The online presence of The Niagara Anglican monthly print newspaper. We serve the Diocese of Niagara and its' many parishes. An archive of the monthly print edition can be found here. Search for: Follow The Niagara Anglican via Email Enter your email address to follow The Niagara Anglican and receive notifications of new posts by email. Follow Recent Posts Let Your Saint Choose You September 3, 2020 Cursillo September 2, 2020 Who Chopped Down the Family Tree? September 1, 2020 Am I Cut Out For This? August 31, 2020 Other Links The Diocese of Niagara Anglican Journal ‘Be invitational in our desire to see change’ September 3, 2020 September issue considers re-openings, pandemic impact September 1, 2020 Anglicans respond charitably amid pandemic September 1, 2020 Anglican Church of Canada Pray for the people of Lebanon August 6, 2020 New eStore for Anglican resources launched August 4, 2020 Highlights from the Council of General Synod: July 25, 2020 July 27, 2020 The Diocese of NiagaraMy Tweets The Niagara AnglicanMy Tweets Prayer, Theology Let Your Saint Choose You by The Rev’d Dr. Daniel Tatarnic My thesis director gave me a good piece of advice, “Pray your way through … Continue reading Let Your Saint Choose You Cursillo Cursillo A few of my friends struggle with the pronunciation of the word Cursillo. I help them out, then move on. … Continue reading Cursillo Now Playing Who Chopped Down the Family Tree? As I stood before the withering fire of her spoken history a cavern of loneliness opened up within me. She … Continue reading Who Chopped Down the Family Tree? COVID-19, Leadership Am I Cut Out For This? by Canon Martha Tatarnic I have long considered myself to be a borderline extrovert. Although I am naturally quiet, I … Continue reading Am I Cut Out For This? Grace, Waterdown, Prayer Meditating in the Christian Tradition by Rita Murnaghan Meditation is not something new. This form of silent, imageless prayer is rooted in the gospel and … Continue reading Meditating in the Christian Tradition The Deacon's Bench, The Niagara Anglican The Deacon’s Bench by The Reverend Deacon Nina Page Looking back, I can say my journey to the Diaconate began years ago. In … Continue reading The Deacon’s Bench Diocese of Niagara, Mission Diocesan Missioner Appointed Bishop Susan Bell is delighted to announce that the Reverend Jeff Potter has accepted role of diocesan missioner, on a … Continue reading Diocesan Missioner Appointed Editorial, Niagara Anglican From the Editor Standing on the threshold can be exciting: a bride about to be carried into a new home a family counting … Continue reading From the Editor St. Michael’s and St. Gabriel’s Hamilton Good News and Frustrations By Sue Crawford The news that the Diocese was suspending services until further notice hit all of us like a … Continue reading Good News and Frustrations Stewardship A Gift of a Lifetime by Gillian Doucet Campbell Growing up, my parents didn’t talk much about money. “That’s not unusual,” says Greg Kippers, CFP, … Continue reading A Gift of a Lifetime Posts navigation Older posts Powered by WordPress.com. Post to Cancel"
238013,20200911,niagaraanglican.news,https://niagaraanglican.news/,text/html,text/html,en,"The Niagara Anglican – A Gathering Place and a Sounding Board for the People of the Diocese of Niagara – Since 1955 Skip to content The Niagara Anglican A Gathering Place and a Sounding Board for the People of the Diocese of Niagara – Since 1955 Menu Primary Navigation Home About Contact Us Social Navigation Twitter The online presence of The Niagara Anglican monthly print newspaper. We serve the Diocese of Niagara and its' many parishes. An archive of the monthly print edition can be found here. Search for: Follow The Niagara Anglican via Email Enter your email address to follow The Niagara Anglican and receive notifications of new posts by email. Follow Recent Posts Leadership Lessons From Scripture September 10, 2020 Cancel Culture September 9, 2020 Creative Outreach in Port Colborne September 8, 2020 Climate Justice Niagara September 7, 2020 Other Links The Diocese of Niagara Anglican Journal ‘So that nothing like this ever happens again’: Residential schools, system declared historic September 10, 2020 Something new waits to be born September 8, 2020 ‘Be invitational in our desire to see change’ September 3, 2020 Anglican Church of Canada World Week of Peace in Palestine and Israel (Sep. 13-21) September 10, 2020 Pray for the people of Lebanon August 6, 2020 New eStore for Anglican resources launched August 4, 2020 The Diocese of NiagaraMy Tweets The Niagara AnglicanMy Tweets Book Review Leadership Lessons From Scripture Leadership In Christian Perspective:Biblical Foundations and Contemporary Practices for Servant Leaders, by Justin Irving and Mark Strauss Baker Academic 2019 … Continue reading Leadership Lessons From Scripture The Niagara Anglican Cancel Culture By Michael Coren In early July, a letter signed by 150 leading writers and academics was published in Harper’s magazine. Signatories … Continue reading Cancel Culture St. James and St. Brendan, Port Colburne Creative Outreach in Port Colborne by Lynda Reinhart During these times of social distancing and isolation, creative connections are being made. St. James and St. … Continue reading Creative Outreach in Port Colborne Climate Justice Niagara, Greening Niagara Climate Justice Niagara by James Newman Our common home is also God’s own house, permeated by the Spirit of God from the dawn … Continue reading Climate Justice Niagara St. John’s Ancaster Ancaster Bottle Drive St. John’s (Ancaster) outreach ministry volunteers held a bottle drive for Mission Services in Hamilton recently and were overwhelmed by … Continue reading Ancaster Bottle Drive In Other Words In other words: Can Three be Divided by Five? Varieties of Leadership by John Bowen During my years at Wycliffe College, I listened to many students wrestling with whether they were called … Continue reading In other words: Can Three be Divided by Five? Varieties of Leadership Prayer, Theology Let Your Saint Choose You by The Rev’d Dr. Daniel Tatarnic My thesis director gave me a good piece of advice, “Pray your way through … Continue reading Let Your Saint Choose You Cursillo Cursillo A few of my friends struggle with the pronunciation of the word Cursillo. I help them out, then move on. … Continue reading Cursillo Now Playing Who Chopped Down the Family Tree? As I stood before the withering fire of her spoken history a cavern of loneliness opened up within me. She … Continue reading Who Chopped Down the Family Tree? COVID-19, Leadership Am I Cut Out For This? by Canon Martha Tatarnic I have long considered myself to be a borderline extrovert. Although I am naturally quiet, I … Continue reading Am I Cut Out For This? Posts navigation Older posts Powered by WordPress.com. Post to Cancel"
249354,20200918,niagaraanglican.news,https://niagaraanglican.news/,text/html,text/html,en,"The Niagara Anglican – A Gathering Place and a Sounding Board for the People of the Diocese of Niagara – Since 1955 Skip to content The Niagara Anglican A Gathering Place and a Sounding Board for the People of the Diocese of Niagara – Since 1955 Menu Primary Navigation Home About Contact Us Social Navigation Twitter The online presence of The Niagara Anglican monthly print newspaper. We serve the Diocese of Niagara and its' many parishes. An archive of the monthly print edition can be found here. Search for: Follow The Niagara Anglican via Email Enter your email address to follow The Niagara Anglican and receive notifications of new posts by email. Follow Recent Posts St. Simon’s Goes Virtual September 12, 2020 Leadership Lessons From Scripture September 10, 2020 Cancel Culture September 9, 2020 Creative Outreach in Port Colborne September 8, 2020 Other Links The Diocese of Niagara Anglican Journal Anglican archbishops react to sign of possible life on Venus September 16, 2020 Meanness, lies and conspiracy theories: Boys State and the state of politics September 14, 2020 ‘So that nothing like this ever happens again’: Residential schools, system declared historic September 10, 2020 Anglican Church of Canada Greetings from the Primate on Rosh Hashanah September 18, 2020 Building peace through ministry with children and youth September 15, 2020 Highlights from the Council of General Synod: September 12, 2020 September 14, 2020 The Diocese of NiagaraMy Tweets The Niagara AnglicanMy Tweets COVID-19, St. Simon’s Oakville St. Simon’s Goes Virtual by Kathie Stevenson During these days all of us in Niagara Diocese have been challenged to continue our ministries. We … Continue reading St. Simon’s Goes Virtual Book Review Leadership Lessons From Scripture Leadership In Christian Perspective:Biblical Foundations and Contemporary Practices for Servant Leaders, by Justin Irving and Mark Strauss Baker Academic 2019 … Continue reading Leadership Lessons From Scripture The Niagara Anglican Cancel Culture By Michael Coren In early July, a letter signed by 150 leading writers and academics was published in Harper’s magazine. Signatories … Continue reading Cancel Culture St. James and St. Brendan, Port Colburne Creative Outreach in Port Colborne by Lynda Reinhart During these times of social distancing and isolation, creative connections are being made. St. James and St. … Continue reading Creative Outreach in Port Colborne Climate Justice Niagara, Greening Niagara Climate Justice Niagara by James Newman Our common home is also God’s own house, permeated by the Spirit of God from the dawn … Continue reading Climate Justice Niagara St. John’s Ancaster Ancaster Bottle Drive St. John’s (Ancaster) outreach ministry volunteers held a bottle drive for Mission Services in Hamilton recently and were overwhelmed by … Continue reading Ancaster Bottle Drive In Other Words In other words: Can Three be Divided by Five? Varieties of Leadership by John Bowen During my years at Wycliffe College, I listened to many students wrestling with whether they were called … Continue reading In other words: Can Three be Divided by Five? Varieties of Leadership Prayer, Theology Let Your Saint Choose You by The Rev’d Dr. Daniel Tatarnic My thesis director gave me a good piece of advice, “Pray your way through … Continue reading Let Your Saint Choose You Cursillo Cursillo A few of my friends struggle with the pronunciation of the word Cursillo. I help them out, then move on. … Continue reading Cursillo Now Playing Who Chopped Down the Family Tree? As I stood before the withering fire of her spoken history a cavern of loneliness opened up within me. She … Continue reading Who Chopped Down the Family Tree? Posts navigation Older posts Powered by WordPress.com. Post to Cancel"
261690,20200925,niagaraanglican.news,https://niagaraanglican.news/,text/html,text/html,en,"The Niagara Anglican – A Gathering Place and a Sounding Board for the People of the Diocese of Niagara – Since 1955 Skip to content The Niagara Anglican A Gathering Place and a Sounding Board for the People of the Diocese of Niagara – Since 1955 Menu Primary Navigation Home About Contact Us Social Navigation Twitter The online presence of The Niagara Anglican monthly print newspaper. We serve the Diocese of Niagara and its' many parishes. An archive of the monthly print edition can be found here. Search for: Follow The Niagara Anglican via Email Enter your email address to follow The Niagara Anglican and receive notifications of new posts by email. Follow Recent Posts Synod Pivots with the Pandemic September 24, 2020 St. Simon’s Goes Virtual September 12, 2020 Leadership Lessons From Scripture September 10, 2020 Cancel Culture September 9, 2020 Other Links The Diocese of Niagara Anglican Journal Children’s, youth ministry shifts online September 25, 2020 Looking around September 25, 2020 The discomfort—and faithfulness—of transformation September 24, 2020 Anglican Church of Canada “Dreams of Long Ago for Tomorrow”: 4th national online Gospel Jamboree September 19, 2020 Greetings from the Primate on Rosh Hashanah September 18, 2020 Building peace through ministry with children and youth September 15, 2020 The Diocese of NiagaraMy Tweets The Niagara AnglicanMy Tweets Diocese of Niagara, Synod Synod Pivots with the Pandemic by The Venerable Bill Mous, Executive Officerand Secretary of Synod For the first time in its 146-year existence, the synod … Continue reading Synod Pivots with the Pandemic COVID-19, St. Simon’s Oakville St. Simon’s Goes Virtual by Kathie Stevenson During these days all of us in Niagara Diocese have been challenged to continue our ministries. We … Continue reading St. Simon’s Goes Virtual Book Review Leadership Lessons From Scripture Leadership In Christian Perspective:Biblical Foundations and Contemporary Practices for Servant Leaders, by Justin Irving and Mark Strauss Baker Academic 2019 … Continue reading Leadership Lessons From Scripture The Niagara Anglican Cancel Culture By Michael Coren In early July, a letter signed by 150 leading writers and academics was published in Harper’s magazine. Signatories … Continue reading Cancel Culture St. James and St. Brendan, Port Colburne Creative Outreach in Port Colborne by Lynda Reinhart During these times of social distancing and isolation, creative connections are being made. St. James and St. … Continue reading Creative Outreach in Port Colborne Climate Justice Niagara, Greening Niagara Climate Justice Niagara by James Newman Our common home is also God’s own house, permeated by the Spirit of God from the dawn … Continue reading Climate Justice Niagara St. John’s Ancaster Ancaster Bottle Drive St. John’s (Ancaster) outreach ministry volunteers held a bottle drive for Mission Services in Hamilton recently and were overwhelmed by … Continue reading Ancaster Bottle Drive In Other Words In other words: Can Three be Divided by Five? Varieties of Leadership by John Bowen During my years at Wycliffe College, I listened to many students wrestling with whether they were called … Continue reading In other words: Can Three be Divided by Five? Varieties of Leadership Prayer, Theology Let Your Saint Choose You by The Rev’d Dr. Daniel Tatarnic My thesis director gave me a good piece of advice, “Pray your way through … Continue reading Let Your Saint Choose You Cursillo Cursillo A few of my friends struggle with the pronunciation of the word Cursillo. I help them out, then move on. … Continue reading Cursillo Posts navigation Older posts Powered by WordPress.com. Post to Cancel"
272656,20201002,niagaraanglican.news,https://niagaraanglican.news/,text/html,text/html,en,"The Niagara Anglican – A Gathering Place and a Sounding Board for the People of the Diocese of Niagara – Since 1955 Skip to content The Niagara Anglican A Gathering Place and a Sounding Board for the People of the Diocese of Niagara – Since 1955 Menu Primary Navigation Home About Contact Us Social Navigation Twitter The online presence of The Niagara Anglican monthly print newspaper. We serve the Diocese of Niagara and its' many parishes. An archive of the monthly print edition can be found here. Search for: Follow The Niagara Anglican via Email Enter your email address to follow The Niagara Anglican and receive notifications of new posts by email. Follow Recent Posts Deacon’s Bench October 1, 2020 Order of Niagara 2020 September 30, 2020 From The Editor September 29, 2020 Dust September 28, 2020 Other Links The Diocese of Niagara Anglican Journal October issue examines continued pandemic adaptations September 30, 2020 Federal grant extends PWRDF maternal and child health program for pandemic September 30, 2020 Seminaries expand remote learning as pandemic continues September 30, 2020 Anglican Church of Canada “Dreams of Long Ago for Tomorrow”: 4th national online Gospel Jamboree September 19, 2020 Greetings from the Primate on Rosh Hashanah September 18, 2020 Building peace through ministry with children and youth September 15, 2020 The Diocese of NiagaraMy Tweets The Niagara AnglicanMy Tweets St. David’s Welland, The Deacon's Bench Deacon’s Bench By Richard Middleton On March 21st, 2004, I was ordained Deacon at Christ’s Church Cathedral (Hamilton). I was one of … Continue reading Deacon’s Bench The Niagara Anglican Order of Niagara 2020 Bishop Susan Bell has announced this years recipients of the Order of Niagara. Due to the Covid-19 pandemic, two separate … Continue reading Order of Niagara 2020 Editorial, Niagara Anglican From The Editor As the province began to open more and more places, so we could come out of isolation, a friend of … Continue reading From The Editor Poetry Dust by Nancy CoombsSt. Jude’s (Oakville) “Shall the dust give thanks unto thee: or shall it declare thy truth?” (The Book … Continue reading Dust Mission to Seafarers, St. John the Evangelist Hamilton Go West (and then head north) The Bishop of Brandon has appointed The Reverend Janice Maloney-Brooks (Jann) as Rector of Christ Church (The Pas, MB). In … Continue reading Go West (and then head north) Diocese of Niagara Diocesan Visual Identity Gets a Fresh New Look New colours and designs rolled out for social media, website, and print After months of planning and consultations, the diocese … Continue reading Diocesan Visual Identity Gets a Fresh New Look Diocese of Niagara, Synod Synod Pivots with the Pandemic by The Venerable Bill Mous, Executive Officerand Secretary of Synod For the first time in its 146-year existence, the synod … Continue reading Synod Pivots with the Pandemic COVID-19, St. Simon’s Oakville St. Simon’s Goes Virtual by Kathie Stevenson During these days all of us in Niagara Diocese have been challenged to continue our ministries. We … Continue reading St. Simon’s Goes Virtual Book Review Leadership Lessons From Scripture Leadership In Christian Perspective:Biblical Foundations and Contemporary Practices for Servant Leaders, by Justin Irving and Mark Strauss Baker Academic 2019 … Continue reading Leadership Lessons From Scripture The Niagara Anglican Cancel Culture By Michael Coren In early July, a letter signed by 150 leading writers and academics was published in Harper’s magazine. Signatories … Continue reading Cancel Culture Posts navigation Older posts Powered by WordPress.com. Post to Cancel"
284995,20201009,niagaraanglican.news,https://niagaraanglican.news/,text/html,text/html,en,"The Niagara Anglican – A Gathering Place and a Sounding Board for the People of the Diocese of Niagara – Since 1955 Skip to content The Niagara Anglican A Gathering Place and a Sounding Board for the People of the Diocese of Niagara – Since 1955 Menu Primary Navigation Home About Contact Us Social Navigation Twitter The online presence of The Niagara Anglican monthly print newspaper. We serve the Diocese of Niagara and its' many parishes. An archive of the monthly print edition can be found here. Search for: Follow The Niagara Anglican via Email Enter your email address to follow The Niagara Anglican and receive notifications of new posts by email. Follow Recent Posts PWRDF Niagara October 8, 2020 In other words: Can Evangelism be Redeemed? October 7, 2020 The School of Dance October 6, 2020 Busy Bees – The Kitchen Bees program making a difference in the Guelph area October 5, 2020 Other Links The Diocese of Niagara Anglican Journal A message from the Primate October 9, 2020 On the suffering of American neighbours October 7, 2020 Decolonization starts with me October 6, 2020 Anglican Church of Canada A message from the Primate October 9, 2020 Greetings from the Primate on Rosh Hashanah September 18, 2020 Building peace through ministry with children and youth September 15, 2020 The Diocese of NiagaraMy Tweets The Niagara AnglicanMy Tweets Diocese of Niagara, PWRDF PWRDF Niagara Kerry Lubrick is the representative from Niagara to the Primate’s World Relief and Development Fund. Kerry recently retired from the … Continue reading PWRDF Niagara Evangelism, In Other Words In other words: Can Evangelism be Redeemed? by John Bowen In 2016, a photograph circulated on the internet of a group of young people in the Rijksmuseum … Continue reading In other words: Can Evangelism be Redeemed? Now Playing The School of Dance Ray (not his real name) is a great friend of mine. He is a fine visual artist, a lover of … Continue reading The School of Dance outreach, The Church of the Apostles Guelph Busy Bees – The Kitchen Bees program making a difference in the Guelph area by Alex Walmsley When the order came from the province to close all public gathering spaces in March, the Church … Continue reading Busy Bees – The Kitchen Bees program making a difference in the Guelph area COVID-19, Indigenous Peoples This Is a Spiritual Crisis by Martha Tatarnic A few years ago, I was part of a delegation of both Indigenous and non-Indigenous Anglican leaders … Continue reading This Is a Spiritual Crisis Stewardship Your Will: A Personal Story of Values by Gillian Doucet Campbell, MA, CFRE Growing up it was not uncommon to hear my mother say, “money doesn’t grow … Continue reading Your Will: A Personal Story of Values St. David’s Welland, The Deacon's Bench Deacon’s Bench By Richard Middleton On March 21st, 2004, I was ordained Deacon at Christ’s Church Cathedral (Hamilton). I was one of … Continue reading Deacon’s Bench The Niagara Anglican Order of Niagara 2020 Bishop Susan Bell has announced this years recipients of the Order of Niagara. Due to the Covid-19 pandemic, two separate … Continue reading Order of Niagara 2020 Editorial, Niagara Anglican From The Editor As the province began to open more and more places, so we could come out of isolation, a friend of … Continue reading From The Editor Poetry Dust by Nancy CoombsSt. Jude’s (Oakville) “Shall the dust give thanks unto thee: or shall it declare thy truth?” (The Book … Continue reading Dust Posts navigation Older posts Powered by WordPress.com. Post to Cancel"
