,crawl_date,domain,url,mime_type_web_server,mime_type_tika,language,content
7967,20200417,niagaraanglican.news,https://niagaraanglican.news/,text/html,text/html,en,"The Niagara Anglican – A Gathering Place and a Sounding Board for the People of the Diocese of Niagara – Since 1955 Skip to content The Niagara Anglican A Gathering Place and a Sounding Board for the People of the Diocese of Niagara – Since 1955 Menu Primary Navigation Home About Contact Us Social Navigation Twitter The online presence of The Niagara Anglican monthly print newspaper. We serve the Diocese of Niagara and its' many parishes. An archive of the monthly print edition can be found here. Search for: Follow The Niagara Anglican via Email Enter your email address to follow The Niagara Anglican and receive notifications of new posts by email. Follow Recent Posts God or Science? April 14, 2020 A Room of One’s Own — Part 2 April 13, 2020 The Bishop’s Easter Letter April 11, 2020 Three Days April 10, 2020 Other Links The Diocese of Niagara Anglican Journal Cultivating perseverance and patience on the road ahead April 16, 2020 An unmistakable sign April 16, 2020 Toronto, Central Newfoundland dioceses declare jubilee for parishes April 15, 2020 Anglican Church of Canada Shutterbugs assemble! Photos sought for 2021 Anglican Church Calendar April 15, 2020 Celebrate Easter Sunday with the Primate April 11, 2020 Holy Week and Easter services and resources April 10, 2020 The Diocese of NiagaraMy Tweets The Niagara AnglicanMy Tweets spirituality, Theology God or Science? By the Reverend Canon Martha Tatarnic I sat down with Owen and David, members of my parish, on a Tuesday … Continue reading God or Science? Now Playing A Room of One’s Own — Part 2 Great books can launch great adventures! In this particular case, The Collected Works of St. John of the Cross and … Continue reading A Room of One’s Own — Part 2 Bishop Susan Bell, Easter The Bishop’s Easter Letter These past weeks, I have been very involved in reading N.T. Wright’s newest offering: The New Testament in its World. … Continue reading The Bishop’s Easter Letter Easter, Poetry Three Days by Angela Rush Three long days of mourning, could it truly be. He would rise as He said, resurrection sets … Continue reading Three Days Diocese of Niagara, Ordination A Special Day People gathered Sunday February 23, 2020 at Christ’s Church Cathedral (Hamilton) for the ordination to the priesthood of three people … Continue reading A Special Day St. George's Georgetown, Trafalgar Region Repairing History By Rob Park In early August of 2018, there was a phone message left at the church from a person … Continue reading Repairing History St. Christopher’s Burlington, Trafalgar Region What’s New at  St. Christopher’s? In addition to passing the Synod motion “Reduction of Single Use Plastics” at its February 23rd vestry meeting, St. Christopher’s … Continue reading What’s New at  St. Christopher’s? St. George's Lowville, Trafalgar Region Ecumenism In Lowville St. George’s Lowville is working to deepen its friendship with Lowville United Church. Following a successful pulpit exchange in January, … Continue reading Ecumenism In Lowville St. Jude’s Oakville, Trafalgar Region Helping Those In Need — A Group Effort On Sunday, January 26, St. Jude’s (Oakville) hosted a hugely successful information/networking event with parishioners and St. Jude’s community outreach … Continue reading Helping Those In Need — A Group Effort Diocese of Niagara, Guest Speaker Create and implement opportunities to ignite and strengthen faith Sarah Bessey, sought after speaker, podcast guest and co-founder of the Evolving Faith Conference as well as author of the … Continue reading Create and implement opportunities to ignite and strengthen faith Posts navigation Older posts Powered by WordPress.com. Post to Cancel"
13754,20200424,niagaraanglican.news,https://niagaraanglican.news/,text/html,text/html,en,"The Niagara Anglican – A Gathering Place and a Sounding Board for the People of the Diocese of Niagara – Since 1955 Skip to content The Niagara Anglican A Gathering Place and a Sounding Board for the People of the Diocese of Niagara – Since 1955 Menu Primary Navigation Home About Contact Us Social Navigation Twitter The online presence of The Niagara Anglican monthly print newspaper. We serve the Diocese of Niagara and its' many parishes. An archive of the monthly print edition can be found here. Search for: Follow The Niagara Anglican via Email Enter your email address to follow The Niagara Anglican and receive notifications of new posts by email. Follow Recent Posts Progress & The Decline of the Carthaginian Empire April 23, 2020 From The Editor April 22, 2020 Jesus Isn’t Deterred by Locked Doors or Fearful Hearts April 21, 2020 God or Science? April 14, 2020 Other Links The Diocese of Niagara Anglican Journal ‘It feels like it could hit you any minute from a different angle’: Diocese of Montreal’s Lee-Ann Matthews on living with—and beating—COVID-19 April 24, 2020 Anglican Foundation grant funds training for parenting program April 24, 2020 Got ideas on what the church should be doing? Now you can have your say April 23, 2020 Anglican Church of Canada For the Love of Creation—an ecumenical initiative for climate justice April 22, 2020 CLAY 2020 gathering postponed to 2021 April 21, 2020 Our hearts are with Nova Scotia April 20, 2020 The Diocese of NiagaraMy Tweets The Niagara AnglicanMy Tweets Theology Progress & The Decline of the Carthaginian Empire by The Reverend Daniel Tatarnic I was sitting in the Cathedral. Rays of light from the rising sun were moving … Continue reading Progress & The Decline of the Carthaginian Empire COVID-19, Editorial From The Editor For years I have preached to many a congregation that “the church” is about more than buildings. That no matter … Continue reading From The Editor COVID-19, Faith Jesus Isn’t Deterred by Locked Doors or Fearful Hearts by The Reverend Canon Martha Tartanic Then the disciples rejoiced when they saw the Lord. Jesus said to them again, … Continue reading Jesus Isn’t Deterred by Locked Doors or Fearful Hearts spirituality, Theology God or Science? By the Reverend Canon Martha Tatarnic I sat down with Owen and David, members of my parish, on a Tuesday … Continue reading God or Science? Now Playing A Room of One’s Own — Part 2 Great books can launch great adventures! In this particular case, The Collected Works of St. John of the Cross and … Continue reading A Room of One’s Own — Part 2 Bishop Susan Bell, Easter The Bishop’s Easter Letter These past weeks, I have been very involved in reading N.T. Wright’s newest offering: The New Testament in its World. … Continue reading The Bishop’s Easter Letter Easter, Poetry Three Days by Angela Rush Three long days of mourning, could it truly be. He would rise as He said, resurrection sets … Continue reading Three Days Diocese of Niagara, Ordination A Special Day People gathered Sunday February 23, 2020 at Christ’s Church Cathedral (Hamilton) for the ordination to the priesthood of three people … Continue reading A Special Day St. George's Georgetown, Trafalgar Region Repairing History By Rob Park In early August of 2018, there was a phone message left at the church from a person … Continue reading Repairing History St. Christopher’s Burlington, Trafalgar Region What’s New at  St. Christopher’s? In addition to passing the Synod motion “Reduction of Single Use Plastics” at its February 23rd vestry meeting, St. Christopher’s … Continue reading What’s New at  St. Christopher’s? Posts navigation Older posts Powered by WordPress.com. Post to Cancel"
18674,20200504,niagaraanglican.news,https://niagaraanglican.news/,text/html,text/html,en,"The Niagara Anglican – A Gathering Place and a Sounding Board for the People of the Diocese of Niagara – Since 1955 Skip to content The Niagara Anglican A Gathering Place and a Sounding Board for the People of the Diocese of Niagara – Since 1955 Menu Primary Navigation Home About Contact Us Social Navigation Twitter The online presence of The Niagara Anglican monthly print newspaper. We serve the Diocese of Niagara and its' many parishes. An archive of the monthly print edition can be found here. Search for: Follow The Niagara Anglican via Email Enter your email address to follow The Niagara Anglican and receive notifications of new posts by email. Follow Recent Posts What we did for Lent May 2, 2020 Dignity Kits May 1, 2020 You Can Do It April 30, 2020 A World to Live in April 29, 2020 Other Links The Diocese of Niagara Anglican Journal From beach to altar: Reflections on 20 years as a priest May 1, 2020 Longing for a post-apocalyptic Easter April 30, 2020 Pandemics and evangelism: The martyrs of the plague of Alexandria April 29, 2020 Anglican Church of Canada A Public Letter on Guaranteed Basic Income May 3, 2020 A message from Bishop Barbara Andrews to the Territory of the People May 1, 2020 General Synod receives legacy gift “for work in Northern Canada” April 30, 2020 The Diocese of NiagaraMy Tweets The Niagara AnglicanMy Tweets Lent, St. John’s Ancaster What we did for Lent by Donna Ellis, Licensed Lay Worker As I sit here working on the article of what we did at St. … Continue reading What we did for Lent outreach, St. John's Port Dalhousie Dignity Kits The St. John’s (Port Dalhousie) Dignity Kit initiative has a new local partner. In the winter months, thanks to Socks … Continue reading Dignity Kits Greening Niagara You Can Do It by Sue Carson As a society we have become totally dependent on plastics in every aspect of our lives. The … Continue reading You Can Do It COVID-19, Now Playing A World to Live in It’s the bottom of the 10th in the nail biting 2011 Texas Rangers/St. Louis Cardinals World Series. Game 6. The … Continue reading A World to Live in Chinese Anglican Mission Chinese Anglican Mission in Oakville by Garfield Wu The Chinese Anglican Mission in Oakville has its own unfolding picture with God’s blessings. Under Bishop Susan’s … Continue reading Chinese Anglican Mission in Oakville The Deacon's Bench The Deacon’s Bench By The Reverend Deacon Heino Claessens In our Diaconal vows, we are called to be a ministry of servanthood, interpreting … Continue reading The Deacon’s Bench COVID-19, Diocese of Niagara Still Being The Church – A Photo Essay Continue reading Still Being The Church – A Photo Essay In Other Words What makes a church, and why does it matter? by John Bowen Change and tradition sometimes seem like opposites. “We Anglicans have our traditions. We love them and are … Continue reading What makes a church, and why does it matter? Theology Progress & The Decline of the Carthaginian Empire by The Reverend Daniel Tatarnic I was sitting in the Cathedral. Rays of light from the rising sun were moving … Continue reading Progress & The Decline of the Carthaginian Empire COVID-19, Editorial From The Editor For years I have preached to many a congregation that “the church” is about more than buildings. That no matter … Continue reading From The Editor Posts navigation Older posts Powered by WordPress.com. Post to Cancel"
22263,20200515,niagaraanglican.news,https://niagaraanglican.news/,text/html,text/html,en,"The Niagara Anglican – A Gathering Place and a Sounding Board for the People of the Diocese of Niagara – Since 1955 Skip to content The Niagara Anglican A Gathering Place and a Sounding Board for the People of the Diocese of Niagara – Since 1955 Menu Primary Navigation Home About Contact Us Social Navigation Twitter The online presence of The Niagara Anglican monthly print newspaper. We serve the Diocese of Niagara and its' many parishes. An archive of the monthly print edition can be found here. Search for: Follow The Niagara Anglican via Email Enter your email address to follow The Niagara Anglican and receive notifications of new posts by email. Follow Recent Posts With a Grateful Heart – Parishes around the diocese are responding to community needs during the pandemic May 4, 2020 What we did for Lent May 2, 2020 Dignity Kits May 1, 2020 You Can Do It April 30, 2020 Other Links The Diocese of Niagara Anglican Journal Anglican spiritual care practitioners talk COVID-19 (Part 2) May 14, 2020 The Eucharist and coming out of lockdown: A tract for these COVID-19 times May 14, 2020 Bishop: Basic income about ‘what’s right to do for people’ May 13, 2020 Anglican Church of Canada A Public Letter on Guaranteed Basic Income May 3, 2020 A message from Bishop Barbara Andrews to the Territory of the People May 1, 2020 General Synod receives legacy gift “for work in Northern Canada” April 30, 2020 The Diocese of NiagaraMy Tweets The Niagara AnglicanMy Tweets COVID-19, Diocese of Niagara With a Grateful Heart – Parishes around the diocese are responding to community needs during the pandemic A Word from Bishop Susan Bell It has been moving to witness the people of our diocese creatively and faithfully … Continue reading With a Grateful Heart – Parishes around the diocese are responding to community needs during the pandemic Lent, St. John’s Ancaster What we did for Lent by Donna Ellis, Licensed Lay Worker As I sit here working on the article of what we did at St. … Continue reading What we did for Lent outreach, St. John's Port Dalhousie Dignity Kits The St. John’s (Port Dalhousie) Dignity Kit initiative has a new local partner. In the winter months, thanks to Socks … Continue reading Dignity Kits Greening Niagara You Can Do It by Sue Carson As a society we have become totally dependent on plastics in every aspect of our lives. The … Continue reading You Can Do It COVID-19, Now Playing A World to Live in It’s the bottom of the 10th in the nail biting 2011 Texas Rangers/St. Louis Cardinals World Series. Game 6. The … Continue reading A World to Live in Chinese Anglican Mission Chinese Anglican Mission in Oakville by Garfield Wu The Chinese Anglican Mission in Oakville has its own unfolding picture with God’s blessings. Under Bishop Susan’s … Continue reading Chinese Anglican Mission in Oakville The Deacon's Bench The Deacon’s Bench By The Reverend Deacon Heino Claessens In our Diaconal vows, we are called to be a ministry of servanthood, interpreting … Continue reading The Deacon’s Bench COVID-19, Diocese of Niagara Still Being The Church – A Photo Essay Continue reading Still Being The Church – A Photo Essay In Other Words What makes a church, and why does it matter? by John Bowen Change and tradition sometimes seem like opposites. “We Anglicans have our traditions. We love them and are … Continue reading What makes a church, and why does it matter? Theology Progress & The Decline of the Carthaginian Empire by The Reverend Daniel Tatarnic I was sitting in the Cathedral. Rays of light from the rising sun were moving … Continue reading Progress & The Decline of the Carthaginian Empire Posts navigation Older posts Powered by WordPress.com. Post to Cancel"
62841,20200522,niagaraanglican.news,https://niagaraanglican.news/,text/html,text/html,en,"The Niagara Anglican – A Gathering Place and a Sounding Board for the People of the Diocese of Niagara – Since 1955 Skip to content The Niagara Anglican A Gathering Place and a Sounding Board for the People of the Diocese of Niagara – Since 1955 Menu Primary Navigation Home About Contact Us Social Navigation Twitter The online presence of The Niagara Anglican monthly print newspaper. We serve the Diocese of Niagara and its' many parishes. An archive of the monthly print edition can be found here. Search for: Follow The Niagara Anglican via Email Enter your email address to follow The Niagara Anglican and receive notifications of new posts by email. Follow Recent Posts The Image of God Reflected Through COVID-19 May 21, 2020 With a Grateful Heart – Parishes around the diocese are responding to community needs during the pandemic May 4, 2020 What we did for Lent May 2, 2020 Dignity Kits May 1, 2020 Other Links The Diocese of Niagara Anglican Journal From the Primate: Discerning when to speak May 22, 2020 Pandemics and evangelism: The martyrs of the plague of Alexandria May 20, 2020 Anglican spiritual care practitioners talk COVID-19 (Part 3) May 20, 2020 Anglican Church of Canada Ecumenical letter calling on Canada to uphold international law and the rights of Palestinians May 22, 2020 On the Safe Reopening of Our Churches May 15, 2020 A Public Letter on Guaranteed Basic Income May 3, 2020 The Diocese of NiagaraMy Tweets The Niagara AnglicanMy Tweets COVID-19 The Image of God Reflected Through COVID-19 By Ann Vander Berg More than two months ago, in mid-March, as I was walking along the front entrance of … Continue reading The Image of God Reflected Through COVID-19 COVID-19, Diocese of Niagara With a Grateful Heart – Parishes around the diocese are responding to community needs during the pandemic A Word from Bishop Susan Bell It has been moving to witness the people of our diocese creatively and faithfully … Continue reading With a Grateful Heart – Parishes around the diocese are responding to community needs during the pandemic Lent, St. John’s Ancaster What we did for Lent by Donna Ellis, Licensed Lay Worker As I sit here working on the article of what we did at St. … Continue reading What we did for Lent outreach, St. John's Port Dalhousie Dignity Kits The St. John’s (Port Dalhousie) Dignity Kit initiative has a new local partner. In the winter months, thanks to Socks … Continue reading Dignity Kits Greening Niagara You Can Do It by Sue Carson As a society we have become totally dependent on plastics in every aspect of our lives. The … Continue reading You Can Do It COVID-19, Now Playing A World to Live in It’s the bottom of the 10th in the nail biting 2011 Texas Rangers/St. Louis Cardinals World Series. Game 6. The … Continue reading A World to Live in Chinese Anglican Mission Chinese Anglican Mission in Oakville by Garfield Wu The Chinese Anglican Mission in Oakville has its own unfolding picture with God’s blessings. Under Bishop Susan’s … Continue reading Chinese Anglican Mission in Oakville The Deacon's Bench The Deacon’s Bench By The Reverend Deacon Heino Claessens In our Diaconal vows, we are called to be a ministry of servanthood, interpreting … Continue reading The Deacon’s Bench COVID-19, Diocese of Niagara Still Being The Church – A Photo Essay Continue reading Still Being The Church – A Photo Essay In Other Words What makes a church, and why does it matter? by John Bowen Change and tradition sometimes seem like opposites. “We Anglicans have our traditions. We love them and are … Continue reading What makes a church, and why does it matter? Posts navigation Older posts Powered by WordPress.com. Post to Cancel"
63378,20200529,niagaraanglican.news,https://niagaraanglican.news/,text/html,text/html,en,"The Niagara Anglican – A Gathering Place and a Sounding Board for the People of the Diocese of Niagara – Since 1955 Skip to content The Niagara Anglican A Gathering Place and a Sounding Board for the People of the Diocese of Niagara – Since 1955 Menu Primary Navigation Home About Contact Us Social Navigation Twitter The online presence of The Niagara Anglican monthly print newspaper. We serve the Diocese of Niagara and its' many parishes. An archive of the monthly print edition can be found here. Search for: Follow The Niagara Anglican via Email Enter your email address to follow The Niagara Anglican and receive notifications of new posts by email. Follow Recent Posts Agenda-driven vs. God-driven May 28, 2020 Best Training for Ministry — Ever May 26, 2020 The Deacon’s Bench May 25, 2020 Easter Celebration May 23, 2020 Other Links The Diocese of Niagara Anglican Journal June issue offers snapshot of COVID-19 responses May 28, 2020 Anglicans, Lutherans gather online in multilingual Pentecost video May 28, 2020 Our eucharistic prayer matters—and not just for us May 28, 2020 Anglican Church of Canada A message to diocesan and parish leadership from the Primate May 28, 2020 Gathering at the River — an online Gospel Jamboree May 27, 2020 Ecumenical letter calling on Canada to uphold international law and the rights of Palestinians May 22, 2020 The Diocese of NiagaraMy Tweets The Niagara AnglicanMy Tweets Book Review Agenda-driven vs. God-driven Book Review: “What Do We Do With The Bible?” Richard Rohr (SPCK 2019) What do we do with the Bible? … Continue reading Agenda-driven vs. God-driven Now Playing Best Training for Ministry — Ever So — this was my third year in England, and London became my hunting ground for work as a pub entertainer. I … Continue reading Best Training for Ministry — Ever COVID-19 The Deacon’s Bench by The Reverencd Deacon Roderick McDowell In Matthew 25:31-46, Jesus challenges all of us to, among many things, to visit … Continue reading The Deacon’s Bench Easter Easter Celebration Bishop Susan Bell was joined by the Primate of All Canada, Archbishop Linda Nicholls, for our diocesan online Easter Worship. Continue reading Easter Celebration Editorial From The Editor There are a lot of things we are missing in this pandemic. Sunday services in our own church seems to … Continue reading From The Editor COVID-19 The Image of God Reflected Through COVID-19 By Ann Vander Berg More than two months ago, in mid-March, as I was walking along the front entrance of … Continue reading The Image of God Reflected Through COVID-19 COVID-19, Diocese of Niagara With a Grateful Heart – Parishes around the diocese are responding to community needs during the pandemic A Word from Bishop Susan Bell It has been moving to witness the people of our diocese creatively and faithfully … Continue reading With a Grateful Heart – Parishes around the diocese are responding to community needs during the pandemic Lent, St. John’s Ancaster What we did for Lent by Donna Ellis, Licensed Lay Worker As I sit here working on the article of what we did at St. … Continue reading What we did for Lent outreach, St. John's Port Dalhousie Dignity Kits The St. John’s (Port Dalhousie) Dignity Kit initiative has a new local partner. In the winter months, thanks to Socks … Continue reading Dignity Kits Greening Niagara You Can Do It by Sue Carson As a society we have become totally dependent on plastics in every aspect of our lives. The … Continue reading You Can Do It Posts navigation Older posts Powered by WordPress.com. Post to Cancel"
