,crawl_date,domain,url,mime_type_web_server,mime_type_tika,language,content
605790,20210514,niagaraanglican.news,https://niagaraanglican.news/,text/html,text/html,en,"The Niagara Anglican – A Gathering Place and a Sounding Board for the People of the Diocese of Niagara – Since 1955 Skip to content The Niagara Anglican A Gathering Place and a Sounding Board for the People of the Diocese of Niagara – Since 1955 Menu Primary Navigation Twitter Social Navigation Twitter The online presence of The Niagara Anglican monthly print newspaper. We serve the Diocese of Niagara and its' many parishes. An archive of the monthly print edition can be found here. Search for: Follow The Niagara Anglican via Email Enter your email address to follow The Niagara Anglican and receive notifications of new posts by email. Email Address: Follow Recent Posts Evolving Faith: Cultivating Hope in the Wilderness May 13, 2021 Ending a Plastic Pandemic Starts in Your Parish May 6, 2021 The Blessings of Hospitality May 4, 2021 Technology Grants Equip Parishes for Contemporary Ministry May 3, 2021 Other Links The Diocese of Niagara Anglican Journal ‘Our response … gives me huge hope’ May 10, 2021 As church struggles with pandemic, primate sees modified agenda for CoGS May 6, 2021 Five years after the TRC report, reflections on reconciliation May 5, 2021 Anglican Church of Canada A message from the Primate for Jerusalem Sunday May 14, 2021 Faith organizations, rights advocacy groups urge PM Trudeau to actively support global vaccine equity May 11, 2021 Highlights from Council of General Synod: May 7-9, 2021 May 11, 2021 The Diocese of NiagaraMy Tweets The Niagara AnglicanMy Tweets Education Evolving Faith: Cultivating Hope in the Wilderness The Bishop has announced that Sarah Bessey will be the featured speaker for this year’s clergy and licensed lay workers … Continue reading Evolving Faith: Cultivating Hope in the Wilderness Climate Justice Niagara Ending a Plastic Pandemic Starts in Your Parish By Irene Pang As we begin to see flickers of light at the end of the COVID-19 tunnel, our society … Continue reading Ending a Plastic Pandemic Starts in Your Parish COVID-19 The Blessings of Hospitality By Canon Sharyn Hall Of the many changes in our lives during this pandemic, one that we will no longer … Continue reading The Blessings of Hospitality Technology Technology Grants Equip Parishes for Contemporary Ministry Over the last year, by necessity, the COVID-19 global pandemic has shifted a great deal of everyday ministry into the … Continue reading Technology Grants Equip Parishes for Contemporary Ministry Alpha, Christianity Not Your Great Grandmother’s Alpha By The Reverend Tom Vaughan Now I’m sure all of you are wondering what I am going to say about … Continue reading Not Your Great Grandmother’s Alpha The Deacon's Bench The Process of Becoming a Deacon By the Reverend Deacon Rod McDowell For some time now, readers of this paper have seen a column called “The … Continue reading The Process of Becoming a Deacon Diocese of Niagara, IGNITE, Stewardship Ignite: Faith in the Future This is the evocative and hope-filled name of a refreshed stewardship initiative within our diocese to support the many ministries … Continue reading Ignite: Faith in the Future Anti-Racism: A Journey Towards Healing and Wholeness Wade in the Water This is the second Installment of a special series By The Reverend Garfield Wu “God said he was going to … Continue reading Wade in the Water Mission The Person is the Mission: How the Church Missions, Matters By the Reverend Daniel Tatarnic On a Sunday afternoon in mid-May, 1976, my relationship with the Church was sealed: prophet, … Continue reading The Person is the Mission: How the Church Missions, Matters Christianity, Jesus Christ Abiding with Jesus By The Reverend Michael Coren When I was a small boy, I spent a great deal of time with my … Continue reading Abiding with Jesus Posts navigation Older posts Website Powered by WordPress.com. Email (Required) Name (Required) Website Loading Comments... Comment ×"
616227,20210521,niagaraanglican.news,https://niagaraanglican.news/,text/html,text/html,en,"The Niagara Anglican – A Gathering Place and a Sounding Board for the People of the Diocese of Niagara – Since 1955 Skip to content The Niagara Anglican A Gathering Place and a Sounding Board for the People of the Diocese of Niagara – Since 1955 Menu Primary Navigation Twitter Social Navigation Twitter The online presence of The Niagara Anglican monthly print newspaper. We serve the Diocese of Niagara and its' many parishes. An archive of the monthly print edition can be found here. Search for: Follow The Niagara Anglican via Email Enter your email address to follow The Niagara Anglican and receive notifications of new posts by email. Email Address: Follow Recent Posts Evolving Faith: Cultivating Hope in the Wilderness May 13, 2021 Ending a Plastic Pandemic Starts in Your Parish May 6, 2021 The Blessings of Hospitality May 4, 2021 Technology Grants Equip Parishes for Contemporary Ministry May 3, 2021 Other Links The Diocese of Niagara Anglican Journal Listening for the Spirit in a liminal time May 18, 2021 ‘Our response … gives me huge hope’ May 10, 2021 As church struggles with pandemic, primate sees modified agenda for CoGS May 6, 2021 Anglican Church of Canada Message to the Church: Supporting our partners in Jerusalem May 20, 2021 Hanna Goschy, Treasurer, retires this summer May 14, 2021 A message from the Primate for Jerusalem Sunday May 14, 2021 The Diocese of NiagaraMy Tweets The Niagara AnglicanMy Tweets Education Evolving Faith: Cultivating Hope in the Wilderness The Bishop has announced that Sarah Bessey will be the featured speaker for this year’s clergy and licensed lay workers … Continue reading Evolving Faith: Cultivating Hope in the Wilderness Climate Justice Niagara Ending a Plastic Pandemic Starts in Your Parish By Irene Pang As we begin to see flickers of light at the end of the COVID-19 tunnel, our society … Continue reading Ending a Plastic Pandemic Starts in Your Parish COVID-19 The Blessings of Hospitality By Canon Sharyn Hall Of the many changes in our lives during this pandemic, one that we will no longer … Continue reading The Blessings of Hospitality Technology Technology Grants Equip Parishes for Contemporary Ministry Over the last year, by necessity, the COVID-19 global pandemic has shifted a great deal of everyday ministry into the … Continue reading Technology Grants Equip Parishes for Contemporary Ministry Alpha, Christianity Not Your Great Grandmother’s Alpha By The Reverend Tom Vaughan Now I’m sure all of you are wondering what I am going to say about … Continue reading Not Your Great Grandmother’s Alpha The Deacon's Bench The Process of Becoming a Deacon By the Reverend Deacon Rod McDowell For some time now, readers of this paper have seen a column called “The … Continue reading The Process of Becoming a Deacon Diocese of Niagara, IGNITE, Stewardship Ignite: Faith in the Future This is the evocative and hope-filled name of a refreshed stewardship initiative within our diocese to support the many ministries … Continue reading Ignite: Faith in the Future Anti-Racism: A Journey Towards Healing and Wholeness Wade in the Water This is the second Installment of a special series By The Reverend Garfield Wu “God said he was going to … Continue reading Wade in the Water Mission The Person is the Mission: How the Church Missions, Matters By the Reverend Daniel Tatarnic On a Sunday afternoon in mid-May, 1976, my relationship with the Church was sealed: prophet, … Continue reading The Person is the Mission: How the Church Missions, Matters Christianity, Jesus Christ Abiding with Jesus By The Reverend Michael Coren When I was a small boy, I spent a great deal of time with my … Continue reading Abiding with Jesus Posts navigation Older posts Website Powered by WordPress.com. Email (Required) Name (Required) Website Loading Comments... Comment ×"
626614,20210528,niagaraanglican.news,https://niagaraanglican.news/,text/html,text/html,en,"The Niagara Anglican – A Gathering Place and a Sounding Board for the People of the Diocese of Niagara – Since 1955 Skip to content The Niagara Anglican A Gathering Place and a Sounding Board for the People of the Diocese of Niagara – Since 1955 Menu Primary Navigation Twitter Social Navigation Twitter The online presence of The Niagara Anglican monthly print newspaper. We serve the Diocese of Niagara and its' many parishes. An archive of the monthly print edition can be found here. Search for: Follow The Niagara Anglican via Email Enter your email address to follow The Niagara Anglican and receive notifications of new posts by email. Email Address: Follow Recent Posts Migrant Farmworkers Project – A New Season Underway May 27, 2021 A Contemporary Grief Observed May 26, 2021 As we celebrate Pentecost May 22, 2021 Dream, Children, Angel, Cross (In honour of Pentecost) May 21, 2021 Other Links The Diocese of Niagara Anglican Journal Listening for the Spirit in a liminal time May 18, 2021 ‘Our response … gives me huge hope’ May 10, 2021 As church struggles with pandemic, primate sees modified agenda for CoGS May 6, 2021 Anglican Church of Canada Mourning the unexpected loss of the national Indigenous Ministries Coordinator May 27, 2021 Message to the Church: Supporting our partners in Jerusalem May 20, 2021 Hanna Goschy, Treasurer, retires this summer May 14, 2021 The Diocese of NiagaraMy Tweets The Niagara AnglicanMy Tweets Migrant Farm Workers Project Migrant Farmworkers Project – A New Season Underway Grocery Bag Drop-Off & Bikes for Farmworkers initiative By The Reverend Antonio Illas with contributions from Gillian Doucet Campbell and … Continue reading Migrant Farmworkers Project – A New Season Underway Grief A Contemporary Grief Observed By The Reverend Michael Coren The COVID-19 pandemic has led to people considering mortality in a way they’ve seldom done … Continue reading A Contemporary Grief Observed Pentecost As we celebrate Pentecost As we celebrate Pentecost, ignited by the irresistible love of Jesus and renewed by the Holy Spirit, Bishop Susan Bell … Continue reading As we celebrate Pentecost Now Playing Dream, Children, Angel, Cross (In honour of Pentecost) By the Venerable Max Woolaver The church hall was filled with children — running, skipping, letting loose – how easily children get … Continue reading Dream, Children, Angel, Cross (In honour of Pentecost) Education Evolving Faith: Cultivating Hope in the Wilderness The Bishop has announced that Sarah Bessey will be the featured speaker for this year’s clergy and licensed lay workers … Continue reading Evolving Faith: Cultivating Hope in the Wilderness Climate Justice Niagara Ending a Plastic Pandemic Starts in Your Parish By Irene Pang As we begin to see flickers of light at the end of the COVID-19 tunnel, our society … Continue reading Ending a Plastic Pandemic Starts in Your Parish COVID-19 The Blessings of Hospitality By Canon Sharyn Hall Of the many changes in our lives during this pandemic, one that we will no longer … Continue reading The Blessings of Hospitality Technology Technology Grants Equip Parishes for Contemporary Ministry Over the last year, by necessity, the COVID-19 global pandemic has shifted a great deal of everyday ministry into the … Continue reading Technology Grants Equip Parishes for Contemporary Ministry Alpha, Christianity Not Your Great Grandmother’s Alpha By The Reverend Tom Vaughan Now I’m sure all of you are wondering what I am going to say about … Continue reading Not Your Great Grandmother’s Alpha The Deacon's Bench The Process of Becoming a Deacon By the Reverend Deacon Rod McDowell For some time now, readers of this paper have seen a column called “The … Continue reading The Process of Becoming a Deacon Posts navigation Older posts Website Powered by WordPress.com. Write a Comment... Email (Required) Name (Required) Website Loading Comments... Comment ×"
637247,20210604,niagaraanglican.news,https://niagaraanglican.news/,text/html,text/html,en,"The Niagara Anglican – A Gathering Place and a Sounding Board for the People of the Diocese of Niagara – Since 1955 Skip to content The Niagara Anglican A Gathering Place and a Sounding Board for the People of the Diocese of Niagara – Since 1955 Menu Primary Navigation Twitter Social Navigation Twitter The online presence of The Niagara Anglican monthly print newspaper. We serve the Diocese of Niagara and its' many parishes. An archive of the monthly print edition can be found here. Search for: Follow The Niagara Anglican via Email Enter your email address to follow The Niagara Anglican and receive notifications of new posts by email. Email Address: Follow Recent Posts Anti-Racism: A Journey Towards Healing and Wholeness: White Fragility and the Privilege Knapsack June 3, 2021 Taking Action on Climate Now June 2, 2021 Everything is Connected: but How? June 1, 2021 Want to Grow a Generous Church? Read This. May 31, 2021 Other Links The Diocese of Niagara Anglican Journal ‘Transformed by the encounter with the other’ June 1, 2021 Anglican-affiliated Thorneloe University fights to remain federated with Laurentian June 1, 2021 ‘Contemplative Knitting’ spins a vision of prayer—stitch by stitch June 1, 2021 Anglican Church of Canada Every Child Matters June 2, 2021 Announcement from the Primate June 1, 2021 Mourning the unexpected loss of the national Indigenous Ministries Coordinator May 27, 2021 The Diocese of NiagaraMy Tweets The Niagara AnglicanMy Tweets Anti-Racism: A Journey Towards Healing and Wholeness Anti-Racism: A Journey Towards Healing and Wholeness: White Fragility and the Privilege Knapsack This is the third Installment of this series By Deirdre Pike It has been just over a year since one … Continue reading Anti-Racism: A Journey Towards Healing and Wholeness: White Fragility and the Privilege Knapsack Climate Change, Climate Justice Niagara Taking Action on Climate Now By The Reverend Don Brown “Where your treasure is, there will your heart be also.” — Matthew 6:21 Irene Pang’s article … Continue reading Taking Action on Climate Now In Other Words Everything is Connected: but How? By John Bowen What holds everything together? For many of us, the Christian faith is made up of fragments. Over … Continue reading Everything is Connected: but How? Stewardship Want to Grow a Generous Church? Read This. Growing a Generous Church: A Year in the Life of Peach Blossom Church. By Lori Guenther Reesor Reviewed by By … Continue reading Want to Grow a Generous Church? Read This. Evangelism John Bowen Receives Prestigious Lambeth Award The Archbishop of Canterbury has announced that John Bowen, parishioner at Church of St. John the Evangelist in Hamilton and … Continue reading John Bowen Receives Prestigious Lambeth Award COVID-19, Diocese of Niagara, Technology The Pandemic, Technology, and Our Resilience By Gillian Doucet Campbell It has been, as Canon Katherine Morgan wrote in response to her parish, St. John’s, Thorold, … Continue reading The Pandemic, Technology, and Our Resilience Migrant Farm Workers Project Migrant Farmworkers Project – A New Season Underway Grocery Bag Drop-Off & Bikes for Farmworkers initiative By The Reverend Antonio Illas with contributions from Gillian Doucet Campbell and … Continue reading Migrant Farmworkers Project – A New Season Underway Grief A Contemporary Grief Observed By The Reverend Michael Coren The COVID-19 pandemic has led to people considering mortality in a way they’ve seldom done … Continue reading A Contemporary Grief Observed Pentecost As we celebrate Pentecost As we celebrate Pentecost, ignited by the irresistible love of Jesus and renewed by the Holy Spirit, Bishop Susan Bell … Continue reading As we celebrate Pentecost Now Playing Dream, Children, Angel, Cross (In honour of Pentecost) By the Venerable Max Woolaver The church hall was filled with children — running, skipping, letting loose – how easily children get … Continue reading Dream, Children, Angel, Cross (In honour of Pentecost) Posts navigation Older posts Website Powered by WordPress.com. Write a Comment... Email (Required) Name (Required) Website Loading Comments... Comment ×"
647800,20210611,niagaraanglican.news,https://niagaraanglican.news/,text/html,text/html,en,"The Niagara Anglican – A Gathering Place and a Sounding Board for the People of the Diocese of Niagara – Since 1955 Skip to content The Niagara Anglican A Gathering Place and a Sounding Board for the People of the Diocese of Niagara – Since 1955 Menu Primary Navigation Twitter Social Navigation Twitter The online presence of The Niagara Anglican monthly print newspaper. We serve the Diocese of Niagara and its' many parishes. An archive of the monthly print edition can be found here. Search for: Follow The Niagara Anglican via Email Enter your email address to follow The Niagara Anglican and receive notifications of new posts by email. Email Address: Follow Recent Posts Called to Life, Compelled to Love: Welcoming Refugees June 10, 2021 New Program Revives the Lenten Journey June 9, 2021 The Deep Roots of the Water Lily June 8, 2021 Job the Innocent Sufferer June 7, 2021 Other Links The Diocese of Niagara Anglican Journal Living creatively in a hybrid church June 9, 2021 Grieving beyond ‘words alone’ June 8, 2021 Territory of the People bishop inhibited from ministry June 8, 2021 Anglican Church of Canada Mentoring new clergy in the Diocese of Moosonee during a Pandemic June 9, 2021 Bringing summer Bible camp home to families June 9, 2021 Radio brings Nunavut hamlet together during pandemic June 9, 2021 The Diocese of NiagaraMy Tweets The Niagara AnglicanMy Tweets Diocese of Niagara, Refugee Sponsorship Called to Life, Compelled to Love: Welcoming Refugees By The Venerable Bill Mous For more than two decades, parishes in our diocese have been helping refugees regain their … Continue reading Called to Life, Compelled to Love: Welcoming Refugees Revive New Program Revives the Lenten Journey By The Reverend Canon Leslie Gerlofs Revive Lent premiered in churches across our diocese and around the Anglican Communion for … Continue reading New Program Revives the Lenten Journey The Deacon's Bench The Deep Roots of the Water Lily By The Reverend Deacon Sheila Plant It seems that more and more people are jumping on the genealogy bandwagon these … Continue reading The Deep Roots of the Water Lily Bible Job the Innocent Sufferer By the Venerable Dr. John Course There is perhaps no greater stumbling block to faith in a loving, all-powerful God … Continue reading Job the Innocent Sufferer Now Playing The Third Day’s Mind By The Venerable Max Woolaver This writing is dedicated to the memory of two men. The first on my mind … Continue reading The Third Day’s Mind COVID-19 The Faith of the Squiggling Puppy By The Reverend Canon Martha Tatarnic Our little puppy Bruce needs to be carried down the stairs every morning for … Continue reading The Faith of the Squiggling Puppy Anti-Racism: A Journey Towards Healing and Wholeness Anti-Racism: A Journey Towards Healing and Wholeness: White Fragility and the Privilege Knapsack This is the third Installment of this series By Deirdre Pike It has been just over a year since one … Continue reading Anti-Racism: A Journey Towards Healing and Wholeness: White Fragility and the Privilege Knapsack Climate Change, Climate Justice Niagara Taking Action on Climate Now By The Reverend Don Brown “Where your treasure is, there will your heart be also.” — Matthew 6:21 Irene Pang’s article … Continue reading Taking Action on Climate Now In Other Words Everything is Connected: but How? By John Bowen What holds everything together? For many of us, the Christian faith is made up of fragments. Over … Continue reading Everything is Connected: but How? Stewardship Want to Grow a Generous Church? Read This. Growing a Generous Church: A Year in the Life of Peach Blossom Church. By Lori Guenther Reesor Reviewed by By … Continue reading Want to Grow a Generous Church? Read This. Posts navigation Older posts Website Powered by WordPress.com. Write a Comment... Email (Required) Name (Required) Website Loading Comments... Comment ×"
657634,20210618,niagaraanglican.news,https://niagaraanglican.news/,text/html,text/html,en,"The Niagara Anglican – A Gathering Place and a Sounding Board for the People of the Diocese of Niagara – Since 1955 Skip to content The Niagara Anglican A Gathering Place and a Sounding Board for the People of the Diocese of Niagara – Since 1955 Menu Primary Navigation Twitter Social Navigation Twitter The online presence of The Niagara Anglican monthly print newspaper. We serve the Diocese of Niagara and its' many parishes. An archive of the monthly print edition can be found here. Search for: Follow The Niagara Anglican via Email Enter your email address to follow The Niagara Anglican and receive notifications of new posts by email. Email Address: Follow Recent Posts Seaspiracy — Revealing The State of Our Oceans June 11, 2021 Called to Life, Compelled to Love: Welcoming Refugees June 10, 2021 New Program Revives the Lenten Journey June 9, 2021 The Deep Roots of the Water Lily June 8, 2021 Other Links The Diocese of Niagara Anglican Journal The Courage to Understand and Draw Conclusions: Exterminate All the Brutes and White Supremacy June 16, 2021 Vivian Seegers lived out gospel through pain and triumph June 14, 2021 Living creatively in a hybrid church June 9, 2021 Anglican Church of Canada Statement from the Primate June 14, 2021 Mentoring new clergy in the Diocese of Moosonee during a Pandemic June 9, 2021 Bringing summer Bible camp home to families June 9, 2021 The Diocese of NiagaraMy Tweets The Niagara AnglicanMy Tweets Climate Justice Niagara, Video Review Seaspiracy — Revealing The State of Our Oceans By Carleon Hardie Not all of you will have a Netflix subscription but if you do, or know someone who … Continue reading Seaspiracy — Revealing The State of Our Oceans Diocese of Niagara, Refugee Sponsorship Called to Life, Compelled to Love: Welcoming Refugees By The Venerable Bill Mous For more than two decades, parishes in our diocese have been helping refugees regain their … Continue reading Called to Life, Compelled to Love: Welcoming Refugees Revive New Program Revives the Lenten Journey By The Reverend Canon Leslie Gerlofs Revive Lent premiered in churches across our diocese and around the Anglican Communion for … Continue reading New Program Revives the Lenten Journey The Deacon's Bench The Deep Roots of the Water Lily By The Reverend Deacon Sheila Plant It seems that more and more people are jumping on the genealogy bandwagon these … Continue reading The Deep Roots of the Water Lily Bible Job the Innocent Sufferer By the Venerable Dr. John Course There is perhaps no greater stumbling block to faith in a loving, all-powerful God … Continue reading Job the Innocent Sufferer Now Playing The Third Day’s Mind By The Venerable Max Woolaver This writing is dedicated to the memory of two men. The first on my mind … Continue reading The Third Day’s Mind COVID-19 The Faith of the Squiggling Puppy By The Reverend Canon Martha Tatarnic Our little puppy Bruce needs to be carried down the stairs every morning for … Continue reading The Faith of the Squiggling Puppy Anti-Racism: A Journey Towards Healing and Wholeness Anti-Racism: A Journey Towards Healing and Wholeness: White Fragility and the Privilege Knapsack This is the third Installment of this series By Deirdre Pike It has been just over a year since one … Continue reading Anti-Racism: A Journey Towards Healing and Wholeness: White Fragility and the Privilege Knapsack Climate Change, Climate Justice Niagara Taking Action on Climate Now By The Reverend Don Brown “Where your treasure is, there will your heart be also.” — Matthew 6:21 Irene Pang’s article … Continue reading Taking Action on Climate Now In Other Words Everything is Connected: but How? By John Bowen What holds everything together? For many of us, the Christian faith is made up of fragments. Over … Continue reading Everything is Connected: but How? Posts navigation Older posts Website Powered by WordPress.com. Write a Comment... Email (Required) Name (Required) Website Loading Comments... Comment ×"
