,crawl_date,domain,url,mime_type_web_server,mime_type_tika,language,content
395515,20201218,ourwindsor.ca,https://www.ourwindsor.ca/,text/html,text/html,en,"Windsor News - Latest Daily Breaking News Stories | OurWindsor.ca Save.caHomefinder.caWheels.ca loading... Sign In Show Navigation 0°CFriday Dec 18 Close Navigation Local News Local NewsBusinessCrimeCouncilCannabis and YouCommunity VoicesHot TopicsCoronavirus Crisis Things to do Things to doEvent ListingsFood and DrinkBooks and AuthorsCommunity Voices Opinion OpinionAdviceColumnsCommunity VoicesEditorial Life LifeCommunity VoicesFashion and BeautyHoroscopesPersonal FinanceTravelWellness Announcements AnnouncementsAnniversariesBirthdaysBirthsEngagementsGraduationsIn MemoriamObituariesWeddings Marketplace MarketplaceClassifiedsBusiness ListingsCouponsFlyersHousing RentalsJobsReal EstateCars Search Sign In Save.caHomefinder.caWheels.ca Editor's picks News Can businesses deny customers who don't get the COVID-19 vaccine? Establishments will have to make difficult decisions about COVID-19 vaccine, legal experts said.1 hour ago News ‘Bad Santa’ video helps GreekTown on the Danforth BIA promote local shopping1 hour ago News No punishment for those who made ‘good-faith mistakes’ in applying for wage subsidies, Justin Trudeau1 hour ago News Any new Ontario lockdown measures will be decided Dec. 21, Ford says2 hours ago Canada Feds seek to reduce nicotine in vaping products23 minutes ago Canada Feds throw support behind mini nuclear reactors38 minutes ago News Ontario extending Toronto, Peel lockdowns43 minutes ago News Neskantaga residents begin returning home45 minutes ago Business Canada's deficit hit $216.6B on COVID relief1 hour ago Canada Feds to invest $9 million in COVID treatments1 hour ago Business Weston family sells shares to Loblaw1 hour ago Events Fri Dec 18, 2020 Kingsville Fantasy of LightsKingsville | 12:00 am - 11:59 pm Fri Dec 18, 2020 Walking in a Winter StorylandWindsor - City | 12:00 am - 11:59 pm Fri Dec 18, 2020 Spirit of Christmas drive-in attractionWindsor - City | 12:00 am - 11:59 pm Fri Dec 18, 2020 River Lights Winter FestivalEssex | 12:00 am - 11:59 pm Fri Dec 18, 2020 A signature christmas: indoor artists marketLeamington | 10:00 am - 4:00 pm Post Your Event Events Fri Dec 18, 2020 Kingsville Fantasy of LightsKingsville | 12:00 am - 11:59 pm Fri Dec 18, 2020 Walking in a Winter StorylandWindsor - City | 12:00 am - 11:59 pm Fri Dec 18, 2020 Spirit of Christmas drive-in attractionWindsor - City | 12:00 am - 11:59 pm Fri Dec 18, 2020 River Lights Winter FestivalEssex | 12:00 am - 11:59 pm Post Your Event Things to do Books Who do we see in Canadian children’s books? The Star’s second annual diversity survey tells the story Exclusive numbers gathered by the Toronto Star for the second year in a row show that, while the voices represented in children’s books published in this country are still overwhelmingly white, other voices are gaining incrementally.23 hours ago Books New crime fiction from masters of storytelling deliver chills — and thrillsDec 17, 2020 Books Toronto Star bestsellers for the week ending Dec. 16, 2020Dec 16, 2020 Books Eight picture books for the little readers on your gift listDec 13, 2020 Featured News Ontario colour zones: Track your region’s COVID-19 status Use our interactive map to see which level of Ontario's new colour-coded COVID-19 response framework your region is in.Dec 14, 2020 News Two more Ontario health units added to lockdown list. Use our database to check your COVID-19 status and see which rules apply to you News We’re tracking COVID-19 cases in Ontario schools. Check our graphic daily for updates Local Index Walk-in Clinics in and around Windsor Opinion Opinion My bully of a brother wants to risk our mother’s life with a Christmas visit. What should I do? Ask Ellie Q: My older brother's been a problem for me all my life. He's now 49, I'm 43. I think he's never forgiven me for intruding on his starring role as ""the only child"" when he was age six.9 hours ago Opinion ‘Devastated and appalled’: Community newspapers left out19 minutes ago Opinion ASK THE MONEY LADY: I have lots of debt — should I declare bankruptcy?9 hours ago Opinion Hold Iran accountable for Flight PS7529 hours ago Horoscopes Horoscope for Friday, Dec. 18, 202011 hours ago Coronavirus Crisis News Ontario extending Toronto, Peel lockdowns Ford calls emergency Friday meeting with health officials over hospitalizations43 minutes ago News Can businesses deny customers who don't get the COVID-19 vaccine?1 hour ago Canada Feds to invest $9 million in COVID treatments1 hour ago News ‘Bad Santa’ video helps GreekTown on the Danforth BIA promote local shopping1 hour ago News No punishment for those who made ‘good-faith mistakes’ in applying for wage subsidies, Justin Trudeau1 hour ago Life Community COVID-weary families brace for curtailed Christmas Tinsel and COVID tests: how some families hope to gather for a pandemic Christmas3 hours ago Opinion ASK THE MONEY LADY: I have lots of debt — should I declare bankruptcy?9 hours ago WhatsOn These 21 holiday light displays are spreading festive cheer in Ontario. Scroll through them hereDec 17, 2020 Community LTC staff express relief, hope with COVID vaccineDec 15, 2020 Wellness Doctors answer common COVID-19 vaccine questionsDec 15, 2020 Holiday Gift Guide Fashion and Beauty These are gift cards they’ll actually be happy to receive Gift cards can get a bit of a bad rap. Some say they display a lack of imagination on the gifter’s part; others point to the masses of gifting money left unspent on forgotten cards. But if you put some thought into your recipient’s favour20 hours ago Fashion and Beauty A most wonderful gift for each sign of the zodiacDec 15, 2020 Books Eight picture books for the little readers on your gift listDec 13, 2020 Books Book gift ideas to transport kids to new worlds this holiday seasonDec 12, 2020 Flyers powered by Sobeys Weekly FlyerThu Dec 17, 2020 - Wed Dec 23, 2020 2001 Audio VideoFri Dec 18, 2020 - Thu Dec 24, 2020 Best BuyFri Dec 18, 2020 - Thu Dec 24, 2020 RexallFri Dec 18, 2020 - Thu Dec 24, 2020 Pro Hockey LifeFri Dec 18, 2020 - Fri Dec 25, 2020 Henry'sFri Dec 18, 2020 - Wed Dec 23, 2020 Fashion and beauty Fashion and Beauty How should I dress this holiday season? Ask the Kit “I love sparkle and the glamour of the holidays, and I am really feeling the loss of that this year, along with everything else, frankly. Think I should make the effort to get dressed for my Zoom get-togethers or even just for my family dinner Dec 11, 2020 Opinion Why can’t I smell my perfume anymore? Ask the KitDec 04, 2020 Opinion How can I find a good injectables doctor? Ask The KitNov 27, 2020 Opinion Can I pull off those giant puffers? Ask the KitNov 20, 2020 Real estate Business Home prices to rise 9% in 2021: CREA Home prices to rise more than 9% in 2020, Canadian Real Estate Association forecastsDec 15, 2020 Business November home sales surge 32.1% from 2019Dec 15, 2020 Business Housing starts jump 14.4% in NovemberDec 15, 2020 Business Home prices to continue to climb in 2021: reportDec 14, 2020 Autos Wheels Mitsubishi will start the New Year with refreshed, updated Eclipse Cross Mitsubishi Canada will be entering 2021 with an updated and refreshed Eclipse Cross that will bring to Canadian drivers a refined and more elegant design and retuned to provide greater handling and control.Dec 15, 2020 Wheels First Drive - 2021 Ford Mustang Mach-EDec 15, 2020 Wheels First Drive - 2021 Lexus ISDec 14, 2020 Wheels November Auto Sales Show Slide From October, Still Some Bright LightsDec 11, 2020 Headlines Newsletter TOP STORIES, delivered to your inbox. Sign Up Submit Content Submit ContentContact UsGive us feedbackJoin our team Subscribe to The Star Subscribe to The StarSignup for email newslettersFAQs Place an Ad Place an AdFlyer Distribution and Printing About Ourwindsor.ca About Ourwindsor.caCommenting guidelinesTorstar's StoryInvestor Relations Join Us! © Copyright 2020 Metroland Media Group Ltd. All Rights Reserved Metroland NewsAdvertising TermsTerms of useCorporate Privacy PolicyAccessibility Policy"
395594,20201218,ourwindsor.ca,https://www.ourwindsor.ca/news-story/9960825-it-s-so-not-over-life-after-lockdown-is-coming-but-will-we-be-mentally-prepared-for-it/,text/html,text/html,en,Save.caHomefinder.caWheels.ca loading... Sign In Show Navigation 0°CFriday Dec 18 Close Navigation Local News Local NewsBusinessCrimeCouncilCannabis and YouCommunity VoicesHot TopicsCoronavirus Crisis Things to do Things to doEvent ListingsFood and DrinkBooks and AuthorsCommunity Voices Opinion OpinionAdviceColumnsCommunity VoicesEditorial Life LifeCommunity VoicesFashion and BeautyHoroscopesPersonal FinanceTravelWellness Announcements AnnouncementsAnniversariesBirthdaysBirthsEngagementsGraduationsIn MemoriamObituariesWeddings Marketplace MarketplaceClassifiedsBusiness ListingsCouponsFlyersHousing RentalsJobsReal EstateCars Search Sign In Save.caHomefinder.caWheels.ca Submit Content Submit ContentContact UsGive us feedbackJoin our team Subscribe to The Star Subscribe to The StarSignup for email newslettersFAQs Place an Ad Place an AdFlyer Distribution and Printing About Ourwindsor.ca About Ourwindsor.caCommenting guidelinesTorstar's StoryInvestor Relations Join Us! © Copyright 2020 Metroland Media Group Ltd. All Rights Reserved Metroland NewsAdvertising TermsTerms of useCorporate Privacy PolicyAccessibility Policy
395598,20201218,ourwindsor.ca,https://www.ourwindsor.ca/opinion-story/9961008-heather-scoffield-here-s-what-s-missing-from-the-debate-over-how-to-reopen-canada-s-economy/,text/html,text/html,en,Heather Scoffield: Here’s what’s missing from the debate over how to reopen Canada’s economy
395611,20201218,ourwindsor.ca,https://www.ourwindsor.ca/news-story/9990695-canada-u-s-extends-border-shutdown-to-non-essential-travel-to-june-21-toronto-reopens-off-leash-dog-parks/,text/html,text/html,en,"Canada, U.S. extends border shutdown to non-essential travel to June 21; Toronto reopens off-leash dog parks"
395614,20201218,ourwindsor.ca,https://www.ourwindsor.ca/news-story/9991666-no-grand-covid-19-reopening-yet-says-tam/,text/html,text/html,en,"No 'grand' COVID-19 reopening yet, says Tam"
404720,20201225,ourwindsor.ca,https://www.ourwindsor.ca/,text/html,text/html,en,"Windsor News - Latest Daily Breaking News Stories | OurWindsor.ca skip to main content Save.ca Homefinder.ca Wheels.ca loading... skip to main contentSign In Show Navigation -6°CFriday Dec 25 Close Navigation Local News Things to do Opinion Life Announcements Marketplace Search Sign In Save.caHomefinder.caWheels.ca Editor's picks NewsToday’s coronavirus news: South Korea reports record-high 1,241 new cases; Trump scuttles COVID relief bill on Christmas Eve The latest coronavirus news from Canada and around the world Friday. This file will be updated throughout the day. Web links to longer stories if available.7 hours ago NewsThis illustration sums up our 2020 Christmas season9 hours ago NewsFamilies struggle as deadly COVID-19 outbreak overruns long-term care home in Scarborough17 hours ago NewsHow many cases of coronavirus are there in Hamilton?17 hours ago NewsShould downhill skiing be permitted to open during the lockdown?20 hours ago NewsFew shoppers out as Montreal prepares for lockdown23 hours ago News3 stories to update you on COVID-19 in Ontario todayDec 24, 2020 CanadaMilitary bases struggling with personnel shortagesDec 24, 2020 NewsOntario cancels in-vehicle road tests until after provincewide shutdownDec 24, 2020 BusinessMarkets close higher in Christmas Eve tradingDec 24, 2020 NewsOntario hits record daily high of COVID-19 casesDec 24, 2020 Events Fri Dec 25, 2020Kingsville Fantasy of LightsKingsville | 12:00 am - 11:59 pm Fri Dec 25, 2020Walking in a Winter StorylandWindsor - City | 12:00 am - 11:59 pm Fri Dec 25, 2020River Lights Winter FestivalEssex | 12:00 am - 11:59 pm Sat Dec 26, 2020Conversations: Windsor Essex Triennial of Contemporary Art 2020Windsor - City | 11:00 am - 5:00 pm Tue Dec 29, 2020Toastmasters LaSalle Meeting6:45 pm - 11:59 pm Post Your Event Events Fri Dec 25, 2020Kingsville Fantasy of LightsKingsville | 12:00 am - 11:59 pm Fri Dec 25, 2020Walking in a Winter StorylandWindsor - City | 12:00 am - 11:59 pm Fri Dec 25, 2020River Lights Winter FestivalEssex | 12:00 am - 11:59 pm Sat Dec 26, 2020Conversations: Windsor Essex Triennial of Contemporary Art 2020Windsor - City | 11:00 am - 5:00 pm Post Your Event Things to do Food and DrinkYou can make turkey stock. It’s easy. And we’ve got some seasoned tips If you’ve had me over for a turkey dinner, you may have caught me leering around the picked-over carcass, suspiciously. “Whatcha gonna do with that?” I might ask, casually.Dec 24, 2020 BooksLatest graphic novels have characters you might relate to — with flaws you hope you won’t shareDec 24, 2020 BooksToronto Star Bestselling books for the week ending Dec. 23, 2020Dec 23, 2020 OpinionThe Star’s wine critic shares a mulled wine recipe that will make you a holiday heroDec 23, 2020 Featured NewsOntario colour zones: Track your region’s COVID-19 status Use our interactive map to see which level of Ontario's new colour-coded COVID-19 response framework your region is in.Dec 24, 2020 NewsTwo more Ontario health units added to lockdown list. Use our database to check your COVID-19 status and see which rules apply to you NewsWe’re tracking COVID-19 cases in Ontario schools. Check our graphic daily for updates Local IndexWalk-in Clinics in and around Windsor Opinion OpinionWhat this COVID Christmas is teaching us A year that has seemed almost biblical in its wrath and tribulation serves the purpose, at least, of focusing the mind, obliging us to strip away the trappings of life and identify what’s essential.Dec 24, 2020 HoroscopesYour annual horoscope for the year 20219 hours ago HoroscopesHoroscope for Friday, Dec. 25, 202011 hours ago OpinionShop for the gardener in your life this holiday seasonDec 24, 2020 Opinion'There is another path': Documentary highlights issues with Earth's soilDec 24, 2020 Coronavirus Crisis NewsToday’s coronavirus news: South Korea reports record-high 1,241 new cases; Trump scuttles COVID relief bill on Christmas Eve The latest coronavirus news from Canada and around the world Friday. This file will be updated throughout the day. Web links to longer stories if available.7 hours ago NewsThis illustration sums up our 2020 Christmas season9 hours ago NewsFamilies struggle as deadly COVID-19 outbreak overruns long-term care home in Scarborough17 hours ago NewsHow many cases of coronavirus are there in Hamilton?17 hours ago NewsShould downhill skiing be permitted to open during the lockdown?20 hours ago Life CommunityChristmas mass adapts in COVID-19 pandemic Churches look for ways to evoke a true Christmas mass in COVID-19 pandemicDec 22, 2020 OPEN DIGITAL ACCESSNORAD's Santa Tracker is keeping watch as Santa makes his rounds on Christmas EveDec 24, 2020 Money MattersThis 34-year-old hospital worker has three kids and a mortgage to pay off. Making $104,000 a year, he wants to save $50K each for his kids. How can he start?Dec 21, 2020 Money MattersFood prices are expected to surge in 2021 — here’s how to save $500 or more on your groceriesDec 20, 2020 CommunityCOVID-weary families brace for curtailed ChristmasDec 18, 2020 Holiday Gift Guide Fashion and BeautyLoungewear upgrades: Dressing up for no place to go The year’s fashion in a few words: stretchy, relaxed and soft. We wanted to be coddled in cashmere and comforted by fleece. And brands, from high-end designers to mass retailers, were more than happy to cater to these new whims. Every online shDec 19, 2020 Fashion and BeautyLast-minute gift ideas that are actually greatDec 19, 2020 Fashion and BeautyThese are gift cards they’ll actually be happy to receiveDec 17, 2020 Fashion and BeautyA most wonderful gift for each sign of the zodiacDec 15, 2020 Flyers powered by Sobeys Celebrate The New Year!Sat Dec 26, 2020 - Fri Jan 1, 2021 RexallSat Dec 26, 2020 - Thu Dec 31, 2020 StaplesFri Dec 25, 2020 - Tue Dec 29, 2020 The SourceFri Dec 25, 2020 - Wed Dec 30, 2020 The SourceFri Dec 25, 2020 - Wed Dec 30, 2020 Fashion and beauty Fashion and BeautyHow Suzanne Rogers became Canada’s fashion fairy godmother Pandemic or no pandemic, there’s no keeping Suzanne Rogers’ signature big hair down. Dec 24, 2020 OpinionWhat can I do about my PMS symptoms? Ask the KitDec 18, 2020 Fashion and BeautyHow should I dress this holiday season? Ask the KitDec 11, 2020 OpinionWhy can’t I smell my perfume anymore? Ask the KitDec 04, 2020 Real estate BusinessHome prices to rise 9% in 2021: CREA Home prices to rise more than 9% in 2020, Canadian Real Estate Association forecastsDec 15, 2020 BusinessNovember home sales surge 32.1% from 2019Dec 15, 2020 BusinessHousing starts jump 14.4% in NovemberDec 15, 2020 BusinessHome prices to continue to climb in 2021: reportDec 14, 2020 Autos WheelsReview - 2020 Volkswagen GTI I'm not sure to what extent this car impresses simply because we're so familiar with VWs. But there's a singularity to this car, a wholeness, a sense that all of its functions work together in near-perfect harmony. This has been characteristic of GTIDec 23, 2020 WheelsMitsubishi will start the New Year with refreshed, updated Eclipse CrossDec 15, 2020 WheelsFirst Drive - 2021 Ford Mustang Mach-EDec 15, 2020 WheelsFirst Drive - 2021 Lexus ISDec 14, 2020 Headlines Newsletter TOP STORIES, delivered to your inbox. Sign Up Submit Content Subscribe to The Star Place an Ad About Ourwindsor.ca Join Us! © Copyright 2020 Metroland Media Group Ltd. All Rights Reserved Metroland NewsAdvertising TermsTerms of useCorporate Privacy PolicyAccessibility Policy"
404845,20201225,ourwindsor.ca,https://www.ourwindsor.ca/news-story/9960825-it-s-so-not-over-life-after-lockdown-is-coming-but-will-we-be-mentally-prepared-for-it/,text/html,text/html,en,skip to main content Save.ca Homefinder.ca Wheels.ca loading... skip to main contentSign In Show Navigation -6°CFriday Dec 25 Close Navigation Local News Things to do Opinion Life Announcements Marketplace Search Sign In Save.caHomefinder.caWheels.ca Submit Content Subscribe to The Star Place an Ad About Ourwindsor.ca Join Us! © Copyright 2020 Metroland Media Group Ltd. All Rights Reserved Metroland NewsAdvertising TermsTerms of useCorporate Privacy PolicyAccessibility Policy
404852,20201225,ourwindsor.ca,https://www.ourwindsor.ca/opinion-story/9961008-heather-scoffield-here-s-what-s-missing-from-the-debate-over-how-to-reopen-canada-s-economy/,text/html,text/html,en,Heather Scoffield: Here’s what’s missing from the debate over how to reopen Canada’s economy
404855,20201225,ourwindsor.ca,https://www.ourwindsor.ca/news-story/9990695-canada-u-s-extends-border-shutdown-to-non-essential-travel-to-june-21-toronto-reopens-off-leash-dog-parks/,text/html,text/html,en,"Canada, U.S. extends border shutdown to non-essential travel to June 21; Toronto reopens off-leash dog parks"
404861,20201225,ourwindsor.ca,https://www.ourwindsor.ca/news-story/9991666-no-grand-covid-19-reopening-yet-says-tam/,text/html,text/html,en,"No 'grand' COVID-19 reopening yet, says Tam"
