,crawl_date,domain,url,mime_type_web_server,mime_type_tika,language,content
21082,20200515,tripadvisor.com,https://www.tripadvisor.com/Tourism-g499288-Port_Colborne_Ontario-Vacations.html,text/html,text/html,en,"Port Colborne 2020: Best of Port Colborne, Ontario Tourism - Tripadvisor Post Alerts TripsSign in Explore Port Colborne Hotels Things to Do Restaurants Travel Forums Insurance Flights Vacation Rentals Rental Cars Vacation Packages More Rental Cars Vacation Packages See all photos Canada Ontario Port Colborne Port Colborne Port Colborne TourismPort Colborne HotelsPort Colborne Bed and BreakfastPort Colborne Vacation RentalsPort Colborne Vacation PackagesFlights to Port ColborneThings to Do in Port ColbornePort Colborne Travel ForumPort Colborne PhotosPort Colborne MapPort Colborne Travel GuideHotels All Port Colborne HotelsPort Colborne Hotel DealsLast Minute Hotels in Port ColborneBy Hotel Class 5-stars Hotels in Port Colborne4-stars Hotels in Port Colborne3-stars Hotels in Port ColbornePopular Amenities Pet Friendly Hotels in Port ColbornePort Colborne Hotels with PoolsPopular Port Colborne Categories Port Colborne Pet Friendly MotelsPort Colborne Pet Friendly CampgroundsPort Colborne Family HotelsNear Landmarks Hotels near Port Colborne Port PromenadeHotels near Nickel BeachHotels near The Welland Canals Parkways TrailHotels near The Friendship TrailHotels near Lock 8 Gateway ParkHotels near HH Knoll Lakeview ParkHotels near Pleasant BeachHotels near Sugarloaf Harbour MarinaHotels near Historical and Marine MuseumHotels near Port Colborne LighthousesHotels near Port Colborne Visitor CentreHotels near Centennial ParkHotels near Greater Niagara Circle RouteHotels near O's By the WaterNear Airports Hotels near (YYZ) Pearson Intl AirportHotels near (BUF) Buffalo Niagara Intl AirportHotels near (YTZ) Toronto Island AirportThings to doRestaurantsFlightsVacation RentalsShoppingVacation PackagesCruisesRental Cars Port Colborne Tourism: Best of Port Colborne Start planning for Port Colborne Create a Trip to save and organize all of your travel ideas, and see them on a map Create a Trip Traveler Faves Play Places to see, ways to wander, and signature experiences. The Friendship Trail 46 Reviews The Welland Canals Parkways Trail 47 Reviews Nickel Beach 88 Reviews Lock 8 Gateway Park 36 Reviews Port Colborne Port Promenade 114 Reviews HH Knoll Lakeview Park 34 Reviews Sugarloaf Harbour Marina 26 Reviews Canal Days Marine Heritage Festival 17 Reviews Historical and Marine Museum 17 Reviews Port Colborne Lighthouses 14 Reviews Eat Can't-miss spots to dine, drink, and feast. The Smokin' Buddha 384 Reviews Canalside Restaurant, Inn & Kitchen Store 421 Reviews Minor Fisheries Ltd. 136 Reviews San Marco's Ristorante 155 Reviews Archies Subs & Eatery 84 Reviews The Belmont Bar and Grill 181 Reviews Flying Squirrel Bistro inc. 63 Reviews Melina's Family Restaurant 79 Reviews Tie Pink Restaurant & Tavern 53 Reviews The Garden Houzz 37 Reviews Loved for Cheap eatsSee all Archies Subs & Eatery 84 Reviews Melina's Family Restaurant 79 Reviews Breakfast Barn Diner 42 Reviews The Saucy Pot 21 Reviews $USD United States © 2020 TripAdvisor LLC All rights reserved. Terms of UsePrivacy and Cookies StatementSite MapHow the site works * TripAdvisor LLC is not a booking agent and does not charge any service fees to users of our site... more TripAdvisor LLC is not responsible for content on external web sites. Taxes, fees not included for deals content."
21088,20200515,tripadvisor.com,https://www.tripadvisor.com/,text/html,text/html,en,"Tripadvisor: Read Reviews, Compare Prices & Book Post Alerts TripsSign in Hotels Things to Do Restaurants Write a review Travel Forums Insurance Flights Cruises Vacation Rentals Rental Cars Vacation Packages Travelers' Choice Airlines Road Trips Help Center More Cruises Vacation Rentals Rental Cars Vacation Packages Travelers' Choice Airlines Road Trips Help Center Find the good out there. Dream, Plan, Travel Support the restaurants you want to visit. Buy a gift card Relive your travel experiences. Write a review Save and map your future travel ideas. Start a Trip Traveler Guides By Clara S Top Restaurants Around the Globe are Delivering Just because you're stuck at home doesn't mean you can't indulge in the world's finest food. From Austin to Sydney, these next-level restaurants are serving menus you can enjoy in your PJs. 32 items By Travel Babbo Our Favorite Places to Get the Kids Outside We've traveled to 62 countries with our kids and have spent a lot of time outdoors, finding the very coolest adventures that we can. These are our favorite places to hike, go kayaking, watch the stars, head out on horseback, run down sand dunes, and belly slide with penguins. 24 items By Meagan America's most beautiful national parks Some of the most beautiful places in the world are right here in America. So, when it's time to hit the road again, these stunning national parks are your best bet for seeing something truly unforgettable, yet close(ish) to home. 📷: @JacobJolibois 22 items Dream your next trip Trending destinations New York City, NY Singapore, Singapore Rome, Italy Paris, France Barcelona, Spain Tokyo, Japan London, UK 2020 Travelers' Choice AwardsSee the winners About Tripadvisor About Us Press Careers Investor Relations Content Integrity Explore Write a review Join Travelers' Choice Insurance GreenLeaders Blog Help Center Do Not Sell My Personal Information Do Business With Us Owners Business Advantage Sponsored Placements Advertise with Us Become an Affiliate Get The App iPhone App Android App Tripadvisor Sites Discover your dream destination with Jetsetter See expert hotel photos on Oyster.com Book the best restaurants with TheFork Book tours and attraction tickets on Viator Read cruise reviews on Cruise Critic Read travel guides at SmarterTravel Get airline seating charts on Seat Guru Find airfare deals at Airfarewatchdog Find vacation rentals on FlipKey Search for holiday rentals on Holiday Lettings Find a vacation home on Vacation Home Rentals Plan a family vacation on Family Vacation Critic $USD United States © 2020 TripAdvisor LLC All rights reserved. Terms of UsePrivacy and Cookies StatementSite MapHow the site works * TripAdvisor LLC is not a booking agent and does not charge any service fees to users of our site... more TripAdvisor LLC is not responsible for content on external web sites. Taxes, fees not included for deals content."
56490,20200522,tripadvisor.com,https://www.tripadvisor.com/Tourism-g499288-Port_Colborne_Ontario-Vacations.html,text/html,text/html,en,"Port Colborne 2020: Best of Port Colborne, Ontario Tourism - Tripadvisor Post Alerts TripsSign in Explore Port Colborne Hotels Things to Do Restaurants Travel Forums Insurance Flights Vacation Rentals Rental Cars Vacation Packages More Rental Cars Vacation Packages See all photos Canada Ontario Port Colborne Port Colborne Port Colborne TourismPort Colborne HotelsPort Colborne Bed and BreakfastPort Colborne Vacation RentalsPort Colborne Vacation PackagesFlights to Port ColborneThings to Do in Port ColbornePort Colborne Travel ForumPort Colborne PhotosPort Colborne MapPort Colborne Travel GuideHotels All Port Colborne HotelsPort Colborne Hotel DealsLast Minute Hotels in Port ColborneBy Hotel Class 5-stars Hotels in Port Colborne4-stars Hotels in Port Colborne3-stars Hotels in Port ColbornePopular Amenities Pet Friendly Hotels in Port ColbornePort Colborne Hotels with PoolsPopular Port Colborne Categories Port Colborne Pet Friendly MotelsPort Colborne Pet Friendly CampgroundsPort Colborne Family HotelsNear Landmarks Hotels near Port Colborne Port PromenadeHotels near Nickel BeachHotels near The Welland Canals Parkways TrailHotels near The Friendship TrailHotels near Lock 8 Gateway ParkHotels near HH Knoll Lakeview ParkHotels near Pleasant BeachHotels near Sugarloaf Harbour MarinaHotels near Historical and Marine MuseumHotels near Port Colborne LighthousesHotels near Port Colborne Visitor CentreHotels near Centennial ParkHotels near Greater Niagara Circle RouteHotels near O's By the WaterNear Airports Hotels near (YYZ) Pearson Intl AirportHotels near (BUF) Buffalo Niagara Intl AirportHotels near (YTZ) Toronto Island AirportThings to doRestaurantsFlightsVacation RentalsShoppingVacation PackagesCruisesRental Cars Port Colborne Tourism: Best of Port Colborne Start planning for Port Colborne Create a Trip to save and organize all of your travel ideas, and see them on a map Create a Trip Traveler Faves Play Places to see, ways to wander, and signature experiences. The Friendship Trail 46 Reviews The Welland Canals Parkways Trail 47 Reviews Nickel Beach 88 Reviews Lock 8 Gateway Park 36 Reviews Port Colborne Port Promenade 114 Reviews HH Knoll Lakeview Park 34 Reviews Sugarloaf Harbour Marina 26 Reviews Canal Days Marine Heritage Festival 17 Reviews Historical and Marine Museum 17 Reviews Port Colborne Lighthouses 14 Reviews Eat Can't-miss spots to dine, drink, and feast. The Smokin' Buddha 384 Reviews Canalside Restaurant, Inn & Kitchen Store 421 Reviews Minor Fisheries Ltd. 136 Reviews San Marco's Ristorante 155 Reviews Archies Subs & Eatery 84 Reviews The Belmont Bar and Grill 181 Reviews Flying Squirrel Bistro inc. 63 Reviews Melina's Family Restaurant 79 Reviews Tie Pink Restaurant & Tavern 53 Reviews The Garden Houzz 37 Reviews Loved for Cheap eatsSee all Archies Subs & Eatery 84 Reviews Melina's Family Restaurant 79 Reviews Breakfast Barn Diner 42 Reviews The Saucy Pot 21 Reviews $USD United States © 2020 TripAdvisor LLC All rights reserved. Terms of UsePrivacy and Cookies StatementSite MapHow the site works * TripAdvisor LLC is not a booking agent and does not charge any service fees to users of our site... more TripAdvisor LLC is not responsible for content on external web sites. Taxes, fees not included for deals content."
56502,20200522,tripadvisor.com,https://www.tripadvisor.com/,text/html,text/html,en,"Tripadvisor: Read Reviews, Compare Prices & Book Post Alerts TripsSign in Hotels Things to Do Restaurants Write a review Travel Forums Insurance Flights Cruises Vacation Rentals Rental Cars Vacation Packages Travelers' Choice Airlines Road Trips Help Center More Airlines Cruises Help Center Rental Cars Road Trips Travelers' Choice Vacation Packages Vacation Rentals Find the good out there. Dream, Plan, Travel Support the restaurants you want to visit. Buy a gift card Relive your travel experiences. Write a review Save and map your future travel ideas. Start a Trip Let Your Taste Buds Travel Local restaurants offering delivery or takeoutSee all Pacific Catch 993 Reviews Za Pizza 545 Reviews Don Pisto's 264 Reviews Curry Leaf Restaurant 231 Reviews Veganburg 139 Reviews Hot Spud 267 Reviews Local restaurants offering delivery or takeout Pacific Catch 993 Reviews Za Pizza 545 Reviews Don Pisto's 264 Reviews Curry Leaf Restaurant 231 Reviews Veganburg 139 Reviews Hot Spud 267 Reviews Traveler Guides By Clara S Top Restaurants Around the Globe are Delivering Just because you're stuck at home doesn't mean you can't indulge in the world's finest food. From Austin to Sydney, these next-level restaurants are serving menus you can enjoy in your PJs. 32 items By Travel Babbo Our Favorite Places to Get the Kids Outside We've traveled to 62 countries with our kids and have spent a lot of time outdoors, finding the very coolest adventures that we can. These are our favorite places to hike, go kayaking, watch the stars, head out on horseback, run down sand dunes, and belly slide with penguins. 24 items By Meagan America's most beautiful national parks Some of the most beautiful places in the world are right here in America. So, when it's time to hit the road again, these stunning national parks are your best bet for seeing something truly unforgettable, yet close(ish) to home. 📷: @JacobJolibois 22 items Dream your next trip Weekend getaways from San Francisco Avila Beach, CA Calistoga, CA Cambria, CA Carmel, CA Monterey, CA Napa, CA Pismo Beach, CA Sacramento, CA San Jose, CA San Luis Obispo, CA Destinations travelers love New York City, NY Singapore, Singapore Rome, Italy Paris, France Barcelona, Spain Tokyo, Japan London, UK 2020 Travelers' Choice AwardsSee the winners About Tripadvisor About Us Press Careers Investor Relations Content Integrity Explore Write a review Join Travelers' Choice Insurance GreenLeaders Blog Help Center Do Not Sell My Personal Information Do Business With Us Owners Business Advantage Sponsored Placements Advertise with Us Become an Affiliate Get The App iPhone App Android App Tripadvisor Sites Discover your dream destination with Jetsetter See expert hotel photos on Oyster.com Book the best restaurants with TheFork Book tours and attraction tickets on Viator Read cruise reviews on Cruise Critic Read travel guides at SmarterTravel Get airline seating charts on Seat Guru Find airfare deals at Airfarewatchdog Find vacation rentals on FlipKey Search for holiday rentals on Holiday Lettings Find a vacation home on Vacation Home Rentals Plan a family vacation on Family Vacation Critic $USD United States © 2020 TripAdvisor LLC All rights reserved. Terms of UsePrivacy and Cookies StatementSite MapHow the site works * TripAdvisor LLC is not a booking agent and does not charge any service fees to users of our site... more TripAdvisor LLC is not responsible for content on external web sites. Taxes, fees not included for deals content."
57596,20200529,tripadvisor.com,https://www.tripadvisor.com/Tourism-g499288-Port_Colborne_Ontario-Vacations.html,text/html,text/html,en,"Port Colborne 2020: Best of Port Colborne, Ontario Tourism - Tripadvisor Post Alerts TripsSign in Explore Port Colborne Hotels Things to Do Restaurants Travel Forums Insurance Flights Vacation Rentals Rental Cars Vacation Packages More Rental Cars Vacation Packages See all photos Canada Ontario Port Colborne Port Colborne Port Colborne TourismPort Colborne HotelsPort Colborne Bed and BreakfastPort Colborne Vacation RentalsPort Colborne Vacation PackagesFlights to Port ColborneThings to Do in Port ColbornePort Colborne Travel ForumPort Colborne PhotosPort Colborne MapPort Colborne Travel GuideHotels All Port Colborne HotelsPort Colborne Hotel DealsLast Minute Hotels in Port ColborneBy Hotel Type Port Colborne MotelsPort Colborne CampgroundsPort Colborne Family HotelsBy Hotel Class 5-stars Hotels in Port Colborne4-stars Hotels in Port Colborne3-stars Hotels in Port ColbornePopular Amenities Pet Friendly Hotels in Port ColbornePort Colborne Hotels with PoolsPopular Port Colborne Categories Port Colborne Pet Friendly MotelsPort Colborne Pet Friendly CampgroundsNear Landmarks Hotels near Port Colborne Port PromenadeHotels near Nickel BeachHotels near The Welland Canals Parkways TrailHotels near The Friendship TrailHotels near Lock 8 Gateway ParkHotels near HH Knoll Lakeview ParkHotels near Pleasant BeachHotels near Sugarloaf Harbour MarinaHotels near Historical and Marine MuseumHotels near Port Colborne LighthousesHotels near Port Colborne Visitor CentreHotels near Centennial ParkHotels near Greater Niagara Circle RouteHotels near O's By the WaterNear Airports Hotels near (YYZ) Pearson Intl AirportHotels near (BUF) Buffalo Niagara Intl AirportHotels near (YTZ) Toronto Island AirportThings to doRestaurantsFlightsVacation RentalsShoppingVacation PackagesCruisesRental Cars Port Colborne Tourism: Best of Port Colborne Start planning for Port Colborne Create a Trip to save and organize all of your travel ideas, and see them on a map Create a Trip Essential Port Colborne Go Play Places to see, ways to wander, and signature experiences. The Friendship Trail 46 Reviews The Welland Canals Parkways Trail 47 Reviews Nickel Beach 88 Reviews Lock 8 Gateway Park 36 Reviews Port Colborne Port Promenade 114 Reviews HH Knoll Lakeview Park 34 Reviews Sugarloaf Harbour Marina 26 Reviews Canal Days Marine Heritage Festival 17 Reviews Historical and Marine Museum 17 Reviews Port Colborne Lighthouses 14 Reviews Go Eat Can't-miss spots to dine, drink, and feast. The Smokin' Buddha 384 Reviews Canalside Restaurant, Inn & Kitchen Store 421 Reviews Minor Fisheries Ltd. 136 Reviews San Marco's Ristorante 155 Reviews Archies Subs & Eatery 85 Reviews The Belmont Bar and Grill 181 Reviews Flying Squirrel Bistro inc. 63 Reviews Melina's Family Restaurant 79 Reviews Tie Pink Restaurant & Tavern 53 Reviews The Garden Houzz 37 Reviews More Port Colborne Picks Cheap eatsSee all Archies Subs & Eatery 85 Reviews Melina's Family Restaurant 79 Reviews Breakfast Barn Diner 42 Reviews The Saucy Pot 21 Reviews $USD United States © 2020 TripAdvisor LLC All rights reserved. Terms of UsePrivacy and Cookies StatementSite MapHow the site works * TripAdvisor LLC is not a booking agent and does not charge any service fees to users of our site... more TripAdvisor LLC is not responsible for content on external web sites. Taxes, fees not included for deals content."
57623,20200529,tripadvisor.com,https://www.tripadvisor.com/,text/html,text/html,en,"Tripadvisor: Read Reviews, Compare Prices & Book Post Alerts TripsSign in Hotels Things to Do Restaurants Write a review Travel Forums Insurance Flights Cruises Vacation Rentals Rental Cars Vacation Packages Travelers' Choice Airlines Road Trips Help Center More Airlines Cruises Help Center Rental Cars Road Trips Travelers' Choice Vacation Packages Vacation Rentals Find the good out there. Support the Good Out There Support the restaurants you want to visit. Buy a gift card Relive your travel experiences. Write a review Save and map your future travel ideas. Start a Trip Let Your Taste Buds Travel Local restaurants offering delivery or takeoutSee all Pacific Catch 993 Reviews Za Pizza 545 Reviews Don Pisto's 264 Reviews Curry Leaf Restaurant 231 Reviews Veganburg 139 Reviews Il Casaro Pizzeria and Mozzarella Bar 862 Reviews Local restaurants offering delivery or takeout Pacific Catch 993 Reviews Za Pizza 545 Reviews Don Pisto's 264 Reviews Curry Leaf Restaurant 231 Reviews Veganburg 139 Reviews Il Casaro Pizzeria and Mozzarella Bar 862 Reviews Traveler Guides By Clara S Top Restaurants Around the Globe are Delivering Just because you're stuck at home doesn't mean you can't indulge in the world's finest food. From Austin to Sydney, these next-level restaurants are serving menus you can enjoy in your PJs. 32 items By Travel Babbo Our Favorite Places to Get the Kids Outside We've traveled to 62 countries with our kids and have spent a lot of time outdoors, finding the very coolest adventures that we can. These are our favorite places to hike, go kayaking, watch the stars, head out on horseback, run down sand dunes, and belly slide with penguins. 24 items By Meagan America's most beautiful national parks Some of the most beautiful places in the world are right here in America. So, when it's time to hit the road again, these stunning national parks are your best bet for seeing something truly unforgettable, yet close(ish) to home. 📷: @JacobJolibois 22 items Dream your next trip Weekend getaways from San Francisco Avila Beach, CA Calistoga, CA Cambria, CA Carmel, CA Monterey, CA Morro Bay, CA Napa, CA Pismo Beach, CA Sacramento, CA San Jose, CA Destinations travelers love New York City, NY Singapore, Singapore Rome, Italy Paris, France Barcelona, Spain Tokyo, Japan London, UK 2020 Travelers' Choice AwardsSee the winners About Tripadvisor About Us Press Careers Investor Relations Content Integrity Explore Write a review Join Travelers' Choice Insurance GreenLeaders Blog Help Center Do Not Sell My Personal Information Do Business With Us Owners Business Advantage Sponsored Placements Advertise with Us Become an Affiliate Get The App iPhone App Android App Tripadvisor Sites Discover your dream destination with Jetsetter See expert hotel photos on Oyster.com Book the best restaurants with TheFork Book tours and attraction tickets on Viator Read cruise reviews on Cruise Critic Read travel guides at SmarterTravel Get airline seating charts on Seat Guru Find airfare deals at Airfarewatchdog Find vacation rentals on FlipKey Search for holiday rentals on Holiday Lettings Find a vacation home on Vacation Home Rentals Plan a family vacation on Family Vacation Critic $USD United States © 2020 TripAdvisor LLC All rights reserved. Terms of UsePrivacy and Cookies StatementSite MapHow the site works * TripAdvisor LLC is not a booking agent and does not charge any service fees to users of our site... more TripAdvisor LLC is not responsible for content on external web sites. Taxes, fees not included for deals content."
69948,20200529,tripadvisor.com,https://www.tripadvisor.com/Tourism-g499288-Port_Colborne_Ontario-Vacations.html,text/html,text/html,en,"Port Colborne 2020: Best of Port Colborne, Ontario Tourism - Tripadvisor Post Alerts TripsSign in Explore Port Colborne Hotels Things to Do Restaurants Travel Forums Insurance Flights Vacation Rentals Rental Cars Vacation Packages More Rental Cars Vacation Packages See all photos Canada Ontario Port Colborne Port Colborne Port Colborne TourismPort Colborne HotelsPort Colborne Bed and BreakfastPort Colborne Vacation RentalsPort Colborne Vacation PackagesFlights to Port ColborneThings to Do in Port ColbornePort Colborne Travel ForumPort Colborne PhotosPort Colborne MapPort Colborne Travel GuideHotels All Port Colborne HotelsPort Colborne Hotel DealsLast Minute Hotels in Port ColborneBy Hotel Type Port Colborne MotelsPort Colborne CampgroundsPort Colborne Family HotelsBy Hotel Class 5-stars Hotels in Port Colborne4-stars Hotels in Port Colborne3-stars Hotels in Port ColbornePopular Amenities Pet Friendly Hotels in Port ColbornePort Colborne Hotels with PoolsPopular Port Colborne Categories Port Colborne Pet Friendly MotelsPort Colborne Pet Friendly CampgroundsNear Landmarks Hotels near Port Colborne Port PromenadeHotels near Nickel BeachHotels near The Welland Canals Parkways TrailHotels near The Friendship TrailHotels near Lock 8 Gateway ParkHotels near HH Knoll Lakeview ParkHotels near Pleasant BeachHotels near Sugarloaf Harbour MarinaHotels near Historical and Marine MuseumHotels near Port Colborne LighthousesHotels near Port Colborne Visitor CentreHotels near Centennial ParkHotels near Greater Niagara Circle RouteHotels near O's By the WaterNear Airports Hotels near (YYZ) Pearson Intl AirportHotels near (BUF) Buffalo Niagara Intl AirportHotels near (YTZ) Toronto Island AirportThings to doRestaurantsFlightsVacation RentalsShoppingVacation PackagesCruisesRental Cars Port Colborne Tourism: Best of Port Colborne Start planning for Port Colborne Create a Trip to save and organize all of your travel ideas, and see them on a map Create a Trip Essential Port Colborne Go Play Places to see, ways to wander, and signature experiences. The Friendship Trail 46 Reviews The Welland Canals Parkways Trail 47 Reviews Nickel Beach 88 Reviews Lock 8 Gateway Park 36 Reviews Port Colborne Port Promenade 114 Reviews HH Knoll Lakeview Park 34 Reviews Sugarloaf Harbour Marina 26 Reviews Canal Days Marine Heritage Festival 17 Reviews Historical and Marine Museum 17 Reviews Port Colborne Lighthouses 14 Reviews Go Eat Can't-miss spots to dine, drink, and feast. The Smokin' Buddha 384 Reviews Canalside Restaurant, Inn & Kitchen Store 421 Reviews Minor Fisheries Ltd. 136 Reviews San Marco's Ristorante 155 Reviews Archies Subs & Eatery 85 Reviews The Belmont Bar and Grill 181 Reviews Flying Squirrel Bistro inc. 63 Reviews Melina's Family Restaurant 79 Reviews Tie Pink Restaurant & Tavern 53 Reviews The Garden Houzz 37 Reviews More Port Colborne Picks Cheap eatsSee all Archies Subs & Eatery 85 Reviews Melina's Family Restaurant 79 Reviews Breakfast Barn Diner 42 Reviews The Saucy Pot 21 Reviews $USD United States © 2020 TripAdvisor LLC All rights reserved. Terms of UsePrivacy and Cookies StatementSite MapHow the site works * TripAdvisor LLC is not a booking agent and does not charge any service fees to users of our site... more TripAdvisor LLC is not responsible for content on external web sites. Taxes, fees not included for deals content."
